user_num_places_rated,user_num_following,user_url,beer_num_ratings,user_num_friends,user_num_breweries_rated,review_palate_score,review_taste_score,user_num_ratings,review_ratings_blob,review_aroma_score,user_num_countries_rated,user_id,review_avg_score,beer_global_style_score,beer_weighted_avg_score,beer_brewer_name,review_overall_score,user_location,review_appearance_score,beer_num_calories,beer_style,beer_url,review_blob,beer_global_score,user_name,beer_location,beer_ABV,beer_name
1,0,http://www.ratebeer.com/user/104213/beer-ratings/,490,3,271,4,8,924,3.8 AROMA 8/10 APPEARANCE 3/5 TASTE 8/10 PALATE 4/5 OVERALL 15/20arone12(924),8,35,104213,3.8,99.894,4.023422,Thornbridge,15, Maryland,3,490,Traditional Ale,http://www.ratebeer.com/beer/thornbridge-hall-bracia/97342/104213/,Pours a black color with a slight burnt coffee aroma. Taste is dry and butter. Slight fruityness at the very beginning that disappears quickly. Pretty good beer! ,99.736,arone12,England,10%,Thornbridge Hall Bracia
1,0,http://www.ratebeer.com/user/104213/beer-ratings/,38,3,271,3,7,924,3.2 AROMA 6/10 APPEARANCE 2/5 TASTE 7/10 PALATE 3/5 OVERALL 14/20arone12(924),6,35,104213,3.2,42.803,3.247218,DuClaw Brewing Company,14, Maryland,2,132,Session IPA,http://www.ratebeer.com/beer/duclaw-oz-fractional-ipa/211111/104213/,Yellow in color. Super duper white head. Tastes like a Luke warm sunrise. Hopalicious. Bam ,69.909,arone12,Maryland,4.4%,DuClaw Oz Fractional IPA
1,0,http://www.ratebeer.com/user/104213/beer-ratings/,216,3,271,4,6,924,3.6 AROMA 7/10 APPEARANCE 4/5 TASTE 6/10 PALATE 4/5 OVERALL 15/20arone12(924),7,35,104213,3.6,63.577,3.643008,Laughing Dog Brewing,15, Maryland,4,216,Imperial Porter,http://www.ratebeer.com/beer/laughing-dog-anubis-imperial-coffee-porter/140139/104213/,Smells a bit like coffee which was expected. Taste is a little sweet like a fruit (plum or date) or some other nonsense like that. Aftertaste is dry and coffee like.  ,95.199,arone12,Idaho,8%,Laughing Dog Anubis Imperial Coffee Porter
1,0,http://www.ratebeer.com/user/104213/beer-ratings/,166,3,271,4,8,924,4 AROMA 9/10 APPEARANCE 4/5 TASTE 8/10 PALATE 4/5 OVERALL 15/20arone12(924),9,35,104213,4,93.908,3.926949,Mikkeller,15, Maryland,4,166,Imperial Stout,http://www.ratebeer.com/beer/mikkeller-beer-geek-brunch-weasel-highland-edition/110814/104213/,Pours a super dark black color like used motor oil.  Dark brown head similar to the color of a chestnut.  Smell some coffee and whiskey!  Some chocolate in the aroma as well!  Taste is a bit chocolatey.  Has the aftertaste of whiskey.  Well rounded beer. ,99.524,arone12,Denmark,10.9%,Mikkeller Beer Geek Brunch Weasel (Highland Edition) 
1,0,http://www.ratebeer.com/user/104213/beer-ratings/,792,3,271,3,7,924,3.5 AROMA 7/10 APPEARANCE 5/5 TASTE 7/10 PALATE 3/5 OVERALL 13/20arone12(924),7,35,104213,3.5,87.891,3.268376,Dogfish Head Brewery,13, Maryland,5,792,Fruit Beer,http://www.ratebeer.com/beer/dogfish-head-sixty-one/200263/104213/,"It pours purple!  Awesome  Small to medium sized reddish purple head.  Must be the grapes, eh?  Smells of grapes and hops.  Taste is similar to what I just said.  This beer surprised me with its goodness. ",63.716,arone12,Delaware,6.5%,Dogfish Head Sixty-One
