user_num_places_rated,user_num_following,user_url,beer_num_ratings,user_num_friends,user_num_breweries_rated,review_palate_score,review_taste_score,user_num_ratings,review_ratings_blob,review_aroma_score,user_num_countries_rated,user_id,review_avg_score,beer_global_style_score,beer_weighted_avg_score,beer_brewer_name,review_overall_score,user_location,review_appearance_score,beer_num_calories,beer_style,beer_url,review_blob,beer_global_score,user_name,beer_location,beer_ABV,beer_name
0,0,http://www.ratebeer.com/user/104399/beer-ratings/,797,1,60,3,8,117,3.8 AROMA 7/10 APPEARANCE 4/5 TASTE 8/10 PALATE 3/5 OVERALL 16/20Xenon(117),7,6,104399,3.8,98.727,3.797121,Dogfish Head Brewery,16," Cary, North Carolina",4,797,India Pale Ale (IPA),http://www.ratebeer.com/beer/dogfish-head-75-minute-ipa-cask-bottle/101034/104399/,"UPDATED: JUL 11, 2014",98.298,Xenon,Delaware,7.5%,Dogfish Head 75 Minute IPA (Cask/Bottle)
0,0,http://www.ratebeer.com/user/104399/beer-ratings/,3,1,60,3,7,117,3.5 AROMA 6/10 APPEARANCE 3/5 TASTE 7/10 PALATE 3/5 OVERALL 16/20Xenon(117),6,6,104399,3.5,,3.018053,Sebago Brewing Company,16," Cary, North Carolina",3,,Doppelbock,http://www.ratebeer.com/beer/sebago-doppelbock/253685/104399/,I appreciate the breadiness. Not as aromatic as Id have expected. A bit of a light doppelbock in color and flavor. Malt sweetness that has a peak mid taste with a small bit of spice. Medium yeast with a strongly dominant bread flavor. Very minimal bitterness. Id buy this if it were on sale near me but the sweetness was both good and detracting from it ,,Xenon,Maine,,Sebago Doppelbock
0,0,http://www.ratebeer.com/user/104399/beer-ratings/,894,1,60,3,5,117,2.9 AROMA 5/10 APPEARANCE 3/5 TASTE 5/10 PALATE 3/5 OVERALL 13/20Xenon(117),5,6,104399,2.9,69.518,3.443671,Blue Point Brewing (AB InBev),13," Cary, North Carolina",3,894,India Pale Ale (IPA),http://www.ratebeer.com/beer/blue-point-hoptical-illusion/39047/104399/,"UPDATED: JUN 13, 2014",84.908,Xenon,New York,6.8%,Blue Point Hoptical Illusion
0,0,http://www.ratebeer.com/user/104399/beer-ratings/,1137,1,60,4,8,117,4.1 AROMA 8/10 APPEARANCE 4/5 TASTE 8/10 PALATE 4/5 OVERALL 17/20Xenon(117),8,6,104399,4.1,98.993,3.852425,AleSmith Brewing Company,17," Cary, North Carolina",4,1137,Belgian Strong Ale,http://www.ratebeer.com/beer/alesmith-grand-cru/2488/104399/,Had on tap as well as a bottle. One thing I like about this beer is that the Belgian yeast survives the High abv which is something I really appreciate. a bit fruity without being citrus like a pale ale. Alcohol warms but does not burn. Caramel Sweet from start to finish  ,98.887,Xenon,California,10%,AleSmith Grand Cru
0,0,http://www.ratebeer.com/user/104399/beer-ratings/,2142,1,60,4,7,117,3.7 AROMA 7/10 APPEARANCE 3/5 TASTE 7/10 PALATE 4/5 OVERALL 16/20Xenon(117),7,6,104399,3.7,95.847,3.823214,Anchor Brewing Company,16," Cary, North Carolina",3,2142,Barley Wine,http://www.ratebeer.com/beer/anchor-old-foghorn-ale/4728/104399/,First barley wine in a long time at the brass tap on draft. Such caramel sweetness with hop balance. I miss this style. Mildly dank with some licorice. Not boozy at all. Not as good as Bigfoot but a great reintroduction. Reddish brown with mild lace ,98.566,Xenon,California,8.8%,Anchor Old Foghorn Ale
0,0,http://www.ratebeer.com/user/104399/beer-ratings/,383,1,60,4,7,117,3.8 AROMA 7/10 APPEARANCE 4/5 TASTE 7/10 PALATE 4/5 OVERALL 16/20Xenon(117),7,6,104399,3.8,96.308,3.512929,Brewery Ommegang  (Duvel-Moortgat),16," Cary, North Carolina",4,383,Spice/Herb/Vegetable,http://www.ratebeer.com/beer/ommegang-game-of-thrones-3--fire-and-blood/258696/104399/,Bought it as a joke but it turned out pretty good. Nice and spicy. Rather bitter than what I expected. Quite fruity tartbess but not really citrusy. I like ommegang s yeast profile as usual..very bready.. The numbers speak for the rest.  ,89.726,Xenon,New York,6.8%,Ommegang Game of Thrones #3 - Fire and Blood
0,0,http://www.ratebeer.com/user/104399/beer-ratings/,1410,1,60,3,8,117,3.9 AROMA 7/10 APPEARANCE 4/5 TASTE 8/10 PALATE 3/5 OVERALL 17/20Xenon(117),7,6,104399,3.9,99.683,3.861197,De Dolle Brouwers,17," Cary, North Carolina",4,1410,Abbey Tripel,http://www.ratebeer.com/beer/de-dolle-dulle-teve-10-mad-bitch/6875/104399/,Hazy amber color with heavy sedimentation. Very malty which is noticeable from the very beginning. Yeast flavor doesnt emerge until beer warms up butonce it does is very smooth. Caramel sweetness and fresh bread dominate the aroma. This us one if the beers that has more complexity in the flavor than the nose. A bit of hop bitterness and booze burn in the middle. Finished sweet and yeasty. Good beer and not God tier thoigh  ,98.94,Xenon,Belgium,10%,De Dolle Dulle Teve 10 (Mad Bitch)
0,0,http://www.ratebeer.com/user/104399/beer-ratings/,3310,1,60,4,9,117,4.4 AROMA 9/10 APPEARANCE 4/5 TASTE 9/10 PALATE 4/5 OVERALL 18/20Xenon(117),9,6,104399,4.4,98.993,4.150541,Founders Brewing Company,18," Cary, North Carolina",4,3310,Imperial Stout,http://www.ratebeer.com/beer/founders-breakfast-stout/14956/104399/,Now this is what I am talking about. This beer is everything I like about stouts. Each breakfast flavor promised can be easily found and savored. Smells like brown chocolate and cappucino. i found the oats in there as well. No head in my bottle at all though. I could smell that cinnamon all day. Mild roastiness to allow for the chocolate to come through. ,99.947,Xenon,Michigan,8.3%,Founders Breakfast Stout
0,0,http://www.ratebeer.com/user/104399/beer-ratings/,728,1,60,3,7,117,3.7 AROMA 7/10 APPEARANCE 3/5 TASTE 7/10 PALATE 3/5 OVERALL 17/20Xenon(117),7,6,104399,3.7,98.028,3.857392,Harviestoun,17," Cary, North Carolina",3,728,Old Ale,http://www.ratebeer.com/beer/harviestoun-ola-dubh-16-year-old/84058/104399/,"Really opened up with temperature. The barrel and scotch flavors were hard to spot but opened up later. As a new scotch drinker, I appreciate those notes. It seems this is more of a porter than a stout, and unfortunately, I feel that porters are just worse stouts. Chocolatey nose Licorice sweetness, no roast, and a slightly spicy mouthfeel despite no carbonation or head, which was pretty cool. Dark as night color.  ",98.94,Xenon,Scotland,8%,Harviestoun Ola Dubh (16 Year Old)
0,0,http://www.ratebeer.com/user/104399/beer-ratings/,1659,1,60,5,10,117,4.8 AROMA 10/10 APPEARANCE 4/5 TASTE 10/10 PALATE 5/5 OVERALL 19/20Xenon(117),10,6,104399,4.8,99.577,4.066717,Stone Brewing,19," Cary, North Carolina",4,1659,Imperial IPA,http://www.ratebeer.com/beer/stone-enjoy-by-ipa/183117/104399/,On tap on 4/12 for the 420 dated beer. This one delivers on the hype for me. Better than hopslam. One of if not the best smelling hoppy beers Ive had. It feels like my nose is inside a pine tree. Dank and mossy. Its bitterness is almost like being salty like ocean water. Interesting touch. Doesnt really carry the stone house flavor as much as I thought but delivers in other ways.Sour notes of Orange citrus immediately after the barnyard middle flavors. Burns the mouth more than expected in a good way. Hard to drink quickly. stayed carbonated abd laced the whole time ,99.788,Xenon,California,9.4%,Stone Enjoy By IPA
0,0,http://www.ratebeer.com/user/104399/beer-ratings/,2463,1,60,2,5,117,2.9 AROMA 5/10 APPEARANCE 3/5 TASTE 5/10 PALATE 2/5 OVERALL 14/20Xenon(117),5,6,104399,2.9,98.028,3.783486,Unibroue (Sapporo),14," Cary, North Carolina",3,2463,Belgian Strong Ale,http://www.ratebeer.com/beer/unibroue-maudite/1921/104399/,"If Im honest, this is the first letdown from the unibroue beers that I have tried. Maybe its the bottle I got? No head at all. Had a bit of an underwhelming mouthfeel and the taste felt like it took awhile to kick in with each sip. Didnt taste strong. Some lemony citrus that I found that was pretty cool, but all around this is the weakest unibroue so far. Still decent, but worse than the others I will rerate with another bottle whenever ",98.136,Xenon,Canada,8%,Unibroue Maudite
0,0,http://www.ratebeer.com/user/104399/beer-ratings/,2004,1,60,3,7,117,3.7 AROMA 8/10 APPEARANCE 3/5 TASTE 7/10 PALATE 3/5 OVERALL 16/20Xenon(117),8,6,104399,3.7,98.082,4.096057,Founders Brewing Company,16," Cary, North Carolina",3,2004,Imperial Stout,http://www.ratebeer.com/beer/founders-imperial-stout/5933/104399/,"This was good, but not as good as I expected. Boozy for sure, but the malty characters Ive come to expect from I stouts was a bit subdued imo. Maybe my nose could be a little bit less stuffy though. Nothing really defining that I can find, but a pretty well rounded brew, albeit underwhelming at times. I will have to try again sometime ",99.841,Xenon,Michigan,10.5%,Founders Imperial Stout
