user_num_places_rated,user_num_following,user_url,beer_num_ratings,user_num_friends,user_num_breweries_rated,review_palate_score,review_taste_score,user_num_ratings,review_ratings_blob,review_aroma_score,user_num_countries_rated,user_id,review_avg_score,beer_global_style_score,beer_weighted_avg_score,beer_brewer_name,review_overall_score,user_location,review_appearance_score,beer_num_calories,beer_style,beer_url,review_blob,beer_global_score,user_name,beer_location,beer_ABV,beer_name
23,9,http://www.ratebeer.com/user/105307/beer-ratings/,55,3,215,4,7,588,3.3 AROMA 6/10 APPEARANCE 4/5 TASTE 7/10 PALATE 4/5 OVERALL 12/20Vir4030(588),6,16,105307,3.3,90.556,3.318569,Wisconsin Dells Brewing Co.,12," Chicago, Illinois",4,165,Amber Ale,http://www.ratebeer.com/beer/wisconsin-dells-kilbourn-hop-ale/17996/105307/,Cloudy amber thick brown head. Dry hoppy water aroma. Flavor watery hoppy beer. ,71.195,Vir4030,Wisconsin,5.5%,Wisconsin Dells Kilbourn Hop Ale 
23,9,http://www.ratebeer.com/user/105307/beer-ratings/,462,3,215,4,8,588,4.1 AROMA 8/10 APPEARANCE 5/5 TASTE 8/10 PALATE 4/5 OVERALL 16/20Vir4030(588),8,16,105307,4.1,98.513,3.939279,Great Lakes Brewing (Ohio),16," Chicago, Illinois",5,462,Imperial IPA,http://www.ratebeer.com/beer/great-lakes-chillwave-double-ipa/200485/105307/,Pours a light tan with a little head. Aroma is sweet and so is flavor. Nice too. ,99.418,Vir4030,Ohio,9.4%,Great Lakes Chillwave Double IPA
23,9,http://www.ratebeer.com/user/105307/beer-ratings/,888,3,215,4,8,588,3.7 AROMA 6/10 APPEARANCE 4/5 TASTE 8/10 PALATE 4/5 OVERALL 15/20Vir4030(588),6,16,105307,3.7,81.071,3.659858,Brooklyn Brewery,15," Chicago, Illinois",4,888,Imperial IPA,http://www.ratebeer.com/beer/brooklyn-blast/51334/105307/,Light gold with small head. Aroma light a bit sour. Flavor light and watery. Decent. ,95.672,Vir4030,New York,8.4%,Brooklyn Blast!
23,9,http://www.ratebeer.com/user/105307/beer-ratings/,86,3,215,5,8,588,4.3 AROMA 9/10 APPEARANCE 4/5 TASTE 8/10 PALATE 5/5 OVERALL 17/20Vir4030(588),9,16,105307,4.3,97.702,3.737969,Revolution Brewing Company,17," Chicago, Illinois",4,204,India Pale Ale (IPA),http://www.ratebeer.com/beer/revolution-firestone-walker-dos-osos/145166/105307/,Pours slightly foggy olive amber from a bomber. Nice sweet hop aroma. Good flavor nice hops. ,97.592,Vir4030,Illinois,6.8%,Revolution Firestone Walker Dos Osos
23,9,http://www.ratebeer.com/user/105307/beer-ratings/,837,3,215,4,8,588,4.2 AROMA 9/10 APPEARANCE 5/5 TASTE 8/10 PALATE 4/5 OVERALL 16/20Vir4030(588),9,16,105307,4.2,96.761,3.85,Lagunitas Brewing Company (Heineken),16," Chicago, Illinois",5,837,Imperial IPA,http://www.ratebeer.com/beer/lagunitas-a-little-sumpin-extra-ale/109078/105307/,Pours clear orangish with a decent head. Aroma slightly sweet citrus. Flavor is a bit spicy and hoppy. ,98.833,Vir4030,California,8.5%,Lagunitas A Little Sumpin Extra! Ale
