user_num_places_rated,user_num_following,user_url,beer_num_ratings,user_num_friends,user_num_breweries_rated,review_palate_score,review_taste_score,user_num_ratings,review_ratings_blob,review_aroma_score,user_num_countries_rated,user_id,review_avg_score,beer_global_style_score,beer_weighted_avg_score,beer_brewer_name,review_overall_score,user_location,review_appearance_score,beer_num_calories,beer_style,beer_url,review_blob,beer_global_score,user_name,beer_location,beer_ABV,beer_name
20,0,http://www.ratebeer.com/user/109648/beer-ratings/,6,1,115,3,6,227,3.5 AROMA 5/10 APPEARANCE 3/5 TASTE 6/10 PALATE 3/5 OVERALL 18/20egg(227),5,4,109648,3.5,,3.371081,Clown Shoes Beer,18,,3,270,Imperial IPA,http://www.ratebeer.com/beer/clown-shoes-vic-secret-space-cake/382276/109648/,"Bomber on 12/24/15. Pours a clear amber with a frothy white head. Nose is fairly faint. Taste is boozy, orange juice, candied orange peel, malty. Boozy beyond its alcohol. Not super impressed but it&apos;s good I guess. No real nose

---Rated via Beer Buddy for iPhone ",,egg,Massachusetts,9%,Clown Shoes Vic Secret Space Cake
20,0,http://www.ratebeer.com/user/109648/beer-ratings/,64,1,115,3,7,227,4 AROMA 10/10 APPEARANCE 3/5 TASTE 7/10 PALATE 3/5 OVERALL 17/20egg(227),10,4,109648,4,78.93,3.621817,Otter Creek Brewing,17,,3,315,Barley Wine,http://www.ratebeer.com/beer/otter-creek--lawsons-finest-liquids-double-or-nothing/368475/109648/,"Bottle on 12/22/15. Pours dark brown with loose tan head. Fragrant. Nose is super sweet, dark fruit, caramel, banana bread without the banana, raisin, booze. Lots going on. Taste is sweet, banana bread, dark fruit, burnt sugar, yummy. 

---Rated via Beer Buddy for iPhone ",94.47,egg,Vermont,10.5%,Otter Creek / Lawsons Finest Liquids Double or Nothing
20,0,http://www.ratebeer.com/user/109648/beer-ratings/,144,1,115,3,8,227,3.9 AROMA 7/10 APPEARANCE 4/5 TASTE 8/10 PALATE 3/5 OVERALL 17/20egg(227),7,4,109648,3.9,99.947,4.057499,Hill Farmstead Brewery,17,,4,144,India Pale Ale (IPA),http://www.ratebeer.com/beer/grassroots-legitimacy/214350/109648/,"Tap on 12/22/15. Pours a hazy dark straw. Fluffy white head. Nose is citrusy hops, grapefruit, juice. Taste is the same and grass, white pepper. Dry and yummy. 

---Rated via Beer Buddy for iPhone ",99.788,egg,Vermont,6.7%,Grassroots Legitimacy
20,0,http://www.ratebeer.com/user/109648/beer-ratings/,265,1,115,4,8,227,4 AROMA 7/10 APPEARANCE 4/5 TASTE 8/10 PALATE 4/5 OVERALL 17/20egg(227),7,4,109648,4,,4.098222,Hill Farmstead Brewery,17,,4,265,India Pale Ale (IPA),http://www.ratebeer.com/beer/hill-farmstead-susan/191994/109648/,"On tap 12/22/15. Pours a hazy dark straw with a fluffy white head. Nose citrus, melon, tropical, yummy. Taste is the same. Lots of melon, lemon, grass, tropical. Super fluffy. Delicious 

---Rated via Beer Buddy for iPhone ",99.841,egg,Vermont,6.2%,Hill Farmstead Susan
20,0,http://www.ratebeer.com/user/109648/beer-ratings/,27,1,115,4,9,227,4.4 AROMA 8/10 APPEARANCE 5/5 TASTE 9/10 PALATE 4/5 OVERALL 18/20egg(227),8,4,109648,4.4,99.153,3.836965,Hill Farmstead Brewery,18,,5,,India Pale Ale (IPA),http://www.ratebeer.com/beer/hill-farmstead-excursions-5/380914/109648/,"On tap 12/22/15. Pours a hazy light straw. Looks like grapefruit juice. Very much in the New England style. Nose is juicy citrus, grapefruit, lemon. Taste is great. Big, bright, juicy. Grapefruit, lemon, super citrusy and bitter. Some grass. Awesome New England IPAs. So much juicy grapefruit.

---Rated via Beer Buddy for iPhone ",98.727,egg,Vermont,,Hill Farmstead Excursions #5
20,0,http://www.ratebeer.com/user/109648/beer-ratings/,3,1,115,3,7,227,3.3 AROMA 6/10 APPEARANCE 3/5 TASTE 7/10 PALATE 3/5 OVERALL 14/20egg(227),6,4,109648,3.3,,3.074993,Southern Barrel Brewing Company,14,,3,255,Imperial IPA,http://www.ratebeer.com/beer/southern-barrel-slippery-slope-dipa/346363/109648/,"Can on 12/19/15. Pours a slightly hazy light copperish orange. This white head. Nose is citrus and fruit snacks. Taste is the same but oddly with a little bit of cocoa powder. Yummy but not great. Good 6 pack 

---Rated via Beer Buddy for iPhone ",,egg,South Carolina,8.5%,Southern Barrel Slippery Slope DIPA
20,0,http://www.ratebeer.com/user/109648/beer-ratings/,75,1,115,3,7,227,3.7 AROMA 7/10 APPEARANCE 3/5 TASTE 7/10 PALATE 3/5 OVERALL 17/20egg(227),7,4,109648,3.7,77.702,3.644177,Ithaca Beer Company,17,,3,270,Imperial IPA,http://www.ratebeer.com/beer/ithaca-the-creeker/225394/109648/,"Bottle on 12/8/15. Pours a slightly hazy orange copper. Nose is nice, fruit, citrus, heat. Taste is nice, fruity, booze, some caramel sweetness, candied orange. I like it. Good standard dipa

---Rated via Beer Buddy for iPhone ",95.258,egg,New York,9%,Ithaca The Creeker
