user_num_places_rated,user_num_following,user_url,beer_num_ratings,user_num_friends,user_num_breweries_rated,review_palate_score,review_taste_score,user_num_ratings,review_ratings_blob,review_aroma_score,user_num_countries_rated,user_id,review_avg_score,beer_global_style_score,beer_weighted_avg_score,beer_brewer_name,review_overall_score,user_location,review_appearance_score,beer_num_calories,beer_style,beer_url,review_blob,beer_global_score,user_name,beer_location,beer_ABV,beer_name
83,0,http://www.ratebeer.com/user/130676/beer-ratings/,244,0,61,4,5,99,3 AROMA 7/10 APPEARANCE 3/5 TASTE 5/10 PALATE 4/5 OVERALL 11/20left_bank(99),7,10,130676,3,94.222,3.285188,Badische Staatsbrauerei Rothaus,11, Japan                           ,3,244,German Hefeweizen,http://www.ratebeer.com/beer/rothaus-hefeweizen/9284/130676/,"the palate on this hefeweizen is maybe in my top 5(very rich with flavor that stays on your tongue for a while)but i get a medicine type flavor at the end that just did not go down well.
 ",67.803,left_bank,Germany,5.4%,Rothaus Hefeweizen
83,0,http://www.ratebeer.com/user/130676/beer-ratings/,880,0,61,4,8,99,3.8 AROMA 8/10 APPEARANCE 3/5 TASTE 8/10 PALATE 4/5 OVERALL 15/20left_bank(99),8,10,130676,3.8,99.259,3.538226,Brauerei Gebr. Maisel Bayreuth,15, Japan                           ,3,880,German Hefeweizen,http://www.ratebeer.com/beer/maisels-weisse-original/4560/130676/,"this hefeweizen reminds me of the story of goldilocks;some hehes are too sweet,some are too bland,but this one is just right. ",90.995,left_bank,Germany,5.4%,Maisels Weisse Original
83,0,http://www.ratebeer.com/user/130676/beer-ratings/,1795,0,61,3,7,99,3.3 AROMA 7/10 APPEARANCE 3/5 TASTE 7/10 PALATE 3/5 OVERALL 13/20left_bank(99),7,10,130676,3.3,95.847,3.36713,Spaten-Franziskaner-Bru (InBev),13, Japan                           ,3,1795,Dunkelweizen,http://www.ratebeer.com/beer/franziskaner-hefe-weissbier-dunkel/1089/130676/,"palate is 3.5 which gives an overall score of 13.5.   caramel.banana,chocolate,bubblegum and spices.  very good,very refreshing.thank you bavarian purity law of 1516!    ",77.018,left_bank,Germany,5%,Franziskaner Hefe-Weissbier Dunkel
83,0,http://www.ratebeer.com/user/130676/beer-ratings/,33,0,61,3,8,99,3.5 AROMA 7/10 APPEARANCE 3/5 TASTE 8/10 PALATE 3/5 OVERALL 14/20left_bank(99),7,10,130676,3.5,82.6,3.204391,Privatbrauerei Hoepfner (Schrghuber),14, Japan                           ,3,147,Dunkelweizen,http://www.ratebeer.com/beer/hoepfner-keller-weizen/1714/130676/,"brown color,aroma/taste of malt,caramel & bananas.like it,but do not love it. ",53.673,left_bank,Germany,4.9%,Hoepfner Keller-Weizen
83,0,http://www.ratebeer.com/user/130676/beer-ratings/,621,0,61,3,7,99,3.2 AROMA 7/10 APPEARANCE 3/5 TASTE 7/10 PALATE 3/5 OVERALL 12/20left_bank(99),7,10,130676,3.2,83.485,3.461676,Fullers,12, Japan                           ,3,621,Stout,http://www.ratebeer.com/beer/fullers-black-cab-stout-bottle-keg/172240/130676/,"roasted malts,chocolate,something fruit,blah-blah-blah/do they make a stout in london that i can give a 14/20 score!? ",86.176,left_bank,England,4.5%,Fullers Black Cab Stout (Bottle & Keg)
83,0,http://www.ratebeer.com/user/130676/beer-ratings/,329,0,61,2,3,99,2.1 AROMA 3/10 APPEARANCE 4/5 TASTE 3/10 PALATE 2/5 OVERALL 9/20left_bank(99),3,10,130676,2.1,80.122,3.26915,Meantime (SAB Miller),9, Japan                           ,4,329,Schwarzbier,http://www.ratebeer.com/beer/meantime-london-stout/76945/130676/,this is one of the nicest (looking)beers to pour with equally nice lacing.that is everything positive i can say. ,63.993,left_bank,England,4.5%,Meantime London Stout
