user_num_places_rated,user_num_following,user_url,beer_num_ratings,user_num_friends,user_num_breweries_rated,review_palate_score,review_taste_score,user_num_ratings,review_ratings_blob,review_aroma_score,user_num_countries_rated,user_id,review_avg_score,beer_global_style_score,beer_weighted_avg_score,beer_brewer_name,review_overall_score,user_location,review_appearance_score,beer_num_calories,beer_style,beer_url,review_blob,beer_global_score,user_name,beer_location,beer_ABV,beer_name
1,0,http://www.ratebeer.com/user/137543/beer-ratings/,3,0,6,3,6,7,2.5 AROMA 5/10 APPEARANCE 4/5 TASTE 6/10 PALATE 3/5 OVERALL 7/20cggipa(7),5,2,137543,2.5,,2.97113,Marble Brewery,7, New Mexico,4,264,Belgian Strong Ale,http://www.ratebeer.com/beer/marble-abbey-darkness/173208/137543/,"Light aroma of dark fruits and paint thinner?  Very dark brown pour. Thin head and very thin body. Boozy and watery, not the boys best effort. ",,cggipa,New Mexico,8.8%,Marble Abbey Darkness
1,0,http://www.ratebeer.com/user/137543/beer-ratings/,197,0,6,3,7,7,3.7 AROMA 8/10 APPEARANCE 4/5 TASTE 7/10 PALATE 3/5 OVERALL 15/20cggipa(7),8,2,137543,3.7,80.862,3.490128,Widmer Brothers Brewing Company,15, New Mexico,4,197,India Pale Ale (IPA),http://www.ratebeer.com/beer/widmer-brothers-rotator-ipa-series--x-114-ipa/95994/137543/,"Pours golden with foamy white head that dissipates at a medium rate, nice lacing.  Very earthy hop forward aroma that comes across dry.  Light body, oily feel on the tongue.  Earthy, spicy hop resins grab your tongue and dont let go. Peppery dry finish.  Easy drinking, but not up to NW IPAs.  Will finish the case though! ",89.726,cggipa,Oregon,6.2%,Widmer Brothers Rotator IPA Series - X-114 IPA
1,0,http://www.ratebeer.com/user/137543/beer-ratings/,3513,0,6,4,9,7,4.2 AROMA 8/10 APPEARANCE 4/5 TASTE 9/10 PALATE 4/5 OVERALL 17/20cggipa(7),8,2,137543,4.2,97.919,3.753789,Sierra Nevada Brewing Company,17, New Mexico,4,3513,India Pale Ale (IPA),http://www.ratebeer.com/beer/sierra-nevada-celebration-ale/370/137543/,"Very appetizing looking in the glass. Light haze in this copper colored ale.  Big frothy white head that sticks around and leaves a nice lace.  Nose is full of malts, biscuit, caramel, grassy hops, citrus.  Medium body of fresh chewy malt, sweet to start followed by whole hop hit of citrus and pine, dry finish.  Great satisfying seasonal beer that takes too long to return. ",97.702,cggipa,California,6.8%,Sierra Nevada Celebration Ale
1,0,http://www.ratebeer.com/user/137543/beer-ratings/,711,0,6,3,7,7,3.6 AROMA 7/10 APPEARANCE 4/5 TASTE 7/10 PALATE 3/5 OVERALL 15/20cggipa(7),7,2,137543,3.6,99.365,3.894431,Stone Brewing,15, New Mexico,4,711,Black IPA,http://www.ratebeer.com/beer/stone-15th-anniversary-escondidian-imperial-black-ipa/147316/137543/,"Pours black with a tan head that holds and leaves nice lacing.  Aroma is dark strong malt and heavy hops - citrus.  Medium to heavy body has full mouthfeel.  Dark malt, roasty toasty, coffee notes and faint dark chocolate with heavy hop bitterness on the finish.  Alcohol is in the background, but the tastes are very heavy, almost plodding.  Great technical brew, just not something you can drink on your own.  Too much work in finishing the bottle. ",99.206,cggipa,California,10.8%,Stone 15th Anniversary Escondidian Imperial Black IPA
1,0,http://www.ratebeer.com/user/137543/beer-ratings/,14,0,6,5,8,7,4.3 AROMA 8/10 APPEARANCE 5/5 TASTE 8/10 PALATE 5/5 OVERALL 17/20cggipa(7),8,2,137543,4.3,68.731,3.457941,La Cumbre Brewing Company,17, New Mexico,5,240,Baltic Porter,http://www.ratebeer.com/beer/la-cumbre-siberian-silk/157996/137543/,"On tap at the brewpub.  Poured black, dark brown with a thin tan head.  Malty, toasty, dark roasted coffee - mmm!  Medium body, smooooth silky mouthfeel.  Sweet malt, toasted bread, then strong coffee and some milk chocolate.  Warm dry finish.  No session beer here.  Dark, rich deep flavored.  Nice dessert beer or night cap. ",90.629,cggipa,New Mexico,8%,La Cumbre Siberian Silk
1,0,http://www.ratebeer.com/user/137543/beer-ratings/,3550,0,6,5,9,7,4.8 AROMA 9/10 APPEARANCE 5/5 TASTE 9/10 PALATE 5/5 OVERALL 20/20cggipa(7),9,2,137543,4.8,99.894,4.074321,Brasserie Rochefort,20, New Mexico,5,3550,Belgian Strong Ale,http://www.ratebeer.com/beer/rochefort-trappistes-8/5400/137543/,"Pours a dark, dark brown; almost black, hazy with the the yeast included.  Thick light brown head that fell away quickly.  Caramel, bread, roasty, bread fruits and alcohol on the nose - love it!.    Medium to full mouthfeel.  Whoa, the taste... the depth, deep roasty sweet malt, bread and dark fruits.  Warming alcohol finish, some raisins.  Some spicyness? ",99.841,cggipa,Belgium,9.2%,Rochefort Trappistes 8
1,0,http://www.ratebeer.com/user/137543/beer-ratings/,27,0,6,4,10,7,4.8 AROMA 9/10 APPEARANCE 5/5 TASTE 10/10 PALATE 4/5 OVERALL 20/20cggipa(7),9,2,137543,4.8,74.786,3.760794,Marble Brewery,20, New Mexico,5,330,Imperial Stout,http://www.ratebeer.com/beer/marble-imperial-stout/117586/137543/,"Solid black with thin tan head.  Dark roasted malt and cocoa on the nose.  Heavy body, thick sweet malt ",97.811,cggipa,New Mexico,11%,Marble Imperial Stout
