user_num_places_rated,user_num_following,user_url,beer_num_ratings,user_num_friends,user_num_breweries_rated,review_palate_score,review_taste_score,user_num_ratings,review_ratings_blob,review_aroma_score,user_num_countries_rated,user_id,review_avg_score,beer_global_style_score,beer_weighted_avg_score,beer_brewer_name,review_overall_score,user_location,review_appearance_score,beer_num_calories,beer_style,beer_url,review_blob,beer_global_score,user_name,beer_location,beer_ABV,beer_name
0,0,http://www.ratebeer.com/user/170962/beer-ratings/,58,0,3,4,9,4,4 AROMA 7/10 APPEARANCE 4/5 TASTE 9/10 PALATE 4/5 OVERALL 16/20sewer123(4),7,1,170962,4,99.365,3.721876,Lakefront Brewery,16," minooka, Illinois",4,240,Spice/Herb/Vegetable,http://www.ratebeer.com/beer/lakefront-25th-anniversary-series-03-imperial-pumpkin-2013/218233/170962/,"If you could drink the months of oct and nov this beer is what it would taste like.Seasonal flavors galore, its got a lot goin on. Good stuff.  ",97.318,sewer123,Wisconsin,8%,Lakefront 25th Anniversary Series #03: Imperial Pumpkin (2013)
0,0,http://www.ratebeer.com/user/170962/beer-ratings/,460,0,3,2,9,4,4.2 AROMA 9/10 APPEARANCE 4/5 TASTE 9/10 PALATE 2/5 OVERALL 18/20sewer123(4),9,1,170962,4.2,93.265,3.249946,New Belgium Brewing Company,18," minooka, Illinois",4,460,Premium Lager,http://www.ratebeer.com/beer/new-belgium-shift-pale-lager/167066/170962/,Solid session beer. Hoppy smell to it. Hoppy after taste but not like an ipa. Calm hops nothing crazy.  Dope session beer if your tired of the cheap stuff. ,60.905,sewer123,Colorado,5%,New Belgium Shift Pale Lager
0,0,http://www.ratebeer.com/user/170962/beer-ratings/,1092,0,3,3,8,4,3.5 AROMA 5/10 APPEARANCE 2/5 TASTE 8/10 PALATE 3/5 OVERALL 17/20sewer123(4),5,1,170962,3.5,74.906,3.081387,New Glarus Brewing Company,17," minooka, Illinois",2,1092,Cream Ale,http://www.ratebeer.com/beer/new-glarus-spotted-cow/7453/170962/,12 oz. Bottle. Easy to drink. Good session beer. I dont remember flavor notes but just thought it was good. ,43.781,sewer123,Wisconsin,4.9%,New Glarus Spotted Cow
0,0,http://www.ratebeer.com/user/170962/beer-ratings/,317,0,3,5,9,4,4 AROMA 5/10 APPEARANCE 4/5 TASTE 9/10 PALATE 5/5 OVERALL 17/20sewer123(4),5,1,170962,4,95.963,3.749425,New Glarus Brewing Company,17," minooka, Illinois",4,317,Black IPA,http://www.ratebeer.com/beer/new-glarus-black-top/150715/170962/,"Not a big IPA fan but I really enjoyed this. I didnt feel like I had a mouthful of hops for hours like I do with most IPAs. Good balance.
 ",97.811,sewer123,Wisconsin,6.9%,New Glarus Black Top
