user_num_places_rated,user_num_following,user_url,beer_num_ratings,user_num_friends,user_num_breweries_rated,review_palate_score,review_taste_score,user_num_ratings,review_ratings_blob,review_aroma_score,user_num_countries_rated,user_id,review_avg_score,beer_global_style_score,beer_weighted_avg_score,beer_brewer_name,review_overall_score,user_location,review_appearance_score,beer_num_calories,beer_style,beer_url,review_blob,beer_global_score,user_name,beer_location,beer_ABV,beer_name
1,0,http://www.ratebeer.com/user/172315/beer-ratings/,2481,0,4,5,4,5,4.2 AROMA 10/10 APPEARANCE 4/5 TASTE 4/10 PALATE 5/5 OVERALL 19/204265homebrew(5),10,1,172315,4.2,89.261,3.572351,Lagunitas Brewing Company (Heineken),19," Coconut Creek, Florida",4,2481,India Pale Ale (IPA),http://www.ratebeer.com/beer/lagunitas-india-pale-ale-ipa/6887/172315/,Wonderful citrus hop aroma.  Clear golden ipa that tastes as good as it smells. Nice rounded palate thats clean and fresh. A real winner. ,92.602,4265homebrew,California,6.2%,Lagunitas India Pale Ale (IPA)
1,0,http://www.ratebeer.com/user/172315/beer-ratings/,367,0,4,1,2,5,1.3 AROMA 4/10 APPEARANCE 3/5 TASTE 2/10 PALATE 1/5 OVERALL 3/204265homebrew(5),4,1,172315,1.3,78.153,3.080181,Boston Beer Company,3," Coconut Creek, Florida",3,367,Klsch,http://www.ratebeer.com/beer/samuel-adams-east-west-kolsch/142225/172315/,"Didn?t care for this beer. Looked clear and crisp, but it had a funky aftertaste. The more I drank the less noticeable the aftertaste. I would not recommend this  unless it was the only beer in the fridge on a hot summer day. ",45.672,4265homebrew,Massachusetts,5.01%,Samuel Adams East-West Kolsch
1,0,http://www.ratebeer.com/user/172315/beer-ratings/,577,0,4,5,8,5,4 AROMA 8/10 APPEARANCE 3/5 TASTE 8/10 PALATE 5/5 OVERALL 16/204265homebrew(5),8,1,172315,4,41.709,2.964735,Shmaltz Brewing Company,16," Coconut Creek, Florida",3,577,Amber Ale,http://www.ratebeer.com/beer/hebrew-genesis-ale/2685/172315/,"Citrus aroma with a gold copper appearance. A nice crisp but not bitter grapefruit taste, from theincredible cascade dry hopping. Taste great through to finish. I was pleasantly surprised at how good this kosher brew tastes. ",35.639,4265homebrew,New York,6%,HeBrew Genesis Ale
1,0,http://www.ratebeer.com/user/172315/beer-ratings/,90,0,4,4,3,5,3.2 AROMA 7/10 APPEARANCE 5/5 TASTE 3/10 PALATE 4/5 OVERALL 13/204265homebrew(5),7,1,172315,3.2,95.495,3.31699,Due South Brewing Co.,13," Coconut Creek, Florida",5,150,Cream Ale,http://www.ratebeer.com/beer/due-south-caramel-cream-ale/152009/172315/,"Due South Brewery just opened yesterday.  May 12, 2013. Initial flavor was good,  good combination of malt and hops. After a few seconds my palate was hit with some very sweet notes. I didnt care for the sweet flavor combined with the bitterness of a hopped ale. Perhaps I just need to get used to the abundance of flavors. ",71.195,4265homebrew,Florida,5%,Due South Caramel Cream Ale
1,0,http://www.ratebeer.com/user/172315/beer-ratings/,16,0,4,4,9,5,4.4 AROMA 9/10 APPEARANCE 3/5 TASTE 9/10 PALATE 4/5 OVERALL 19/204265homebrew(5),9,1,172315,4.4,15.917,2.927389,Due South Brewing Co.,19," Coconut Creek, Florida",3,183,Dry Stout,http://www.ratebeer.com/beer/due-south-roasted-cocoa-stout/152011/172315/,"Due South Brewery just opened yesterday May 12, 2012. Nice malty chocolate smell and taste. Had a typical oatmeal stout flavor, with some heavy hopiness. Nice blend of hops and chocolate overtones. ",36.702,4265homebrew,Florida,6.1%,Due South Roasted Cocoa Stout
