user_num_places_rated,user_num_following,user_url,beer_num_ratings,user_num_friends,user_num_breweries_rated,review_palate_score,review_taste_score,user_num_ratings,review_ratings_blob,review_aroma_score,user_num_countries_rated,user_id,review_avg_score,beer_global_style_score,beer_weighted_avg_score,beer_brewer_name,review_overall_score,user_location,review_appearance_score,beer_num_calories,beer_style,beer_url,review_blob,beer_global_score,user_name,beer_location,beer_ABV,beer_name
41,0,http://www.ratebeer.com/user/172876/beer-ratings/,108,4,307,2,4,1104,2.2 AROMA 3/10 APPEARANCE 3/5 TASTE 4/10 PALATE 2/5 OVERALL 10/20jonnyguns(1104),3,30,172876,2.2,35.998,3.38943,Williams Brothers (Heather Ales),10, Australia                       ,3,108,Imperial IPA,http://www.ratebeer.com/beer/williams-brothers-double-joker/180696/172876/,"Bottle from mane liquor. Pours hazy orange with small head. Nose is incredibly sweet. Almost smells like pure honey. Taste is overly sweet too. Far too much honey and caramel for my liking. No balance. 

---Rated via Beer Buddy for iPhone ",79.584,jonnyguns,Scotland,8.3%,Williams Brothers Double Joker
41,0,http://www.ratebeer.com/user/172876/beer-ratings/,180,4,307,4,7,1104,3.8 AROMA 8/10 APPEARANCE 4/5 TASTE 7/10 PALATE 4/5 OVERALL 15/20jonnyguns(1104),8,30,172876,3.8,86.44,3.547593,Deschutes Brewery,15, Australia                       ,4,180,India Pale Ale (IPA),http://www.ratebeer.com/beer/deschutes-foray-belgian-style-ipa/273098/172876/,"Bottle from Mane Liquor. Pours a slight hazy golden with a small white cap. Nose has nectarine,, tropical fruits, cloves, banana and hint of spice. Very appealing. Taste is clean tropical fruit and banana yeast. Dry bitterness with mild spices and cloves. Pretty easy to slam down. Good drop. 

---Rated via Beer Buddy for iPhone ",91.497,jonnyguns,Oregon,6.4%,Deschutes Foray Belgian Style IPA
41,0,http://www.ratebeer.com/user/172876/beer-ratings/,4,4,307,3,7,1104,3.4 AROMA 6/10 APPEARANCE 3/5 TASTE 7/10 PALATE 3/5 OVERALL 15/20jonnyguns(1104),6,30,172876,3.4,,3.045858,Bridge Road Brewers,15, Australia                       ,3,132,Saison,http://www.ratebeer.com/beer/bridge-road-posse-summer-ale-2014/304179/172876/,"Bottle from mane liquor. Pours cloudy golden with fluffy white head. Nose is yeasty, banana and citrus tones. Taste is much in the same vein. Taste is banana, clove, refreshing citrus. Very drinkable. 

---Rated via Beer Buddy for iPhone ",,jonnyguns,Australia,4.4%,Bridge Road Posse Summer Ale (2014)
41,0,http://www.ratebeer.com/user/172876/beer-ratings/,10,4,307,2,6,1104,3 AROMA 6/10 APPEARANCE 3/5 TASTE 6/10 PALATE 2/5 OVERALL 13/20jonnyguns(1104),6,30,172876,3,14.408,3.043997,Red Island Brewing Co.,13, Australia                       ,3,180,India Pale Ale (IPA),http://www.ratebeer.com/beer/quiet-deeds-white-ipa/298693/172876/,"Can from Mane Liquor. Pretty approachable stuff loads of cloves, banana and tropical notes. Not a bad drop. 

---Rated via Beer Buddy for iPhone ",41.355,jonnyguns,Australia,6%,Quiet Deeds White IPA
41,0,http://www.ratebeer.com/user/172876/beer-ratings/,110,4,307,4,8,1104,3.9 AROMA 9/10 APPEARANCE 3/5 TASTE 8/10 PALATE 4/5 OVERALL 15/20jonnyguns(1104),9,30,172876,3.9,97.811,3.743529,Siren,15, Australia                       ,3,110,India Pale Ale (IPA),http://www.ratebeer.com/beer/siren--to-ol-middle-finger-discount/279874/172876/,"Bottle from Fantasticfilm, cheers. Pours a pretty dirty orange, not overly appealing. Wow. The nose is fucking exceptional. Loads of pine upfront, smokey wood and citrus. Taste is loads of pine again, with a woody/smokey finish. Heaps of spice and tropical notes too. Fucking great stuff. 

---Rated via Beer Buddy for iPhone ",97.592,jonnyguns,England,7.2%,Siren / To l Middle Finger Discount
41,0,http://www.ratebeer.com/user/172876/beer-ratings/,8,4,307,3,6,1104,3 AROMA 6/10 APPEARANCE 3/5 TASTE 6/10 PALATE 3/5 OVERALL 12/20jonnyguns(1104),6,30,172876,3,,2.919731,Beaten Track Brewery,12, Australia                       ,3,192,India Pale Ale (IPA),http://www.ratebeer.com/beer/beaten-track-gunbarrel-ipa/186172/172876/,"Bottle from mane liquor. Pours copper white head. Nose shows pine, stone fruit and resinous hops. Smells a little boozy too. Taste is pine, caramel and some grassy notes. Okay but not great. 

---Rated via Beer Buddy for iPhone ",,jonnyguns,Australia,6.4%,Beaten Track Gunbarrel IPA
41,0,http://www.ratebeer.com/user/172876/beer-ratings/,1019,4,307,4,8,1104,4.2 AROMA 8/10 APPEARANCE 5/5 TASTE 8/10 PALATE 4/5 OVERALL 17/20jonnyguns(1104),8,30,172876,4.2,99.418,4.206059,Surly Brewing Company,17, Australia                       ,5,1019,Imperial Stout,http://www.ratebeer.com/beer/surly-darkness/65289/172876/,"Bottle from Mane Liquor thanks to Drew for cracking it on your 40th. Sexy looking pour. Deep black oil pour with a khaki head that holds briefly. Fucking amazing lacing. Nose is chocolate mud cake sweetness, vanilla, roasted espresso and pepper. Intense nose. Taste is bitter dark chocolate backed by vanilla sweetness. Coffee tones coming through. Very intense sweetness. Sticky chocolate coating on the palate. Fucking impressive stuff. 

---Rated via Beer Buddy for iPhone ",99.947,jonnyguns,Minnesota,9.6%,Surly Darkness
41,0,http://www.ratebeer.com/user/172876/beer-ratings/,23,4,307,4,8,1104,4 AROMA 8/10 APPEARANCE 4/5 TASTE 8/10 PALATE 4/5 OVERALL 16/20jonnyguns(1104),8,30,172876,4,95.672,3.673014,South East Brewing Company,16, Australia                       ,4,171,India Pale Ale (IPA),http://www.ratebeer.com/beer/kaiju-robohop-golden-ipa/304395/172876/,"Bottle from mane liquor. Pours a nice golden colour with a frothy white head. Nose is an absolute fruit bowl - tangerines, limes, mango and citrus. Taste is heavy on the tangerines and stone fruit with a juicy lime finish. So easy to slam down. Ridiculous beer sitting on 5.7%!

---Rated via Beer Buddy for iPhone ",96.078,jonnyguns,Australia,5.7%,Kaiju! Robohop Golden IPA
41,0,http://www.ratebeer.com/user/172876/beer-ratings/,56,4,307,3,6,1104,3.1 AROMA 6/10 APPEARANCE 3/5 TASTE 6/10 PALATE 3/5 OVERALL 13/20jonnyguns(1104),6,30,172876,3.1,61.472,3.569621,Bristol Beer Factory,13, Australia                       ,3,255,Imperial IPA,http://www.ratebeer.com/beer/bristol-beer-factory-unlimited-double-ipa/259784/172876/,"Bottle from mane liquor. Loads of sticky resin and pineapple in the nose. Very sweet double ipa. Not too bad. 

---Rated via Beer Buddy for iPhone ",92.737,jonnyguns,England,8.5%,Bristol Beer Factory UNLIMITED Double IPA
