user_num_places_rated,user_num_following,user_url,beer_num_ratings,user_num_friends,user_num_breweries_rated,review_palate_score,review_taste_score,user_num_ratings,review_ratings_blob,review_aroma_score,user_num_countries_rated,user_id,review_avg_score,beer_global_style_score,beer_weighted_avg_score,beer_brewer_name,review_overall_score,user_location,review_appearance_score,beer_num_calories,beer_style,beer_url,review_blob,beer_global_score,user_name,beer_location,beer_ABV,beer_name
1,0,http://www.ratebeer.com/user/177126/beer-ratings/,310,0,44,3,7,64,3.7 AROMA 7/10 APPEARANCE 3/5 TASTE 7/10 PALATE 3/5 OVERALL 17/20Stizz19(64),7,7,177126,3.7,96.308,3.689721,Elysian Brewing (AB InBev),17," Victoria, British Columbia, Canada                          ",3,310,India Pale Ale (IPA),http://www.ratebeer.com/beer/elysian-space-dust-ipa/173579/177126/,"Poured from a bomber. Nice thick white foamy head. Smells citrusy for sure, a small amount of fruit. Tastes bitter right off the hop, not much lingering though. I like it.

---Rated via Beer Buddy for iPhone ",96.479,Stizz19,Washington,8.2%,Elysian Space Dust IPA
1,0,http://www.ratebeer.com/user/177126/beer-ratings/,129,0,44,3,7,64,3.6 AROMA 7/10 APPEARANCE 3/5 TASTE 7/10 PALATE 3/5 OVERALL 16/20Stizz19(64),7,7,177126,3.6,96.985,3.712195,Breakside Brewery,16," Victoria, British Columbia, Canada                          ",3,129,India Pale Ale (IPA),http://www.ratebeer.com/beer/breakside-ipa/139634/177126/,"Poured from a bomber. Thick, foamy head. Smells a bit dank, taste is on the yeasty side but the hops come through. Unique IPA i&apos;d try again.

---Rated via Beer Buddy for iPhone ",96.985,Stizz19,Oregon,6.8%,Breakside IPA
1,0,http://www.ratebeer.com/user/177126/beer-ratings/,53,0,44,3,3,64,3.3 AROMA 8/10 APPEARANCE 4/5 TASTE 3/10 PALATE 3/5 OVERALL 15/20Stizz19(64),8,7,177126,3.3,75.738,3.601361,Gigantic Brewing Co.,15," Victoria, British Columbia, Canada                          ",4,255,Imperial IPA,http://www.ratebeer.com/beer/gigantic-whole-in-the-head/210368/177126/,"Poured from a 650ml bomber. Floral smell. Taste has a decent balance, a little acidic. Overall a pretty good beer from Gigantic.

---Rated via Beer Buddy for iPhone ",95.318,Stizz19,Oregon,8.5%,Gigantic Whole In the Head
1,0,http://www.ratebeer.com/user/177126/beer-ratings/,1646,0,44,4,9,64,4.4 AROMA 9/10 APPEARANCE 4/5 TASTE 9/10 PALATE 4/5 OVERALL 18/20Stizz19(64),9,7,177126,4.4,99.524,4.046329,Firestone Walker Brewing (Duvel Moortgat),18," Victoria, British Columbia, Canada                          ",4,1646,Imperial IPA,http://www.ratebeer.com/beer/firestone-walker-double-jack-ipa/106045/177126/,"Tried this in Todd English Pub at the Aria in Las Vegas. One of the, if not the best DIPA i&apos;ve ever had. Very well balanced. I wish they sold it where I live.

---Rated via Beer Buddy for iPhone ",99.788,Stizz19,California,9.5%,Firestone Walker Double Jack IPA
1,0,http://www.ratebeer.com/user/177126/beer-ratings/,4,0,44,3,6,64,3.2 AROMA 6/10 APPEARANCE 3/5 TASTE 6/10 PALATE 3/5 OVERALL 14/20Stizz19(64),6,7,177126,3.2,,2.838757,Mill St. Brewery (AB InBev),14," Victoria, British Columbia, Canada                          ",3,210,Heller Bock,http://www.ratebeer.com/beer/mill-street-spring-bock/121585/177126/,"Had a bottle from a 6 pack. Bit of a funky beer, very funky aftertaste. Ok beer at best.

---Rated via Beer Buddy for iPhone ",,Stizz19,Canada,7%,Mill Street Spring Bock
1,0,http://www.ratebeer.com/user/177126/beer-ratings/,27,0,44,3,7,64,2.7 AROMA 6/10 APPEARANCE 4/5 TASTE 7/10 PALATE 3/5 OVERALL 7/20Stizz19(64),6,7,177126,2.7,9.192,3.114032,Spinnakers Brewpub,7," Victoria, British Columbia, Canada                          ",4,195,Black IPA,http://www.ratebeer.com/beer/spinnakers-lions-head-cascadia-dark-ale/131600/177126/,"6-pack from Spinnakers Liquor Store. Good balance of Hops and malts. Slight chocolate and toffee flavour. Decent beer for sure.

---Rated via Beer Buddy for iPhone ",49.259,Stizz19,Canada,6.5%,Spinnakers Lions Head Cascadia Dark Ale
1,0,http://www.ratebeer.com/user/177126/beer-ratings/,177,0,44,3,5,64,2.2 AROMA 6/10 APPEARANCE 2/5 TASTE 5/10 PALATE 3/5 OVERALL 6/20Stizz19(64),6,7,177126,2.2,14.408,3.044091,Double Trouble Brewing Co.,6," Victoria, British Columbia, Canada                          ",2,177,India Pale Ale (IPA),http://www.ratebeer.com/beer/double-trouble-hops-and-robbers-ipa/157801/177126/,"Golden color with very little head. Being from the West Coast of Canada this does not remind me of an IPA, more of a lager haha. 

---Rated via Beer Buddy for iPhone ",41.212,Stizz19,Canada,5.7%,Double Trouble Hops and Robbers IPA
1,0,http://www.ratebeer.com/user/177126/beer-ratings/,4227,0,44,4,9,64,4.4 AROMA 9/10 APPEARANCE 4/5 TASTE 9/10 PALATE 4/5 OVERALL 18/20Stizz19(64),9,7,177126,4.4,99.63,4.144226,St. Bernardus Brouwerij,18," Victoria, British Columbia, Canada                          ",4,4227,Abt/Quadrupel,http://www.ratebeer.com/beer/st-bernardus-abt-12/2530/177126/,"This as close to Rochefort and Westy as you can get. Great dark fruity taste and decent malty taste. Easily accessible unlike Westy. Great tasting beer!!!

---Rated via Beer Buddy for iPhone ",99.894,Stizz19,Belgium,10%,St. Bernardus Abt 12
1,0,http://www.ratebeer.com/user/177126/beer-ratings/,73,0,44,3,8,64,4 AROMA 8/10 APPEARANCE 4/5 TASTE 8/10 PALATE 3/5 OVERALL 17/20Stizz19(64),8,7,177126,4,86.176,3.624471,Phillips Brewing Co.,17," Victoria, British Columbia, Canada                          ",4,255,Black IPA,http://www.ratebeer.com/beer/phillips-cabin-fever-imperial-black-ipa/203838/177126/,"Poured from a Growler. Nice citrusy hop smell. Pours a quarter inch white foam with a slightly see-through black body. The taste is slightly underwhelming compared to the smell but it is a smooth imperial with a malty finish. Would drink this regularly.

---Rated via Beer Buddy for iPhone ",94.655,Stizz19,Canada,8.5%,Phillips Cabin Fever Imperial Black IPA
1,0,http://www.ratebeer.com/user/177126/beer-ratings/,3513,0,44,4,8,64,4 AROMA 8/10 APPEARANCE 4/5 TASTE 8/10 PALATE 4/5 OVERALL 16/20Stizz19(64),8,7,177126,4,97.919,3.753818,Sierra Nevada Brewing Company,16," Victoria, British Columbia, Canada                          ",4,3513,India Pale Ale (IPA),http://www.ratebeer.com/beer/sierra-nevada-celebration-ale/370/177126/,"Fairly feint smell of hops. Nice, autumny reddish-brown colour with a thick foamy head. Slight hoppy taste, decent carbonation and a bitter finish.

---Rated via Beer Buddy for iPhone ",97.702,Stizz19,California,6.8%,Sierra Nevada Celebration Ale
