user_num_places_rated,user_num_following,user_url,beer_num_ratings,user_num_friends,user_num_breweries_rated,review_palate_score,review_taste_score,user_num_ratings,review_ratings_blob,review_aroma_score,user_num_countries_rated,user_id,review_avg_score,beer_global_style_score,beer_weighted_avg_score,beer_brewer_name,review_overall_score,user_location,review_appearance_score,beer_num_calories,beer_style,beer_url,review_blob,beer_global_score,user_name,beer_location,beer_ABV,beer_name
0,0,http://www.ratebeer.com/user/1774/beer-ratings/,151,0,5,3,7,6,3.4 AROMA 6/10 APPEARANCE 5/5 TASTE 7/10 PALATE 3/5 OVERALL 13/20Domza(6),6,4,1774,3.4,90.923,2.53194,Cascade Brewery (CUB),13, Australia                       ,5,151,Pale Lager,http://www.ratebeer.com/beer/cascade-premium-lager/4980/1774/,"I like it. Good Tasmanian beer, fresh, lively, almost like boags, beauty. Can taste the Tassie hops. ",12.599,Domza,Australia,5.2%,Cascade Premium Lager
0,0,http://www.ratebeer.com/user/1774/beer-ratings/,3543,0,5,2,3,6,1.7 AROMA 2/10 APPEARANCE 5/5 TASTE 3/10 PALATE 2/5 OVERALL 5/20Domza(6),2,4,1774,1.7,10.905,1.694185,Grupo Modelo (Corona),5, Australia                       ,5,3543,Pale Lager,http://www.ratebeer.com/beer/corona-extra/742/1774/,"Fucking shocking beer. leaves a taste like grass and bark in your mouth. avoid at all costs. Pretty colour, shit taste. ",0.736,Domza,Mexico,4.6%,Corona Extra
0,0,http://www.ratebeer.com/user/1774/beer-ratings/,2149,0,5,3,7,6,3.3 AROMA 6/10 APPEARANCE 3/5 TASTE 7/10 PALATE 3/5 OVERALL 14/20Domza(6),6,4,1774,3.3,21.45,2.342572,Brauerei Beck & Co./Becks (InBev),14, Australia                       ,3,2149,Premium Lager,http://www.ratebeer.com/beer/becks/703/1774/,"First imported beer i ever tasted. Not bad, but bland. Not much nose, but finishes nicely. Similar to Tooheys Blue.  ",8.617,Domza,Germany,4.8%,Becks
0,0,http://www.ratebeer.com/user/1774/beer-ratings/,1472,0,5,3,7,6,3.6 AROMA 7/10 APPEARANCE 4/5 TASTE 7/10 PALATE 3/5 OVERALL 15/20Domza(6),7,4,1774,3.6,50.588,2.128906,Singapore Brewery (Asia Pacific Breweries-Heineken),15, Australia                       ,4,1472,Pale Lager,http://www.ratebeer.com/beer/tiger-beer/3126/1774/,"Better rating beer, good strong, firm upper palate, lingers a nutty flavour... quite enjoyable. Best asain beer around.  ",5.136,Domza,Singapore,5%,Tiger Beer
0,0,http://www.ratebeer.com/user/1774/beer-ratings/,193,0,5,3,5,6,2.9 AROMA 4/10 APPEARANCE 2/5 TASTE 5/10 PALATE 3/5 OVERALL 15/20Domza(6),4,4,1774,2.9,25.738,1.857309,Carlton & United Breweries  (CUB),15, Australia                       ,2,193,Pale Lager,http://www.ratebeer.com/beer/carlton-draught/7179/1774/,"Not the nicest Aussie beers, goes well with BBQd seafood, easy to drink, lacks punch in the after mouth. Quite refreshing ",1.912,Domza,Australia,4.6%,Carlton Draught
0,0,http://www.ratebeer.com/user/1774/beer-ratings/,286,0,5,4,6,6,2.5 AROMA 6/10 APPEARANCE 3/5 TASTE 6/10 PALATE 4/5 OVERALL 6/20Domza(6),6,4,1774,2.5,45.672,2.065192,Carlton & United Breweries  (CUB),6, Australia                       ,3,286,Pale Lager,http://www.ratebeer.com/beer/carlton-crown-lager/7209/1774/,"Clean, smooth taste. Creamy head, but light on hops. Feels good, but lacking in kick ",4.259,Domza,Australia,4.9%,Carlton Crown Lager
