user_num_places_rated,user_num_following,user_url,beer_num_ratings,user_num_friends,user_num_breweries_rated,review_palate_score,review_taste_score,user_num_ratings,review_ratings_blob,review_aroma_score,user_num_countries_rated,user_id,review_avg_score,beer_global_style_score,beer_weighted_avg_score,beer_brewer_name,review_overall_score,user_location,review_appearance_score,beer_num_calories,beer_style,beer_url,review_blob,beer_global_score,user_name,beer_location,beer_ABV,beer_name
0,0,http://www.ratebeer.com/user/178298/beer-ratings/,862,0,6,4,8,6,4.1 AROMA 8/10 APPEARANCE 4/5 TASTE 8/10 PALATE 4/5 OVERALL 17/20Marulv(6),8,3,178298,4.1,97.919,3.952842,Brouwerij Rodenbach (Palm),17," Uppsala, Sweden                          ",4,862,Sour Red/Brown,http://www.ratebeer.com/beer/rodenbach-vintage/112249/178298/,"750ml bottle, 2010 Vintage. Red-amber color. Aroma is fruity vinegar notes. Taste is amazingly balanced sourness.  ",99.471,Marulv,Belgium,7%,Rodenbach Vintage
0,0,http://www.ratebeer.com/user/178298/beer-ratings/,2750,0,6,4,9,6,4.3 AROMA 7/10 APPEARANCE 5/5 TASTE 9/10 PALATE 4/5 OVERALL 18/20Marulv(6),7,3,178298,4.3,99.683,4.257768,Goose Island Beer Company (AB-InBev),18," Uppsala, Sweden                          ",5,2750,Imperial Stout,http://www.ratebeer.com/beer/goose-island-bourbon-county-stout/8909/178298/,"355ml bottle from 2012. Color is black as night with almost no head. Aroma is bourbon bourbon bourbon... Taste is dark chocolate, roasted, boozy, cherries.  ",,Marulv,Illinois,14.2%,Goose Island Bourbon County Stout
0,0,http://www.ratebeer.com/user/178298/beer-ratings/,205,0,6,3,7,6,3.5 AROMA 7/10 APPEARANCE 3/5 TASTE 7/10 PALATE 3/5 OVERALL 15/20Marulv(6),7,3,178298,3.5,96.365,3.498281,Jmtlands Bryggeri,15," Uppsala, Sweden                          ",3,205,English Strong Ale,http://www.ratebeer.com/beer/jamtlands-julol/5946/178298/,500ml bottle from Systembolaget. Pours dark copper. Aroma is nutty and malty. Taste is fruity and slightly roasted. Great christmas beer ,89.183,Marulv,Sweden,6.5%,Jmtlands Jull
0,0,http://www.ratebeer.com/user/178298/beer-ratings/,61,0,6,3,5,6,2.9 AROMA 5/10 APPEARANCE 3/5 TASTE 5/10 PALATE 3/5 OVERALL 13/20Marulv(6),5,3,178298,2.9,88.383,3.643591,Nynshamns ngbryggeri,13," Uppsala, Sweden                          ",3,240,Foreign Stout,http://www.ratebeer.com/beer/nynashamns-sotholmen-extra-stout-svensk-ek/289539/178298/,"250ml bottle. Black in color and a small dark head. Aroma is whiskey, a bit to much. Taste whiskey, roasted malt and chocolate. A bit disappointing... ",95.318,Marulv,Sweden,8%,Nynshamns Sotholmen Extra Stout Svensk Ek
0,0,http://www.ratebeer.com/user/178298/beer-ratings/,2074,0,6,4,9,6,4.5 AROMA 10/10 APPEARANCE 4/5 TASTE 9/10 PALATE 4/5 OVERALL 18/20Marulv(6),10,3,178298,4.5,99.947,4.194244,De Struise Brouwers,18," Uppsala, Sweden                          ",4,2074,Belgian Strong Ale,http://www.ratebeer.com/beer/struise-pannepot/37835/178298/,"330ml bottle from 2011. Pours dark with very little foam. Amazing smell, spices. Tastes malty with a lot of raisins, spices and dark sugars. A truly amazing beer! ",99.947,Marulv,Belgium,10%,Struise Pannepot
0,0,http://www.ratebeer.com/user/178298/beer-ratings/,103,0,6,4,8,6,3.8 AROMA 7/10 APPEARANCE 3/5 TASTE 8/10 PALATE 4/5 OVERALL 16/20Marulv(6),7,3,178298,3.8,65.508,3.71534,Mohawk Brewing Company,16," Uppsala, Sweden                          ",3,103,Imperial Stout,http://www.ratebeer.com/beer/mohawk-snowmelter/295098/178298/,"Huge amount of coffee is the first thing that you smell. And same with the taste, coffee and a slight heat. And a smooth chocolate finish. Tasteful beer that suppress the abv very well. ",96.985,Marulv,Sweden,11%,Mohawk Snowmelter
