user_num_places_rated,user_num_following,user_url,beer_num_ratings,user_num_friends,user_num_breweries_rated,review_palate_score,review_taste_score,user_num_ratings,review_ratings_blob,review_aroma_score,user_num_countries_rated,user_id,review_avg_score,beer_global_style_score,beer_weighted_avg_score,beer_brewer_name,review_overall_score,user_location,review_appearance_score,beer_num_calories,beer_style,beer_url,review_blob,beer_global_score,user_name,beer_location,beer_ABV,beer_name
0,0,http://www.ratebeer.com/user/18576/beer-ratings/,1345,0,7,2,4,9,1.9 AROMA 3/10 APPEARANCE 3/5 TASTE 4/10 PALATE 2/5 OVERALL 7/20Goodfieldnohit(9),3,2,18576,1.9,46.193,2.076997,Grupo Modelo (Corona),7," Canadian, Texas",3,1345,Pale Lager,http://www.ratebeer.com/beer/pacifico-clara/746/18576/,good for a mexican beer.  Better than corona.  nice balance to the salsa and fajitas i was eating.  very light ,4.405,Goodfieldnohit,Mexico,4.5%,Pacifico Clara
0,0,http://www.ratebeer.com/user/18576/beer-ratings/,982,0,7,4,8,9,3.9 AROMA 8/10 APPEARANCE 4/5 TASTE 8/10 PALATE 4/5 OVERALL 15/20Goodfieldnohit(9),8,2,18576,3.9,63.158,3.06393,Boulevard Brewing Company (Duvel-Moortgat),15," Canadian, Texas",4,982,Wheat Ale,http://www.ratebeer.com/beer/boulevard-unfiltered-wheat-beer/114/18576/,"This is my favorite beer when I can get to Kansas.  Its probably a good thing that I dont have easier access to it.  Very refreshing and as others have mentioned, it is smooth.  Get some if you can.... ",42.87,Goodfieldnohit,Missouri,4.4%,Boulevard Unfiltered Wheat Beer
0,0,http://www.ratebeer.com/user/18576/beer-ratings/,1829,0,7,3,6,9,2.8 AROMA 6/10 APPEARANCE 3/5 TASTE 6/10 PALATE 3/5 OVERALL 10/20Goodfieldnohit(9),6,2,18576,2.8,37.218,2.584679,Spoetzl Brewery (Gambrinus Company),10," Canadian, Texas",3,1829,Amber Lager/Vienna,http://www.ratebeer.com/beer/shiner-bock/909/18576/,Good as an everyday beer.  No big deal though. To me it tastes like Negra Modelo.   ,13.716,Goodfieldnohit,Texas,4.41%,Shiner Bock
0,0,http://www.ratebeer.com/user/18576/beer-ratings/,3968,0,7,1,1,9,0.7 AROMA 1/10 APPEARANCE 2/5 TASTE 1/10 PALATE 1/5 OVERALL 2/20Goodfieldnohit(9),1,2,18576,0.7,3.087,1.456147,Anheuser-Busch InBev,2," Canadian, Texas",2,3968,Pale Lager,http://www.ratebeer.com/beer/budweiser/473/18576/,I think this is the worst beer available. And to  think I paid 8 bucks for a cup of it at a St. Louis Cardinal game.  Still better than a coke or Dr. Pepper... ,0.147,Goodfieldnohit,Missouri,5%,Budweiser
0,0,http://www.ratebeer.com/user/18576/beer-ratings/,1426,0,7,2,2,9,1.2 AROMA 2/10 APPEARANCE 2/5 TASTE 2/10 PALATE 2/5 OVERALL 4/20Goodfieldnohit(9),2,2,18576,1.2,10.478,1.69086,Coors Brewing Company (MillerCoors),4," Canadian, Texas",2,1426,Pale Lager,http://www.ratebeer.com/beer/coors-banquet-beer/706/18576/,"When I want to think about how a beer tastes, I dont reach for a Coors.  But it is what it is.  There arent many better beers to drink when its hot outside, or when playing golf...... ",0.736,Goodfieldnohit,Colorado,5%,Coors Banquet Beer
0,0,http://www.ratebeer.com/user/18576/beer-ratings/,2946,0,7,3,7,9,3.4 AROMA 7/10 APPEARANCE 5/5 TASTE 7/10 PALATE 3/5 OVERALL 12/20Goodfieldnohit(9),7,2,18576,3.4,54.113,3.078354,New Belgium Brewing Company,12," Canadian, Texas",5,2946,Amber Ale,http://www.ratebeer.com/beer/new-belgium-fat-tire/424/18576/,"Lots of yeasty taste, almost like eating bread.  I have had this on tap and was quite pleased.  In a bottle the head was very thin and not nearly as tasty.  I wouldnt turn it down, but probably wouldnt buy more.   ",43.524,Goodfieldnohit,Colorado,5.2%,New Belgium Fat Tire 
0,0,http://www.ratebeer.com/user/18576/beer-ratings/,2193,0,7,3,6,9,2.9 AROMA 6/10 APPEARANCE 4/5 TASTE 6/10 PALATE 3/5 OVERALL 10/20Goodfieldnohit(9),6,2,18576,2.9,45.079,2.694136,Grupo Modelo (Corona),10," Canadian, Texas",4,2193,Amber Lager/Vienna,http://www.ratebeer.com/beer/negra-modelo/745/18576/,Pours nice with a thinnish head.  In many respects is like Shiner Bock.  A good average beer.   ,17.67,Goodfieldnohit,Mexico,5.3%,Negra Modelo
0,0,http://www.ratebeer.com/user/18576/beer-ratings/,2981,0,7,4,8,9,4.4 AROMA 10/10 APPEARANCE 4/5 TASTE 8/10 PALATE 4/5 OVERALL 18/20Goodfieldnohit(9),10,2,18576,4.4,99.524,3.82061,Anchor Brewing Company,18," Canadian, Texas",4,2981,Porter,http://www.ratebeer.com/beer/anchor-porter/48/18576/,"I had never had a porter before this....definitely liked this one.  Very dark color.  Combines my 3 favorites, chocolate, coffee, and beer.  Highly recommended ",98.566,Goodfieldnohit,California,5.6%,Anchor Porter
0,0,http://www.ratebeer.com/user/18576/beer-ratings/,2180,0,7,4,7,9,3.4 AROMA 5/10 APPEARANCE 4/5 TASTE 7/10 PALATE 4/5 OVERALL 14/20Goodfieldnohit(9),5,2,18576,3.4,56.883,3.108494,Anheuser-Busch InBev,14," Canadian, Texas",4,2180,Premium Bitter/ESB,http://www.ratebeer.com/beer/bass-pale-ale-usa-and-export/133/18576/,"Easy to drink.  I had just played golf and was thirsty, but overall I liked it.  Better than the usual available around here. ",45.73,Goodfieldnohit,Missouri,5%,Bass Pale Ale (USA and export)
