user_num_places_rated,user_num_following,user_url,beer_num_ratings,user_num_friends,user_num_breweries_rated,review_palate_score,review_taste_score,user_num_ratings,review_ratings_blob,review_aroma_score,user_num_countries_rated,user_id,review_avg_score,beer_global_style_score,beer_weighted_avg_score,beer_brewer_name,review_overall_score,user_location,review_appearance_score,beer_num_calories,beer_style,beer_url,review_blob,beer_global_score,user_name,beer_location,beer_ABV,beer_name
0,0,http://www.ratebeer.com/user/223497/beer-ratings/,2630,0,1,5,10,1,5 AROMA 10/10 APPEARANCE 5/5 TASTE 10/10 PALATE 5/5 OVERALL 20/20DRAAKMAN(1),10,1,223497,5,98.405,3.801758,Brouwerij Van Steenberge,20," Cross Roads, ",5,2630,Belgian Strong Ale,http://www.ratebeer.com/beer/gulden-draak/3958/223497/,"Aroma: Caramel, chocolate, nuts with a hint of raisins and dates.
Appearance: Amber red sparkling with minimal tan head.
Taste: Medium sweet low bitterness best temp to drink is 50 ( about 10 to 15 min out of the fridge.
Palate: Full flavor strong delightful finish. 
Overall: The best Belgium Triple out there.
 ",98.352,DRAAKMAN,Belgium,10.5%,Gulden Draak
