user_num_places_rated,user_num_following,user_url,beer_num_ratings,user_num_friends,user_num_breweries_rated,review_palate_score,review_taste_score,user_num_ratings,review_ratings_blob,review_aroma_score,user_num_countries_rated,user_id,review_avg_score,beer_global_style_score,beer_weighted_avg_score,beer_brewer_name,review_overall_score,user_location,review_appearance_score,beer_num_calories,beer_style,beer_url,review_blob,beer_global_score,user_name,beer_location,beer_ABV,beer_name
0,0,http://www.ratebeer.com/user/226258/beer-ratings/,962,0,4,5,10,5,5 AROMA 10/10 APPEARANCE 5/5 TASTE 10/10 PALATE 5/5 OVERALL 20/20Barbaraxx(5),10,3,226258,5,41.212,3.379636,Brouwerij F. Boon,20, Sweden                          ,5,962,Lambic Style - Fruit,http://www.ratebeer.com/beer/boon-kriek/4505/226258/,"Cherry taste all over. Sprizzy refreshing, sweet and yet I am able to drink several of them in a row. ",78.487,Barbaraxx,Belgium,4%,Boon Kriek
0,0,http://www.ratebeer.com/user/226258/beer-ratings/,69,0,4,4,10,5,3.8 AROMA 4/10 APPEARANCE 3/5 TASTE 10/10 PALATE 4/5 OVERALL 17/20Barbaraxx(5),4,3,226258,3.8,97.702,3.496489,De Struise Brouwers,17, Sweden                          ,3,210,Cider,http://www.ratebeer.com/beer/struise-bompon/186726/226258/,Discovered at Stockholm Beer & Whiskey festival. The perfect beer to drink between richer types of beer. Very refreshing. Great beer to introduce to girls/people who dont think they lile beer very much. ,88.786,Barbaraxx,Belgium,7%,Struise Bompon
0,0,http://www.ratebeer.com/user/226258/beer-ratings/,249,0,4,5,9,5,4.1 AROMA 7/10 APPEARANCE 5/5 TASTE 9/10 PALATE 5/5 OVERALL 15/20Barbaraxx(5),7,3,226258,4.1,97.373,4.055637,De Struise Brouwers,15, Sweden                          ,5,249,Imperial Stout,http://www.ratebeer.com/beer/struise-black-damnation-i--black-berry-albert/186722/226258/,"Unbelievable beer experience! Nothing to just drink away. Take your time, relax, be in no hurry while you experience the most rich berry beer explosion in your mouth! ",99.788,Barbaraxx,Belgium,13%,Struise Black Damnation I - Black Berry Albert
0,0,http://www.ratebeer.com/user/226258/beer-ratings/,88,0,4,5,8,5,3.2 AROMA 6/10 APPEARANCE 5/5 TASTE 8/10 PALATE 5/5 OVERALL 8/20Barbaraxx(5),6,3,226258,3.2,58.185,3.047381,Brauhaus Riegele,8, Sweden                          ,5,150,German Hefeweizen,http://www.ratebeer.com/beer/riegele-commerzienrat-riegeles-weisse/50577/226258/,"Great summer beer with the fruity taste of banana. Am usually no Weizen-fan but this one really is one of my favorites. Very refreshing, yet no fruit beer.  ",41.709,Barbaraxx,Germany,5%,Riegele Commerzienrat Riegeles Weisse
0,0,http://www.ratebeer.com/user/226258/beer-ratings/,29,0,4,4,7,5,2.9 AROMA 7/10 APPEARANCE 4/5 TASTE 7/10 PALATE 4/5 OVERALL 7/20Barbaraxx(5),7,3,226258,2.9,71.576,3.045841,Innis & Gunn,7, Sweden                          ,4,159,Golden Ale/Blond Ale,http://www.ratebeer.com/beer/innis-gunn-oak-aged-blonde-beer/41847/226258/,"Great beer. Enjoyed the oak taste and richness of this beer, still not getting tired of the taste throughout one bottle/glas.  ",45.73,Barbaraxx,Scotland,5.3%,Innis & Gunn Oak Aged Blonde Beer 
