user_num_places_rated,user_num_following,user_url,beer_num_ratings,user_num_friends,user_num_breweries_rated,review_palate_score,review_taste_score,user_num_ratings,review_ratings_blob,review_aroma_score,user_num_countries_rated,user_id,review_avg_score,beer_global_style_score,beer_weighted_avg_score,beer_brewer_name,review_overall_score,user_location,review_appearance_score,beer_num_calories,beer_style,beer_url,review_blob,beer_global_score,user_name,beer_location,beer_ABV,beer_name
1,0,http://www.ratebeer.com/user/255846/beer-ratings/,25,0,14,4,7,23,3.8 AROMA 6/10 APPEARANCE 4/5 TASTE 7/10 PALATE 4/5 OVERALL 17/20Danielcrozier(23),6,2,255846,3.8,97.428,3.588757,Sudwerk Brewing Company,17," Vacaville, California",4,270,Imperial Pils/Strong Pale Lager,http://www.ratebeer.com/beer/sudwerk-the-big-dipl/267420/255846/,"Great foamy white head. Strong beta acid smell. Lingering alpha acid taste. Good mix of roasted malts. Four stars for me. 

---Crozier ",93.33,Danielcrozier,California,9%,Sudwerk The Big DIPL
1,0,http://www.ratebeer.com/user/255846/beer-ratings/,4066,0,14,4,9,23,4 AROMA 7/10 APPEARANCE 3/5 TASTE 9/10 PALATE 4/5 OVERALL 17/20Danielcrozier(23),7,2,255846,4,98.136,4.097268,North Coast Brewing Company,17," Vacaville, California",3,4066,Imperial Stout,http://www.ratebeer.com/beer/north-coast-old-rasputin-russian-imperial-stout/680/255846/,"Nice dark color. Thick texture. Great right after snowboarding and chillin in the lodge. 

---Crozier ",99.841,Danielcrozier,California,9%,North Coast Old Rasputin Russian Imperial Stout
1,0,http://www.ratebeer.com/user/255846/beer-ratings/,492,0,14,4,9,23,4.3 AROMA 9/10 APPEARANCE 4/5 TASTE 9/10 PALATE 4/5 OVERALL 17/20Danielcrozier(23),9,2,255846,4.3,97.041,3.630709,Boston Beer Company,17," Vacaville, California",4,492,Abbey Tripel,http://www.ratebeer.com/beer/samuel-adams-barrel-room-collection-new-world-tripel/112477/255846/,"Great beer. I love tripels and this one spoke to me. It told me that pallet and complexity isn&apos;t anything without taste. And this beer had taste. Try it and see. You will become a believer. 

---Crozier ",94.837,Danielcrozier,Massachusetts,10%,Samuel Adams (Barrel Room Collection) New World Tripel
1,0,http://www.ratebeer.com/user/255846/beer-ratings/,503,0,14,4,8,23,3.9 AROMA 7/10 APPEARANCE 4/5 TASTE 8/10 PALATE 4/5 OVERALL 16/20Danielcrozier(23),7,2,255846,3.9,88.786,3.477067,Brasserie des Gants (Brasserie des Lgendes),16," Vacaville, California",4,503,Abbey Tripel,http://www.ratebeer.com/beer/geants-gouyasse-tripel-triple/35390/255846/,"White foamy head. Golden color. Fruity ancient recipe style. Strong bite for a tripel. Not very complex but very well brewed which is a nice retreat in a world of ""want to be"" complex craft brews. Great smack back to the realm of time when craft brew was just brew. 

---Crozier ",87.303,Danielcrozier,Belgium,9%,Gants Gouyasse Tripel (Triple)
1,0,http://www.ratebeer.com/user/255846/beer-ratings/,70,0,14,4,9,23,4.2 AROMA 8/10 APPEARANCE 4/5 TASTE 9/10 PALATE 4/5 OVERALL 17/20Danielcrozier(23),8,2,255846,4.2,90.629,3.734468,Knee Deep Brewing Company,17," Vacaville, California",4,102,Imperial IPA,http://www.ratebeer.com/beer/knee-deep-belgo-hoptologist/202932/255846/,"One of my favorites. Taste is smooth. Great spices. Absolutely an amazing beer 

---Crozier ",97.428,Danielcrozier,California,9%,Knee Deep Belgo Hoptologist
1,0,http://www.ratebeer.com/user/255846/beer-ratings/,1707,0,14,4,7,23,4 AROMA 9/10 APPEARANCE 4/5 TASTE 7/10 PALATE 4/5 OVERALL 16/20Danielcrozier(23),9,2,255846,4,98.405,3.932122,Sierra Nevada Brewing Company,16," Vacaville, California",4,1707,Imperial IPA,http://www.ratebeer.com/beer/sierra-nevada-hoptimum/117825/255846/,"Picked up the four pack as a trial but not expecting much. Had no idea that Sierra Nevada had stepped up the hop game and slam dunked this brew. Absolutely amazed coming from the brewery and price. I&apos;m buying more. 

---Crozier ",99.418,Danielcrozier,California,10.4%,Sierra Nevada Hoptimum
1,0,http://www.ratebeer.com/user/255846/beer-ratings/,2499,0,14,4,10,23,4.4 AROMA 9/10 APPEARANCE 4/5 TASTE 10/10 PALATE 4/5 OVERALL 17/20Danielcrozier(23),9,2,255846,4.4,96.985,3.854011,Dogfish Head Brewery,17," Vacaville, California",4,2499,Imperial IPA,http://www.ratebeer.com/beer/dogfish-head-120-minute-ipa/22904/255846/,"Omg. I love this beer. I have been waiting and trying to get this beer for 1 1/2 years. All the hype and wondering how its going to taste... It didn&apos;t let me down. Hints of fruit. Strong taste of alcohol and spices. Well worth the wait and I can&apos;t wait for the next one. 

---Crozier ",98.887,Danielcrozier,Delaware,18%,Dogfish Head 120 Minute IPA
1,0,http://www.ratebeer.com/user/255846/beer-ratings/,833,0,14,1,1,23,0.8 AROMA 1/10 APPEARANCE 3/5 TASTE 1/10 PALATE 1/5 OVERALL 2/20Danielcrozier(23),1,2,255846,0.8,98.405,3.948118,Russian River Brewing,2," Vacaville, California",3,833,Sour/Wild Ale,http://www.ratebeer.com/beer/russian-river-sanctification/38052/255846/,"I guess I don&apos;t get it. I thought I love all craft brews... Until today. I always heard the hype of this beer style people called sours. And living by Russian River brewery, figured the first one I would have should be the best. The initial aroma was that of rotten moldy vegetables in the bottom produce drawer in my fridge. Then the taste hit me, Athletes foot mixed with fungus. Before you ask, yes it was fresh from the brewery. No aging was done. Never again will I go out of my way to try a sour. It was the first beer I didn&apos;t want to drink. 

---Crozier ",99.471,Danielcrozier,California,6.75%,Russian River Sanctification
1,0,http://www.ratebeer.com/user/255846/beer-ratings/,3735,0,14,4,7,23,3.3 AROMA 6/10 APPEARANCE 4/5 TASTE 7/10 PALATE 4/5 OVERALL 12/20Danielcrozier(23),6,2,255846,3.3,99.788,3.967826,Stone Brewing,12," Vacaville, California",4,3735,India Pale Ale (IPA),http://www.ratebeer.com/beer/stone-ipa-india-pale-ale/422/255846/,"Good beer. Your basic recipe for a good IPA Stone style. Perfect beer to have stocked in the fridge so you can have a good beer when doing yard work or some other manly project. 

---Crozier ",99.524,Danielcrozier,California,6.9%,Stone IPA (India Pale Ale)
1,0,http://www.ratebeer.com/user/255846/beer-ratings/,1647,0,14,4,9,23,4.1 AROMA 8/10 APPEARANCE 4/5 TASTE 9/10 PALATE 4/5 OVERALL 16/20Danielcrozier(23),8,2,255846,4.1,99.524,4.046299,Firestone Walker Brewing (Duvel Moortgat),16," Vacaville, California",4,1647,Imperial IPA,http://www.ratebeer.com/beer/firestone-walker-double-jack-ipa/106045/255846/,"This one did it for me. Complex flavor, great color with good head, strong dry smell and an amazing bite with a smooth finish. For sure made my top ten list of great beers to enjoy anytime. 

---Crozier ",99.788,Danielcrozier,California,9.5%,Firestone Walker Double Jack IPA
1,0,http://www.ratebeer.com/user/255846/beer-ratings/,64,0,14,4,8,23,3.7 AROMA 7/10 APPEARANCE 4/5 TASTE 8/10 PALATE 4/5 OVERALL 14/20Danielcrozier(23),7,2,255846,3.7,88.946,3.718356,Mendocino Brewing Company (United Breweries Group),14," Vacaville, California",4,100,Imperial IPA,http://www.ratebeer.com/beer/mendocino-talon-double-ipa/195411/255846/,"Good beer. 10% ABV. Good amount of bitterness followed by a beautiful rush of orange peel zest. I don&apos;t like IPA&apos;s with strong fruit accents but this brew pulled it off. Well done. 

---Crozier ",97.096,Danielcrozier,California,10%,Mendocino Talon Double IPA
1,0,http://www.ratebeer.com/user/255846/beer-ratings/,671,0,14,4,9,23,4.5 AROMA 10/10 APPEARANCE 4/5 TASTE 9/10 PALATE 4/5 OVERALL 18/20Danielcrozier(23),10,2,255846,4.5,87.472,3.857544,Clown Shoes Beer,18," Vacaville, California",4,671,Imperial Stout,http://www.ratebeer.com/beer/clown-shoes-undead-party-crasher/162827/255846/,"Dark color. Good head. Rich flavor. Taste of fruit, copper, and wood. Love the beer. 

---Crozier ",98.94,Danielcrozier,Massachusetts,10%,Clown Shoes Undead Party Crasher
1,0,http://www.ratebeer.com/user/255846/beer-ratings/,89,0,14,4,8,23,3.9 AROMA 9/10 APPEARANCE 3/5 TASTE 8/10 PALATE 4/5 OVERALL 15/20Danielcrozier(23),9,2,255846,3.9,94.655,3.643845,Knee Deep Brewing Company,15," Vacaville, California",3,225,India Pale Ale (IPA),http://www.ratebeer.com/beer/knee-deep-batch-138-ipa/196931/255846/,"Amber color. Good head. Soft bite at first, then you get the full flavor. Good beer

---Crozier ",95.672,Danielcrozier,California,7.5%,Knee Deep Batch 138 IPA
1,0,http://www.ratebeer.com/user/255846/beer-ratings/,643,0,14,4,9,23,4 AROMA 7/10 APPEARANCE 4/5 TASTE 9/10 PALATE 4/5 OVERALL 16/20Danielcrozier(23),7,2,255846,4,39.417,3.415929,BridgePort Brewing,16," Vacaville, California",4,643,Imperial IPA,http://www.ratebeer.com/beer/bridgeport-hop-czar-imperial-ipa/90738/255846/,"Good dark color. Good head. Great bud aroma. Perfect amount of hops and malts. 

---Crozier ",82.6,Danielcrozier,Oregon,7.5%,BridgePort Hop Czar Imperial IPA
1,0,http://www.ratebeer.com/user/255846/beer-ratings/,1359,0,14,4,8,23,3.8 AROMA 7/10 APPEARANCE 3/5 TASTE 8/10 PALATE 4/5 OVERALL 16/20Danielcrozier(23),7,2,255846,3.8,99.841,3.99018,Russian River Brewing,16," Vacaville, California",3,1359,India Pale Ale (IPA),http://www.ratebeer.com/beer/russian-river-blind-pig-ipa/48429/255846/,"Light color. 2 finger head. Easy on the pallet. Taste of tropical fruit... And a hint of pine. Good starter beer to build your pallet. 

---Crozier ",99.63,Danielcrozier,California,6.1%,Russian River Blind Pig IPA
1,0,http://www.ratebeer.com/user/255846/beer-ratings/,2757,0,14,5,9,23,4.3 AROMA 8/10 APPEARANCE 4/5 TASTE 9/10 PALATE 5/5 OVERALL 17/20Danielcrozier(23),8,2,255846,4.3,,4.273134,Russian River Brewing,17," Vacaville, California",4,2757,Imperial IPA,http://www.ratebeer.com/beer/russian-river-pliny-the-elder/8936/255846/,"Deep bid smell. Good head. Taste of pine nuts and wood. Very good beer overall. 

---Crozier ",,Danielcrozier,California,8%,Russian River Pliny the Elder
1,0,http://www.ratebeer.com/user/255846/beer-ratings/,21,0,14,4,6,23,3.8 AROMA 9/10 APPEARANCE 3/5 TASTE 6/10 PALATE 4/5 OVERALL 16/20Danielcrozier(23),9,2,255846,3.8,52.206,3.458089,Ruhstaller,16," Vacaville, California",3,186,American Strong Ale,http://www.ratebeer.com/beer/ruhstaller-the-kenyan-v2/212244/255846/,"Good aroma. 1/2"" head. The coffee is a bit to overpowering. I would have liked to see the coffee being used in a porter or any stronger beer. Overall a good beer though. 

---Crozier ",86.789,Danielcrozier,California,6.2%,Ruhstaller The Kenyan [v.2]
1,0,http://www.ratebeer.com/user/255846/beer-ratings/,2108,0,14,4,9,23,4.5 AROMA 10/10 APPEARANCE 4/5 TASTE 9/10 PALATE 4/5 OVERALL 18/20Danielcrozier(23),10,2,255846,4.5,98.673,3.905295,Dogfish Head Brewery,18," Vacaville, California",4,2108,American Strong Ale,http://www.ratebeer.com/beer/dogfish-head-palo-santo-marron/66797/255846/,"Dark woody taste with a sweeter aftertaste. Very thick and dark. Pours heavy. Overall a good beer. 

---Crozier ",99.259,Danielcrozier,Delaware,12%,Dogfish Head Palo Santo Marron
1,0,http://www.ratebeer.com/user/255846/beer-ratings/,2152,0,14,3,8,23,2.9 AROMA 3/10 APPEARANCE 3/5 TASTE 8/10 PALATE 3/5 OVERALL 12/20Danielcrozier(23),3,2,255846,2.9,96.365,3.505816,Dogfish Head Brewery,12," Vacaville, California",3,2152,Traditional Ale,http://www.ratebeer.com/beer/dogfish-head-midas-touch-golden-elixir/7293/255846/,"It&apos;s a good light beer. Very sweet. Very light head. Good representation of a corn beer. 

---Crozier ",89.339,Danielcrozier,Delaware,9%,Dogfish Head Midas Touch Golden Elixir
1,0,http://www.ratebeer.com/user/255846/beer-ratings/,1659,0,14,4,9,23,4.2 AROMA 9/10 APPEARANCE 4/5 TASTE 9/10 PALATE 4/5 OVERALL 16/20Danielcrozier(23),9,2,255846,4.2,99.577,4.066717,Stone Brewing,16," Vacaville, California",4,1659,Imperial IPA,http://www.ratebeer.com/beer/stone-enjoy-by-ipa/183117/255846/,"Good choice of spices. Tastes of fruit zest. Good hops. Lower IBU&apos;S for my taste but very good balance of flavors. Great beer to give your friend that you want to love IPA&apos;s. 

---Crozier ",99.788,Danielcrozier,California,9.4%,Stone Enjoy By IPA
1,0,http://www.ratebeer.com/user/255846/beer-ratings/,1132,0,14,4,9,23,4.4 AROMA 9/10 APPEARANCE 4/5 TASTE 9/10 PALATE 4/5 OVERALL 18/20Danielcrozier(23),9,2,255846,4.4,99.206,4.000085,Stone Brewing,18," Vacaville, California",4,1132,Imperial IPA,http://www.ratebeer.com/beer/stone-ruinten-ipa/171722/255846/,"Every hop heads dream. First sniff and you think you might be in over your head. Extremely bitter! Love it love it love it! If you like high IBU&apos;s then this is a must have on stock for your fridge. 

---Crozier ",99.63,Danielcrozier,California,10.8%,Stone RuinTen IPA
1,0,http://www.ratebeer.com/user/255846/beer-ratings/,3421,0,14,4,7,23,4 AROMA 7/10 APPEARANCE 4/5 TASTE 7/10 PALATE 4/5 OVERALL 18/20Danielcrozier(23),7,2,255846,4,97.974,3.756386,Dogfish Head Brewery,18," Vacaville, California",4,3421,India Pale Ale (IPA),http://www.ratebeer.com/beer/dogfish-head-60-minute-ipa/7431/255846/,"Good taste. Full body. Good head. Not a bad beer to hang back and relax on. 

---Crozier ",97.756,Danielcrozier,Delaware,6%,Dogfish Head 60 Minute IPA
1,0,http://www.ratebeer.com/user/255846/beer-ratings/,3080,0,14,5,9,23,4.6 AROMA 9/10 APPEARANCE 4/5 TASTE 9/10 PALATE 5/5 OVERALL 19/20Danielcrozier(23),9,2,255846,4.6,99.259,4.1828,Stone Brewing,19," Vacaville, California",4,3080,Imperial Stout,http://www.ratebeer.com/beer/stone-imperial-russian-stout/4315/255846/,Good aroma. Never thought I would like the espresso mix but I did. Low bite but the espresso hangs in there from start to finish.  ,99.947,Danielcrozier,California,10.5%,Stone Imperial Russian Stout
