user_num_places_rated,user_num_following,user_url,beer_num_ratings,user_num_friends,user_num_breweries_rated,review_palate_score,review_taste_score,user_num_ratings,review_ratings_blob,review_aroma_score,user_num_countries_rated,user_id,review_avg_score,beer_global_style_score,beer_weighted_avg_score,beer_brewer_name,review_overall_score,user_location,review_appearance_score,beer_num_calories,beer_style,beer_url,review_blob,beer_global_score,user_name,beer_location,beer_ABV,beer_name
0,0,http://www.ratebeer.com/user/26751/beer-ratings/,1633,0,28,5,10,65,4.9 AROMA 10/10 APPEARANCE 5/5 TASTE 10/10 PALATE 5/5 OVERALL 19/20BetterRedFred(65),10,6,26751,4.9,88.946,3.569116,New Belgium Brewing Company,19," Los Alamos, New Mexico",5,1633,India Pale Ale (IPA),http://www.ratebeer.com/beer/new-belgium-ranger-ipa/108325/26751/,"Very nice.  Exceptionally smooth and balanced. Very similar to ODells IPA, which I like very much as well.  Malt and yeast balance much better than Stone, which I hold as the standard of a ""pure"" west coast IPA.  Appearance is also distinguished by lasting white head and lacing, nice orange color, and excellent activity. Might be the best overall balanced IPA Ive had yet. ",92.467,BetterRedFred,Colorado,6.5%,New Belgium Ranger IPA
0,0,http://www.ratebeer.com/user/26751/beer-ratings/,830,0,28,2,4,65,2.4 AROMA 5/10 APPEARANCE 3/5 TASTE 4/10 PALATE 2/5 OVERALL 10/20BetterRedFred(65),5,6,26751,2.4,86.702,3.212427,Sierra Nevada Brewing Company,10," Los Alamos, New Mexico",3,830,Heller Bock,http://www.ratebeer.com/beer/sierra-nevada-glissade-golden-bock/113317/26751/,"Tasty brew for the style.  Quite reminescent of all those German Bocks I quaffed back in the day  My only real complaint comes against the style itself.  Pilsener Bocks simply dont have the substance to carry the high alcohol content without it being objectionably noticeable.  It always comes across as a spiked pilsener, which is simply not a good thing IMO. In spite of that complaint, this is a very good offering for the style, and a nice change of pace for one accustomed to strong IPAs. ",54.99,BetterRedFred,California,6.4%,Sierra Nevada Glissade Golden Bock
0,0,http://www.ratebeer.com/user/26751/beer-ratings/,1360,0,28,3,6,65,3 AROMA 5/10 APPEARANCE 3/5 TASTE 6/10 PALATE 3/5 OVERALL 13/20BetterRedFred(65),5,6,26751,3,97.096,3.361059,Boston Beer Company,13," Los Alamos, New Mexico",3,1360,Pilsener,http://www.ratebeer.com/beer/samuel-adams-noble-pils/107598/26751/,"Distinct taste of lemon right up front -  not at all objectionable.  Traditional European pils taste hides subtly in the background.  Couldnt detect it at first for the lemony attack.  Lacing is extraordinary for a pils, and the body is much more robust as well.  Not a bad pilsener at all.  Much more character than most Ive tried.  Very refreshing after a winter (its very springlike here in NM today) of heavy IPAs.  Nice playoff football watching quaff, for sure. ",76.672,BetterRedFred,Massachusetts,5.24%,Samuel Adams Noble Pils
0,0,http://www.ratebeer.com/user/26751/beer-ratings/,360,0,28,3,8,65,3 AROMA 4/10 APPEARANCE 3/5 TASTE 8/10 PALATE 3/5 OVERALL 12/20BetterRedFred(65),4,6,26751,3,2.059,2.174264,Anheuser-Busch InBev,12," Los Alamos, New Mexico",3,360,Wheat Ale,http://www.ratebeer.com/beer/bud-light-golden-wheat/107512/26751/,"Quite decent offering in a macro-brewed light beer.  Picked up a twelve on a hunch when I was in the mood for some light-weight sipping brew, and was not disappointed.  This would really be quite excellent in the heat of the summer, and would be an excellent change of pace for holiday gatherings as well.  Nice introduction to wheat beer, which can tend to be a little overwhelming to a novice.  Hats off to Budweiser for daring to offer a very tasty alternative to the mainstream light beer market.  This is really quite an innovative move on their part. ",6.302,BetterRedFred,Missouri,4.1%,Bud Light Golden Wheat
0,0,http://www.ratebeer.com/user/26751/beer-ratings/,314,0,28,5,10,65,4.9 AROMA 10/10 APPEARANCE 5/5 TASTE 10/10 PALATE 5/5 OVERALL 19/20BetterRedFred(65),10,6,26751,4.9,45.73,3.309562,Widmer Brothers Brewing Company,19," Los Alamos, New Mexico",5,314,India Pale Ale (IPA),http://www.ratebeer.com/beer/widmer-brothers-broken-halo-ipa/57728/26751/,"UPDATED: NOV 29, 2009",70.168,BetterRedFred,Oregon,6%,Widmer Brothers Broken Halo IPA
0,0,http://www.ratebeer.com/user/26751/beer-ratings/,3386,0,28,3,5,65,2.7 AROMA 5/10 APPEARANCE 4/5 TASTE 5/10 PALATE 3/5 OVERALL 10/20BetterRedFred(65),5,6,26751,2.7,97.483,3.732972,Sierra Nevada Brewing Company,10," Los Alamos, New Mexico",4,3386,India Pale Ale (IPA),http://www.ratebeer.com/beer/sierra-nevada-torpedo-extra-ipa/59261/26751/,"Interesting, but like the other SN IPA Ive tried, tastes NOTHING like an IPA.  Some sort of mild fruity pineappple/grapfruit thing going on across the middle of the palate, but little else.  A good beer, but certainly nothing remarkable.  Hops?  I couldnt taste any.  Tastes more like a confused strong amber/ice bock to me.  ",97.373,BetterRedFred,California,7.2%,Sierra Nevada Torpedo Extra IPA
0,0,http://www.ratebeer.com/user/26751/beer-ratings/,799,0,28,3,5,65,2.8 AROMA 5/10 APPEARANCE 3/5 TASTE 5/10 PALATE 3/5 OVERALL 12/20BetterRedFred(65),5,6,26751,2.8,88.706,3.29448,Odell Brewing Company,12," Los Alamos, New Mexico",3,799,Scottish Ale,http://www.ratebeer.com/beer/odell-90-shilling/2177/26751/,"Lots of chocolate in this one, especially for an amber.  Sort of an Irish Stout meets and Irish Red IMO.  Balanced and tasty for a change pace, but certainly nothing to go out of your way for.  Sam Adams Irish Red tastes better, is easier to find, and costs less.  Need I say more?  ",67.402,BetterRedFred,Colorado,5.3%,Odell 90 Shilling
0,0,http://www.ratebeer.com/user/26751/beer-ratings/,581,0,28,2,2,65,2 AROMA 5/10 APPEARANCE 3/5 TASTE 2/10 PALATE 2/5 OVERALL 8/20BetterRedFred(65),5,6,26751,2,96.817,3.334662,Odell Brewing Company,8," Los Alamos, New Mexico",3,581,English Pale Ale,http://www.ratebeer.com/beer/odell-5-barrel-pale-ale/43776/26751/,"Im confused.  Maybe my six pack somehow bypassed the hops process.  This beer was as unobjectionable as it is unremarkable.  Surprising, since I loved their IPA.  Keep a six of this on hand to satisfy your mainstream beer friends and impress them with your knowledge of micro brews.  Other than that, pass. ",73.449,BetterRedFred,Colorado,5.2%,Odell 5 Barrel Pale Ale
0,0,http://www.ratebeer.com/user/26751/beer-ratings/,899,0,28,5,10,65,4.5 AROMA 8/10 APPEARANCE 4/5 TASTE 10/10 PALATE 5/5 OVERALL 18/20BetterRedFred(65),8,6,26751,4.5,98.19,3.766811,Odell Brewing Company,18," Los Alamos, New Mexico",4,899,India Pale Ale (IPA),http://www.ratebeer.com/beer/odell-india-pale-ale-ipa/70770/26751/,"UPDATED: JAN 30, 2009",97.865,BetterRedFred,Colorado,7%,Odell India Pale Ale (IPA)
0,0,http://www.ratebeer.com/user/26751/beer-ratings/,778,0,28,2,5,65,2.4 AROMA 5/10 APPEARANCE 2/5 TASTE 5/10 PALATE 2/5 OVERALL 10/20BetterRedFred(65),5,6,26751,2.4,49.153,3.240226,Boulevard Brewing Company (Duvel-Moortgat),10," Los Alamos, New Mexico",2,778,American Pale Ale,http://www.ratebeer.com/beer/boulevard-pale-ale/113/26751/,"Bottle, Emporia Kansas.  Average and unadventurous, albeit well-balanced APA.  Very ""midwest"" to my tastes - conservative and unlikely to offend anyone, just not likely to make anyone scream its praises either.  Unfortunately, Im not much into balanced APAs or IPAs, hence the low rating. ",59.192,BetterRedFred,Missouri,5.4%,Boulevard Pale Ale
0,0,http://www.ratebeer.com/user/26751/beer-ratings/,814,0,28,1,5,65,2 AROMA 8/10 APPEARANCE 2/5 TASTE 5/10 PALATE 1/5 OVERALL 4/20BetterRedFred(65),8,6,26751,2,13.993,2.682552,Anheuser-Busch InBev,4," Los Alamos, New Mexico",2,814,Amber Ale,http://www.ratebeer.com/beer/budweiser-american-ale/90235/26751/,"Actually, not as absolutely as piss poor as I thought it would be.  Color, aroma, and taste were all acceptable for something coming from Budweiser.  Nothing Ill pay money for again, but not a drain pour.  The worst part of this whole experience was drinking the 3.2 version of this shit in a shitty motel room in Weathorford OK of all the fucked up holes in the universe, and knowing this was the BEST shit that could be found in town.  Why would ANYONE choose to live here?

What the FUCK is up with the apostrophe warning?  Is this website based in OK per chance? ",18.863,BetterRedFred,Missouri,5.3%,Budweiser American Ale
0,0,http://www.ratebeer.com/user/26751/beer-ratings/,4330,0,28,2,5,65,2.5 AROMA 5/10 APPEARANCE 3/5 TASTE 5/10 PALATE 2/5 OVERALL 10/20BetterRedFred(65),5,6,26751,2.5,95.963,3.21647,Boston Beer Company,10," Los Alamos, New Mexico",3,4330,Amber Lager/Vienna,http://www.ratebeer.com/beer/samuel-adams-boston-lager/158/26751/,"I refer back to this one every now and then as a benchmark to see how my tastes have changed.  The malt and hops tastes in the commercial deScription are always right on, but the weak, watery, character that the ad guys wont tell you about is always there too.  Maybe I just cant take lagers anymore, I dunno.  If youre used to slamming light beers all day, this will definitely be a move up.  If youre used to sampling even the moderately better brews out there, save your money. ",55.282,BetterRedFred,Massachusetts,4.9%,Samuel Adams Boston Lager
0,0,http://www.ratebeer.com/user/26751/beer-ratings/,1029,0,28,3,5,65,3.2 AROMA 8/10 APPEARANCE 4/5 TASTE 5/10 PALATE 3/5 OVERALL 12/20BetterRedFred(65),8,6,26751,3.2,82.699,3.134299,Boston Beer Company,12," Los Alamos, New Mexico",4,1029,Irish Ale,http://www.ratebeer.com/beer/samuel-adams-irish-red-ale/72240/26751/,"Very decent red.  Nice fluffy white head, impressive lacing, beautiful color color, fragrant nose, and excellent bitter-sweet taste, true to the style.  Not over the top ABV wise either.  Not complex in any way like an Arrogant Bastard for instance, but not everyone appreciates such over the top brews anyway.  Very good everymans brew. ",47.152,BetterRedFred,Massachusetts,5.8%,Samuel Adams Irish Red Ale
0,0,http://www.ratebeer.com/user/26751/beer-ratings/,831,0,28,4,9,65,4 AROMA 8/10 APPEARANCE 4/5 TASTE 9/10 PALATE 4/5 OVERALL 15/20BetterRedFred(65),8,6,26751,4,31.996,3.198219,Full Sail Brewing Company,15," Los Alamos, New Mexico",4,831,India Pale Ale (IPA),http://www.ratebeer.com/beer/full-sail-ipa/559/26751/,"Although Im a devotee of Stone IPA and have not been a fan of Full Sail offerings Ive tried in the past, I must admit this stuff is one of the more balanced and better IPAs Ive tried. A nice malty presence for an IPA (and as a true Stoney, I view a hefty malt presence as offensive), without being overly heavy.  The bitter floral hops notes are all there, but not over the top.  My bottle was marked at 6.0 ABV, and I find that to be the ideal.  All in all, very good stuff.  I dont like many IPAs, but this one is very good indeed. ",52.94,BetterRedFred,Oregon,6%,Full Sail IPA
0,0,http://www.ratebeer.com/user/26751/beer-ratings/,2606,0,28,5,10,65,4.9 AROMA 10/10 APPEARANCE 5/5 TASTE 10/10 PALATE 5/5 OVERALL 19/20BetterRedFred(65),10,6,26751,4.9,99.788,3.618862,Fullers,19," Los Alamos, New Mexico",5,2606,Premium Bitter/ESB,http://www.ratebeer.com/beer/fullers-esb-bottle-keg/290/26751/,"FINALLY found this one for $11.25 @ sixer in a HyVee gocery store in Council Bluffs IA of all places.  I was knocked out by the taste, and am now on a quest to find more in the Albuquerque-Santa Fe region of NM.  Local dealers give me phantom sightings (""we JUST had some""), but no actual results just yet.  I might have to rent a truck and haul it in myself.  This stuff was mothers-milk smooth with a 6% ABV kick.  Smoothest brew Ive drunk that I can remember.  If this was freely available, Id drink nothing else (well, at least for a while).  Exceptional! ",94.408,BetterRedFred,England,5.9%,Fullers ESB (Bottle/Keg)
0,0,http://www.ratebeer.com/user/26751/beer-ratings/,2186,0,28,5,10,65,4.6 AROMA 8/10 APPEARANCE 5/5 TASTE 10/10 PALATE 5/5 OVERALL 18/20BetterRedFred(65),8,6,26751,4.6,96.422,3.392261,Fullers,18," Los Alamos, New Mexico",5,2186,Premium Bitter/ESB,http://www.ratebeer.com/beer/fullers-london-pride-pasteurised/288/26751/,"Finally found this stuff.  Tried both the PA and the ESB in bottles from a HyVee in Council Bluffs IA for $11.25 @ sixer at that.  I had heard many good reviews of the Fuller ESB in particular, and I was quite impressed with both.  The London Pride PA seemed a bit weak in the knees at 4.7%, but on the plus side, that would make it quite sessionable (albeit at a VERY steep price).  Very complex as advertised, especially when compared to typical US West Coast offerings, which are typically bolder by a large measure.  Fullers is now on my ""must have"" radar when its available, as its most decidedly not in the NM, Colorado region that I frequent. ",79.8,BetterRedFred,England,4.7%,Fullers London Pride (Pasteurised)
0,0,http://www.ratebeer.com/user/26751/beer-ratings/,3968,0,28,1,2,65,1 AROMA 1/10 APPEARANCE 1/5 TASTE 2/10 PALATE 1/5 OVERALL 5/20BetterRedFred(65),1,6,26751,1,3.087,1.456147,Anheuser-Busch InBev,5," Los Alamos, New Mexico",1,3968,Pale Lager,http://www.ratebeer.com/beer/budweiser/473/26751/,"A good, almost tasteless alternative for a hot summer day, when you mostly need water for hydration, but want a minimal amount of alcoholic kick and taste as well.  Bud fills that niche well, but not much else.  Best taste in its category, although thats not saying much either.  Ive always liked the packaging though.  Definitely best in class.  Their advertising is always first rate too.  Hey, cant blame em for trying!  Their sales figures obviously dont lie. ",0.147,BetterRedFred,Missouri,5%,Budweiser
0,0,http://www.ratebeer.com/user/26751/beer-ratings/,2375,0,28,2,3,65,1.5 AROMA 3/10 APPEARANCE 2/5 TASTE 3/10 PALATE 2/5 OVERALL 5/20BetterRedFred(65),3,6,26751,1.5,94.958,3.583831,Sierra Nevada Brewing Company,5," Los Alamos, New Mexico",2,2375,Porter,http://www.ratebeer.com/beer/sierra-nevada-porter/366/26751/,"Not a fan of dark beers, but I read up on Stouts and Porters (couldnt find a definitive difference bewteen the two) before comparing SN Stout and SN Porter head to head today in honor of St. Pats.  This is simply no contest.  If you like this style, SN Stout is head, shoulders, elbows, hips, and knees above this subpar offering in every way.  Overcarbonated, watery, and lacking in character and complexity.  What more can I say?  Very nearly a drain pour. ",93.134,BetterRedFred,California,5.6%,Sierra Nevada Porter
0,0,http://www.ratebeer.com/user/26751/beer-ratings/,2044,0,28,4,5,65,3.5 AROMA 8/10 APPEARANCE 3/5 TASTE 5/10 PALATE 4/5 OVERALL 15/20BetterRedFred(65),8,6,26751,3.5,94.284,3.591294,Sierra Nevada Brewing Company,15," Los Alamos, New Mexico",3,2044,Stout,http://www.ratebeer.com/beer/sierra-nevada-stout/367/26751/,"Not a fan of this style, but in honor of St. Pattys day, Im doing a head to head with this and a SN Porter from the bottle, along with some corned beef and cabbage.  Both are similar in appearance (the beers), with the Porter notably more carbonated in an unappealing way.  In short, even though the Stout was served several degrees colder, it simply blows away the Porter in complexity, depth, and all things dark and mysterious.  In fact, the Porter would be better labeled a Stout Light if truth in advertising meant anything.  Skip the Porter, try the Stout if youre into this sort of thing. ",93.395,BetterRedFred,California,5.8%,Sierra Nevada Stout
0,0,http://www.ratebeer.com/user/26751/beer-ratings/,746,0,28,3,7,65,3 AROMA 5/10 APPEARANCE 3/5 TASTE 7/10 PALATE 3/5 OVERALL 12/20BetterRedFred(65),5,6,26751,3,97.041,3.386152,Sierra Nevada Brewing Company,12," Los Alamos, New Mexico",3,746,Premium Bitter/ESB,http://www.ratebeer.com/beer/sierra-nevada-early-spring-beer-esb/82791/26751/,"Been a while since I had an ESB, but this ones better than most.  Im an IPA guy now, so this tastes a little tame for me, but Ill give it a go anyway.  Nice amber color and white head with decent lacing and staying power.  Very nice change of pace from traditional SN brews, which all taste very similar to me.  Not as bitter as the ESBs I remember, but not as thin and watery either.  I doubt the ESB guys will call this one world class for its lack of defining character, but I doubt SN intended it for that anyway. 6% ABV is just right too.  Since this ones a seasonal, Ill probably lay in a case or two for future review.  SN always produces good stuff, and this ones no exception. ",85.458,BetterRedFred,California,5.9%,Sierra Nevada Early Spring Beer (ESB)
0,0,http://www.ratebeer.com/user/26751/beer-ratings/,2220,0,28,5,10,65,5 AROMA 10/10 APPEARANCE 5/5 TASTE 10/10 PALATE 5/5 OVERALL 20/20BetterRedFred(65),10,6,26751,5,97.152,3.82996,Stone Brewing,20," Los Alamos, New Mexico",5,2220,American Strong Ale,http://www.ratebeer.com/beer/arrogant-bastard-ale--oaked/39654/26751/,"UPDATED: JAN 18, 2008",98.673,BetterRedFred,California,7.2%,Arrogant Bastard Ale - Oaked
0,0,http://www.ratebeer.com/user/26751/beer-ratings/,3643,0,28,2,2,65,1.6 AROMA 6/10 APPEARANCE 2/5 TASTE 2/10 PALATE 2/5 OVERALL 4/20BetterRedFred(65),6,6,26751,1.6,92.67,3.259444,Plzensky Prazdroj (SABMiller),4," Los Alamos, New Mexico",2,3643,Czech Pilsner (Svtl),http://www.ratebeer.com/beer/pilsner-urquell/717/26751/,"Reminds me of my first German Pils; thin, bitter, and stinky, just not as good.
Decent for the style, but really now; why would anyone drink more than one of these, regardless of what else was available (Listerine anyone)?
Im guesing that in a blind taste test (minus all the ""original Pilsener"" hype) this one would score MUCH lower than it has.
Sorry, I find nothing remarkable here, other than peoples amazing response to hype. ",62.177,BetterRedFred,Czech Republic,4.4%,Pilsner Urquell 
0,0,http://www.ratebeer.com/user/26751/beer-ratings/,1715,0,28,5,10,65,4.9 AROMA 10/10 APPEARANCE 5/5 TASTE 10/10 PALATE 5/5 OVERALL 19/20BetterRedFred(65),10,6,26751,4.9,97.041,3.607933,Stone Brewing,19," Los Alamos, New Mexico",5,1715,American Pale Ale,http://www.ratebeer.com/beer/stone-pale-ale/420/26751/,"Im a big Stone fan like many posters on this board, but Im probably going against the grain when I say that I think this is one of their best.  No, this ones not over the top in the hops dept. like their famous IPAs, and I think it might almost be misclassified as an American pale ale as well.  What it is, is an exceptionally well balanced pale/amber ale, with no overwhelmingly pronounced single characteristic.  Its actually what I expect every Oktoberfest beer to be,  only to be so quickly dissappointed once the first cap comes off.

This is an EXCEPTIONAL beer, whether or not its true to the American pale ale style or imagined Stone standard for hoppiness or not.  I love it! ",94.097,BetterRedFred,California,5.4%,Stone Pale Ale
0,0,http://www.ratebeer.com/user/26751/beer-ratings/,2654,0,28,2,8,65,3 AROMA 5/10 APPEARANCE 3/5 TASTE 8/10 PALATE 2/5 OVERALL 12/20BetterRedFred(65),5,6,26751,3,91.988,3.232411,Boston Beer Company,12," Los Alamos, New Mexico",3,2654,Oktoberfest/Mrzen,http://www.ratebeer.com/beer/samuel-adams-octoberfest/167/26751/,"UPDATED: SEP 26, 2008",58.761,BetterRedFred,Massachusetts,5.3%,Samuel Adams Octoberfest
0,0,http://www.ratebeer.com/user/26751/beer-ratings/,912,0,28,4,8,65,3.8 AROMA 6/10 APPEARANCE 4/5 TASTE 8/10 PALATE 4/5 OVERALL 16/20BetterRedFred(65),6,6,26751,3.8,48.62,3.044575,Mendocino Brewing Company (United Breweries Group),16," Los Alamos, New Mexico",4,912,Amber Ale,http://www.ratebeer.com/beer/mendocino-red-tail-ale/353/26751/,"A pleasant surprise!  Best Mendocino offering Ive tried.  Not over the top alcohol-wise like their Eye of the Hawk and IPA.  Quite good overall; one of the better ambers Ive tried.  No weird aftertastes, like many of this style seem to have. Ill probably be coming back to this one often.  I think the 52 current rating is considerably understated. ",41.212,BetterRedFred,California,6%,Mendocino Red Tail Ale
0,0,http://www.ratebeer.com/user/26751/beer-ratings/,3670,0,28,2,3,65,1.5 AROMA 6/10 APPEARANCE 2/5 TASTE 3/10 PALATE 2/5 OVERALL 2/20BetterRedFred(65),6,6,26751,1.5,47.373,2.091399,Heineken Nederland,2," Los Alamos, New Mexico",2,3670,Pale Lager,http://www.ratebeer.com/beer/heineken/37/26751/,"UPDATED: JAN 8, 2008",4.552,BetterRedFred,Netherlands,5%,Heineken
0,0,http://www.ratebeer.com/user/26751/beer-ratings/,3514,0,28,4,7,65,3.8 AROMA 8/10 APPEARANCE 4/5 TASTE 7/10 PALATE 4/5 OVERALL 15/20BetterRedFred(65),8,6,26751,3.8,97.919,3.753832,Sierra Nevada Brewing Company,15," Los Alamos, New Mexico",4,3514,India Pale Ale (IPA),http://www.ratebeer.com/beer/sierra-nevada-celebration-ale/370/26751/,"Nice, medium-high alcohol, holiday fest-brew.  Not as hoppy as Ive come to expect and prefer, but a good middle of the road offering nonetheless, thats more likely to appeal to the broad variety of palates that gatherings this time of year are likely to include.  SN has gradually become the ""quality Budweiser"" of American brews in my opinion, an altogether good thing I think.  Lets hope they dont water down their offerings as well to attract an even wider market share. ",97.702,BetterRedFred,California,6.8%,Sierra Nevada Celebration Ale
0,0,http://www.ratebeer.com/user/26751/beer-ratings/,1254,0,28,3,4,65,2 AROMA 5/10 APPEARANCE 3/5 TASTE 4/10 PALATE 3/5 OVERALL 5/20BetterRedFred(65),5,6,26751,2,88.056,3.561079,Deschutes Brewery,5," Los Alamos, New Mexico",3,1254,India Pale Ale (IPA),http://www.ratebeer.com/beer/deschutes-inversion-ipa/55610/26751/,"UPDATED: OCT 10, 2007",92.126,BetterRedFred,Oregon,6.8%,Deschutes Inversion IPA
0,0,http://www.ratebeer.com/user/26751/beer-ratings/,483,0,28,4,9,65,4.3 AROMA 8/10 APPEARANCE 4/5 TASTE 9/10 PALATE 4/5 OVERALL 18/20BetterRedFred(65),8,6,26751,4.3,86.528,3.641215,Stone Brewing,18," Los Alamos, New Mexico",4,483,American Strong Ale,http://www.ratebeer.com/beer/stone-9th-anniversary-ale/50440/26751/,"Wow - Stone does it again!  Picked up two bombers - dont usually like wheats, hedged my bet with Stone IPA - wish Id bought some more.  This ones like an over the top wheat/IPA or something.  All the cloudiness and complexity of a good wheat, with the typical hops bite of a Stone.  The alcohol comes through a little too clearly, but other than that, a VERY fine brew.  Definitely gonna pick up a case or two for long-term appreciation. ",95.377,BetterRedFred,California,7.8%,Stone 9th Anniversary Ale
0,0,http://www.ratebeer.com/user/26751/beer-ratings/,3698,0,28,4,5,65,3.5 AROMA 8/10 APPEARANCE 4/5 TASTE 5/10 PALATE 4/5 OVERALL 14/20BetterRedFred(65),8,6,26751,3.5,99.418,4.034443,Stone Brewing,14," Los Alamos, New Mexico",4,3698,Imperial IPA,http://www.ratebeer.com/beer/stone-ruination-ipa/14709/26751/,"UPDATED: JAN 30, 2009",99.736,BetterRedFred,California,8.2%,Stone Ruination IPA
0,0,http://www.ratebeer.com/user/26751/beer-ratings/,824,0,28,2,5,65,2.7 AROMA 7/10 APPEARANCE 3/5 TASTE 5/10 PALATE 2/5 OVERALL 10/20BetterRedFred(65),7,6,26751,2.7,44.346,2.879765,Sierra Nevada Brewing Company,10," Los Alamos, New Mexico",3,824,Wheat Ale,http://www.ratebeer.com/beer/sierra-nevada-wheat/368/26751/,"Decent, different take on a Wheat.  As most here have noted, this one doesnt really clearly fall into distinct any category, so just take it for what it is.  Sort of a wheat-malt distinctly lemony pilsener maybe?  Nice change-up offering for summer, but I wouldnt go out of my way looking for it or anything.  Try one at a friends house if possible - saves buying (and not finishing) a sixer. ",30.122,BetterRedFred,California,4.4%,Sierra Nevada Wheat
0,0,http://www.ratebeer.com/user/26751/beer-ratings/,1392,0,28,3,7,65,3.5 AROMA 6/10 APPEARANCE 4/5 TASTE 7/10 PALATE 3/5 OVERALL 15/20BetterRedFred(65),6,6,26751,3.5,43.781,2.889741,Widmer Brothers Brewing Company,15," Los Alamos, New Mexico",4,1392,Wheat Ale,http://www.ratebeer.com/beer/widmer-brothers-hefeweizen/606/26751/,"Sampled this head to head vs a Sierra Nevad a Wheat.  Two different approaches, but very comparable results.  Widmer is cloudier and truer to the style, although definitely lacking in complexity of character, as many other reviewers have noted.  Even so, a good Wheat for those who dont enjoy the extreme fruitiness of the higher rated Wheats. ",29.367,BetterRedFred,Oregon,4.7%,Widmer Brothers Hefeweizen
0,0,http://www.ratebeer.com/user/26751/beer-ratings/,2901,0,28,4,8,65,4.3 AROMA 8/10 APPEARANCE 5/5 TASTE 8/10 PALATE 4/5 OVERALL 18/20BetterRedFred(65),8,6,26751,4.3,99.63,3.581276,Paulaner Brauerei (Schrghuber),18," Los Alamos, New Mexico",5,2901,German Hefeweizen,http://www.ratebeer.com/beer/paulaner-hefe-weissbier-hefe-weizen-55/647/26751/,"Never been a fan of wheats, but this is a good one.  Tastes almost like an exotic fruit juice.  Frothy white head and decent lacing, opaque tangerine color, spicy and fruity flavor.  This one might make me a convert.  VERY nice. ",93.002,BetterRedFred,Germany,5.5%,Paulaner Hefe-Weissbier (Hefe-Weizen) (5.5%)
0,0,http://www.ratebeer.com/user/26751/beer-ratings/,247,0,28,3,5,65,3.1 AROMA 5/10 APPEARANCE 3/5 TASTE 5/10 PALATE 3/5 OVERALL 15/20BetterRedFred(65),5,6,26751,3.1,20.038,2.696444,Petes Brewing Company,15," Los Alamos, New Mexico",3,247,Golden Ale/Blond Ale,http://www.ratebeer.com/beer/petes-wicked-rally-cap-ale/32879/26751/,"One of Petes better offerings.  Decent, quickly diminishing head on pour, and good activity after.  Nice summer offering with minimal hops bite. ",20.297,BetterRedFred,Texas,5%,Petes Wicked Rally Cap Ale
