user_num_places_rated,user_num_following,user_url,beer_num_ratings,user_num_friends,user_num_breweries_rated,review_palate_score,review_taste_score,user_num_ratings,review_ratings_blob,review_aroma_score,user_num_countries_rated,user_id,review_avg_score,beer_global_style_score,beer_weighted_avg_score,beer_brewer_name,review_overall_score,user_location,review_appearance_score,beer_num_calories,beer_style,beer_url,review_blob,beer_global_score,user_name,beer_location,beer_ABV,beer_name
0,0,http://www.ratebeer.com/user/269959/beer-ratings/,9,0,2,2,10,4,4 AROMA 9/10 APPEARANCE 1/5 TASTE 10/10 PALATE 2/5 OVERALL 18/20KoreanMong(4),9,1,269959,4,,2.428113,Taiwan Tsing Beer Co.,18," Seoul, South Korea                     ",1,,Fruit Beer,http://www.ratebeer.com/beer/taiwan-long-chuan-beer-fruit-bar-peach/200674/269959/,"Natural peach flavor and aroma are very outstanding service.
Japan and South Korea in the fruit beer, fruit beer and the aroma and flavor without being able to compare the two is superior.
Through the eyes of a fruit beer, fruit beer. ",,KoreanMong,Taiwan,2.5%,Taiwan Long Chuan Beer Fruit Bar Peach
0,0,http://www.ratebeer.com/user/269959/beer-ratings/,1,0,2,2,9,4,3.9 AROMA 8/10 APPEARANCE 2/5 TASTE 9/10 PALATE 2/5 OVERALL 18/20KoreanMong(4),8,1,269959,3.9,,,Taiwan Tsing Beer Co.,18," Seoul, South Korea                     ",2,,Fruit Beer,http://www.ratebeer.com/beer/taiwan-long-chuan-beer-fruit-bar-passion-fruit/200675/269959/,"Fruit beer should be assessed from the perspective of the fruit.
The taste of young people dare yen as the best fruit beer Ill Rate.
Taiwan does not like beer, fruit beer, as much as their own
I think had been released well.
One close to the aroma and flavor longer, but the drink itself.
As mentioned earlier, two fruit beer, the fruit, beer, from the perspective of need to judge thinks that. ",,KoreanMong,Taiwan,2.5%,Taiwan Long Chuan Beer Fruit Bar Passion Fruit
0,0,http://www.ratebeer.com/user/269959/beer-ratings/,24,0,2,4,10,4,4.3 AROMA 9/10 APPEARANCE 1/5 TASTE 10/10 PALATE 4/5 OVERALL 19/20KoreanMong(4),9,1,269959,4.3,3.527,1.903152,Taiwan Tobacco and Liquor Corp,19," Seoul, South Korea                     ",1,,Fruit Beer,http://www.ratebeer.com/beer/taiwan-beer-pineapple/196088/269959/,"Taiwan, like mango mango beer is far superior taste.
If mango pineapple taste a little contrived seureowoomyeonseodo much natural flavor and taste is excellent. Although the design figured copper.
Rather than design, and as much as I taste beer seriously and
Well not around drinking with friends to enjoy the atmosphere and the prices high scores
Top jungen dare say that fruit beer. ",2.5,KoreanMong,Taiwan,2.8%,Taiwan Beer Pineapple
0,0,http://www.ratebeer.com/user/269959/beer-ratings/,21,0,2,2,10,4,4.1 AROMA 9/10 APPEARANCE 1/5 TASTE 10/10 PALATE 2/5 OVERALL 19/20KoreanMong(4),9,1,269959,4.1,7.896,2.154698,Taiwan Tobacco and Liquor Corp,19," Seoul, South Korea                     ",1,,Fruit Beer,http://www.ratebeer.com/beer/taiwan-beer-mango/188574/269959/," very hot summer. this beer is awsome x 100!!!!!!!! is sucks, but aroma and taste as such good. 
asian top fruit beer. 

p.s - chasing asian girlss with this beer.  ",5.574,KoreanMong,Taiwan,2.8%,Taiwan Beer Mango
