user_num_places_rated,user_num_following,user_url,beer_num_ratings,user_num_friends,user_num_breweries_rated,review_palate_score,review_taste_score,user_num_ratings,review_ratings_blob,review_aroma_score,user_num_countries_rated,user_id,review_avg_score,beer_global_style_score,beer_weighted_avg_score,beer_brewer_name,review_overall_score,user_location,review_appearance_score,beer_num_calories,beer_style,beer_url,review_blob,beer_global_score,user_name,beer_location,beer_ABV,beer_name
0,0,http://www.ratebeer.com/user/2789/beer-ratings/,5020,0,4,4,8,6,4.5 AROMA 9/10 APPEARANCE 5/5 TASTE 8/10 PALATE 4/5 OVERALL 19/20Crow99(6),9,3,2789,4.5,87.891,3.398754,St. Jamess Gate (Diageo),19," Adelaide, Australia                       ",5,5020,Dry Stout,http://www.ratebeer.com/beer/guinness-draught/1267/2789/,"If theres a nicer drink to have sitting by a fire on a miserable winters day Ive yet to find it. 
beautiful full rich taste. ",80.547,Crow99,Ireland,4.2%,Guinness Draught 
0,0,http://www.ratebeer.com/user/2789/beer-ratings/,140,0,4,3,7,6,3.7 AROMA 8/10 APPEARANCE 2/5 TASTE 7/10 PALATE 3/5 OVERALL 17/20Crow99(6),8,3,2789,3.7,20.812,2.623362,Bulmers Cider (Heineken UK),17," Adelaide, Australia                       ",2,140,Cider,http://www.ratebeer.com/beer/scrumpy-jack/3002/2789/,"not really one for ciders, but really tangy and fruity.  ",16.053,Crow99,England,6%,Scrumpy Jack
0,0,http://www.ratebeer.com/user/2789/beer-ratings/,286,0,4,3,4,6,2.4 AROMA 2/10 APPEARANCE 5/5 TASTE 4/10 PALATE 3/5 OVERALL 10/20Crow99(6),2,3,2789,2.4,45.672,2.065192,Carlton & United Breweries  (CUB),10," Adelaide, Australia                       ",5,286,Pale Lager,http://www.ratebeer.com/beer/carlton-crown-lager/7209/2789/,"crisp, flavourless beer sold as the Premium beer in Australia but in that regard is vastly overrated. 

too expensive to drink in large quantities, and not good enough to really want to.  ",4.259,Crow99,Australia,4.9%,Carlton Crown Lager
0,0,http://www.ratebeer.com/user/2789/beer-ratings/,1861,0,4,1,1,6,0.5 AROMA 1/10 APPEARANCE 1/5 TASTE 1/10 PALATE 1/5 OVERALL 1/20Crow99(6),1,3,2789,0.5,40.629,2.003466,Fosters Brewing (CUB),1," Adelaide, Australia                       ",1,1861,Pale Lager,http://www.ratebeer.com/beer/fosters-lager/187/2789/,exported to the world so that Australians dont have to drink it ,3.38,Crow99,Australia,4.9%,Fosters Lager
0,0,http://www.ratebeer.com/user/2789/beer-ratings/,744,0,4,4,9,6,4.5 AROMA 10/10 APPEARANCE 3/5 TASTE 9/10 PALATE 4/5 OVERALL 19/20Crow99(6),10,3,2789,4.5,90.556,3.400714,Coopers Brewery,19," Adelaide, Australia                       ",3,744,English Strong Ale,http://www.ratebeer.com/beer/coopers-vintage-ale/4063/2789/,in my opinion Australias best beer. ,80.862,Crow99,Australia,7.5%,Coopers Vintage Ale
0,0,http://www.ratebeer.com/user/2789/beer-ratings/,698,0,4,3,1,6,1.2 AROMA 3/10 APPEARANCE 4/5 TASTE 1/10 PALATE 3/5 OVERALL 1/20Crow99(6),3,3,2789,1.2,31.691,1.914244,Carlton & United Breweries  (CUB),1," Adelaide, Australia                       ",4,698,Pale Lager,http://www.ratebeer.com/beer/victoria-bitter/7580/2789/,"real friends wouldnt let their friends drink this stuff. 
truly awful ",2.353,Crow99,Australia,4.9%,Victoria Bitter
