user_num_places_rated,user_num_following,user_url,beer_num_ratings,user_num_friends,user_num_breweries_rated,review_palate_score,review_taste_score,user_num_ratings,review_ratings_blob,review_aroma_score,user_num_countries_rated,user_id,review_avg_score,beer_global_style_score,beer_weighted_avg_score,beer_brewer_name,review_overall_score,user_location,review_appearance_score,beer_num_calories,beer_style,beer_url,review_blob,beer_global_score,user_name,beer_location,beer_ABV,beer_name
0,0,http://www.ratebeer.com/user/28366/beer-ratings/,13,0,0,3,4,5,2.9 AROMA 8/10 APPEARANCE 4/5 TASTE 4/10 PALATE 3/5 OVERALL 10/20gavinio(5),8,1,28366,2.9,65.781,2.960657,Westons Cider,10, England                         ,4,225,Cider,http://www.ratebeer.com/beer/westons-extra-strong-scrumpy/30488/28366/,"Dont know if it was just me but after a few pints it really hit me, very strong tasting cider. Cloudy and msyterious to the eye but smooth and tasty to the throught. ",45.019,gavinio,England,7.5%,Westons Extra Strong Scrumpy
0,0,http://www.ratebeer.com/user/28366/beer-ratings/,6,0,0,3,7,5,3.8 AROMA 9/10 APPEARANCE 4/5 TASTE 7/10 PALATE 3/5 OVERALL 15/20gavinio(5),9,1,28366,3.8,,2.763465,The Cornish Cyder Farm,15, England                         ,4,222,Cider,http://www.ratebeer.com/beer/cornish-scrumpy-medium-sweet/37385/28366/,really strong tasting cider where after a few pints youll be wondering if you can stand up properly. Not as sweet as most ciders out there and probably harder to find.  ,,gavinio,England,7.4%,Cornish  Scrumpy Medium Sweet
0,0,http://www.ratebeer.com/user/28366/beer-ratings/,879,0,0,3,5,5,2.9 AROMA 7/10 APPEARANCE 4/5 TASTE 5/10 PALATE 3/5 OVERALL 10/20gavinio(5),7,1,28366,2.9,12.599,2.459059,Bulmers Cider (Heineken UK),10, England                         ,4,879,Cider,http://www.ratebeer.com/beer/strongbow-cider/3001/28366/,"Clear and sparkling cider thats too sweet for me but had a nice bite too it. Other than that its a very plain and boring cider, nothing as good as Addlestones ",10.905,gavinio,England,5%,Strongbow Cider
0,0,http://www.ratebeer.com/user/28366/beer-ratings/,236,0,0,3,8,5,3 AROMA 5/10 APPEARANCE 4/5 TASTE 8/10 PALATE 3/5 OVERALL 10/20gavinio(5),5,1,28366,3,11.754,2.420575,Bulmers Cider (Heineken UK),10, England                         ,4,236,Cider,http://www.ratebeer.com/beer/woodpecker-cider/3000/28366/,"One of the most popular ciders in pubs and tastes smooth, not too sweet. Makes your burps smell funny tho ",10.478,gavinio,England,4%,Woodpecker Cider
0,0,http://www.ratebeer.com/user/28366/beer-ratings/,44,0,0,3,8,5,4.1 AROMA 10/10 APPEARANCE 5/5 TASTE 8/10 PALATE 3/5 OVERALL 15/20gavinio(5),10,1,28366,4.1,36.789,2.793623,Magners GB / Shepton Mallet Cider Mill (C&C; Group),15, England                         ,5,156,Cider,http://www.ratebeer.com/beer/addlestones-cask-conditioned-draught-cider/38418/28366/,"My favourite cider, doesnt taste too sweet like most ciders and goes down really nicely. The cloudyness gives it a mysterious appearence and smells very much of apples. Drank it in a village in weardale and cant find it anywhere else tho. ",26.903,gavinio,England,5.2%,Addlestones Cask Conditioned Draught Cider
