user_num_places_rated,user_num_following,user_url,beer_num_ratings,user_num_friends,user_num_breweries_rated,review_palate_score,review_taste_score,user_num_ratings,review_ratings_blob,review_aroma_score,user_num_countries_rated,user_id,review_avg_score,beer_global_style_score,beer_weighted_avg_score,beer_brewer_name,review_overall_score,user_location,review_appearance_score,beer_num_calories,beer_style,beer_url,review_blob,beer_global_score,user_name,beer_location,beer_ABV,beer_name
0,3,http://www.ratebeer.com/user/285134/beer-ratings/,1,0,1,5,10,7,4.6 AROMA 8/10 APPEARANCE 5/5 TASTE 10/10 PALATE 5/5 OVERALL 18/20richmaguni(7),8,1,285134,4.6,,,Jing A (A) Capital Brewing Co.,18,,5,195,Oktoberfest/Mrzen,http://www.ratebeer.com/beer/jing-a-uber-jing-oktoberfest-lager/234492/285134/,"Lively head, rich amber color
Toasty aroma,
Full-bodied malt flavor
Not too carbonated, slightly creamy and thick mouthfeel from all that malt. ",,richmaguni,China,6.5%,Jing A ber-Jing Oktoberfest Lager
0,3,http://www.ratebeer.com/user/285134/beer-ratings/,1,0,1,4,7,7,3.6 AROMA 6/10 APPEARANCE 3/5 TASTE 7/10 PALATE 4/5 OVERALL 16/20richmaguni(7),6,1,285134,3.6,,,Jing A (A) Capital Brewing Co.,16,,3,150,Brown Ale,http://www.ratebeer.com/beer/jing-a-smoke-on-the-beech/234490/285134/,"Appearance is a semi-opaque brown with tan head
Served too cold to get much aroma, but some caramel, smoke, and a bit of yeast.
The smoke appears again in the taste, otherwise a bit salty/sweet.
Carbonation is too much, beer was much better after I let it sit and warm up and soften. ",,richmaguni,China,5%,Jing A Smoke On The Beech
0,3,http://www.ratebeer.com/user/285134/beer-ratings/,5,0,1,3,7,7,3.5 AROMA 7/10 APPEARANCE 3/5 TASTE 7/10 PALATE 3/5 OVERALL 15/20richmaguni(7),7,1,285134,3.5,,2.857743,Jing A (A) Capital Brewing Co.,15,,3,123,Witbier,http://www.ratebeer.com/beer/jing-a-mandarin-summer-wheat/234489/285134/,"Very pale, slightly cloudy appearance
Fresh orange zest aroma dominates
Taste is light, notes of wheat, oranges, and some sweetnes
Very dry finish and high carb, like champagne.
 Not bad, very refreshing, but Id prefer it with a bit more body and spice.
 ",,richmaguni,China,4.1%,Jing A Mandarin Summer Wheat
0,3,http://www.ratebeer.com/user/285134/beer-ratings/,14,0,1,4,8,7,3.9 AROMA 7/10 APPEARANCE 4/5 TASTE 8/10 PALATE 4/5 OVERALL 16/20richmaguni(7),7,1,285134,3.9,27.018,3.215631,Jing A (A) Capital Brewing Co.,16,,4,198,Saison,http://www.ratebeer.com/beer/jing-a-full-moon-farmhouse-ale/234488/285134/,"Golden and a good fluffy head.
Very floral aroma, different from what youd get in an ipa, and lacks the spicyness of a saison.
Hard to place the flavor, but its a slightly light saison with more some floral/honey notes.
Medium body, goes down very smoothly. ",51.618,richmaguni,China,6.6%,Jing A Full Moon Farmhouse Ale
0,3,http://www.ratebeer.com/user/285134/beer-ratings/,10,0,1,5,9,7,4.8 AROMA 10/10 APPEARANCE 5/5 TASTE 9/10 PALATE 5/5 OVERALL 19/20richmaguni(7),10,1,285134,4.8,84.535,3.529735,Jing A (A) Capital Brewing Co.,19,,5,195,India Pale Ale (IPA),http://www.ratebeer.com/beer/jing-a-flying-fist-ipa/234484/285134/,"Pours golden/orange 
Great floral aroma from citra dry-hopping
Nice balance of sweetness and hop bitterness
Good carb and a typical ipa bitter finish
One of the best IPAs Ive had in a while. Like sculpin, but slightly less sharp. ",90.703,richmaguni,China,6.5%,Jing A Flying Fist IPA
0,3,http://www.ratebeer.com/user/285134/beer-ratings/,1,0,1,4,8,7,4.2 AROMA 8/10 APPEARANCE 4/5 TASTE 8/10 PALATE 4/5 OVERALL 18/20richmaguni(7),8,1,285134,4.2,,,Jing A (A) Capital Brewing Co.,18,,4,150,Session IPA,http://www.ratebeer.com/beer/jing-a-bittersweet-symphony-session-ipa/234486/285134/,"Pours amber orange and clear, with a finger of head
Nice piney, even smokey chinook aroma
Medium bitterness on the malty backbone
The body is medum/light, a session beer. Good carbonation. ",,richmaguni,China,5%,Jing A Bittersweet Symphony Session IPA
0,3,http://www.ratebeer.com/user/285134/beer-ratings/,1,0,1,4,8,7,4.1 AROMA 8/10 APPEARANCE 4/5 TASTE 8/10 PALATE 4/5 OVERALL 17/20richmaguni(7),8,1,285134,4.1,,,Jing A (A) Capital Brewing Co.,17,,4,135,Fruit Beer,http://www.ratebeer.com/beer/jing-a-big-slice-watermelon-wheat/234485/285134/,"Clear, pale with 1/2 inch head.
Fruity watermelon aroma. 
Not as sweet as expected, but could use more tartness.
Nice dry finish, definitely sessionable. ",,richmaguni,China,4.5%,Jing A Big Slice Watermelon Wheat
