user_num_places_rated,user_num_following,user_url,beer_num_ratings,user_num_friends,user_num_breweries_rated,review_palate_score,review_taste_score,user_num_ratings,review_ratings_blob,review_aroma_score,user_num_countries_rated,user_id,review_avg_score,beer_global_style_score,beer_weighted_avg_score,beer_brewer_name,review_overall_score,user_location,review_appearance_score,beer_num_calories,beer_style,beer_url,review_blob,beer_global_score,user_name,beer_location,beer_ABV,beer_name
0,0,http://www.ratebeer.com/user/290400/beer-ratings/,9,0,7,4,9,9,4.4 AROMA 9/10 APPEARANCE 4/5 TASTE 9/10 PALATE 4/5 OVERALL 18/20jjjbeer(9),9,5,290400,4.4,,3.273544,Birrificio Pavese,18,,4,165,American Pale Ale,http://www.ratebeer.com/beer/birrificio-pavese-mayflower/177851/290400/,"mayflower, la mia birra preferita... nel bicchiere si presenta biondo torbido, al naso una piacevole esplosione di luppolo, al palato: beverina,corpo medio, profumi di malto e luppolo senza invadere la realt percettiva del nostro palato, amaro giusto(33 ibu)... bravo pavese...questa birra rappresenta lequilibrio in materia... cheers mates.. ",,jjjbeer,Italy,5.5%,Birrificio Pavese Mayflower
0,0,http://www.ratebeer.com/user/290400/beer-ratings/,391,0,7,5,10,9,4.9 AROMA 10/10 APPEARANCE 5/5 TASTE 10/10 PALATE 5/5 OVERALL 19/20jjjbeer(9),10,5,290400,4.9,98.028,3.588454,Mikkeller,19,,5,391,Belgian Ale,http://www.ratebeer.com/beer/mikkeller-hva-saa/208261/290400/,"meglio dellorval sotto alcuni aspetti.... cmq perfetta... ma questo  personale. bravo mikkeller,  la birra che ci aspettavamo.. bravo!!! ",93.33,jjjbeer,Denmark,6.8%,Mikkeller Hva S?!
0,0,http://www.ratebeer.com/user/290400/beer-ratings/,484,0,7,3,5,9,2.8 AROMA 4/10 APPEARANCE 4/5 TASTE 5/10 PALATE 3/5 OVERALL 12/20jjjbeer(9),4,5,290400,2.8,40.703,3.081874,Ridgeway,12,,4,484,English Strong Ale,http://www.ratebeer.com/beer/ridgeway-bad-elf-6/28228/290400/,"sto bevendo una bad elf 2013, al naso il primo sentore  lievito, lontanamente vanigliato. nel bicchiere si presenta biondo opalescente, al palato si percepisce una sensazione di birretta appena secchina e lontanamente amara.... non  il mio genere... cheers.. ",44.284,jjjbeer,England,6%,Ridgeway Bad Elf  (6%)
0,0,http://www.ratebeer.com/user/290400/beer-ratings/,27,0,7,4,9,9,4.5 AROMA 9/10 APPEARANCE 5/5 TASTE 9/10 PALATE 4/5 OVERALL 18/20jjjbeer(9),9,5,290400,4.5,45.377,3.462043,Birrificio Pontino,18,,5,255,Imperial IPA,http://www.ratebeer.com/beer/birrificio-pontino-purple-ale/219552/290400/,"color ambrato carico, schiuma quasi inesistente, note di malto e caramello luppolatura generosa con amaro spiccato e persistente. una grande birra. cheers.. ",87.472,jjjbeer,Italy,8.5%,Birrificio Pontino Purple Ale
0,0,http://www.ratebeer.com/user/290400/beer-ratings/,82,0,7,4,9,9,4.2 AROMA 9/10 APPEARANCE 4/5 TASTE 9/10 PALATE 4/5 OVERALL 16/20jjjbeer(9),9,5,290400,4.2,97.647,3.392978,Brauerei Rittmayer Hallerndorf,16,,4,165,Pilsener,http://www.ratebeer.com/beer/rittmayer-hallerndorfer-bitter-42/211767/290400/,"ottima pils profumata, al palato secca ed erbacea con sciuma fina e compatta.
giusta per accompagnare pizza o dissetarsi con un ottimo rapporto qualit prezzo.
cheers mates ",80.122,jjjbeer,Germany,5.5%,Rittmayer Hallerndorfer Bitter 42
0,0,http://www.ratebeer.com/user/290400/beer-ratings/,10,0,7,4,8,9,4.2 AROMA 8/10 APPEARANCE 4/5 TASTE 8/10 PALATE 4/5 OVERALL 18/20jjjbeer(9),8,5,290400,4.2,99.312,3.521196,Birra Bellazzi,18,,4,180,Heller Bock,http://www.ratebeer.com/beer/birra-bellazzi-mybo/240805/290400/,"tenendo presente che non sono un amente delle bock, questa birra mia ha conquistato. malti giusti , lievito giusto , grado alcolico giusto , luppolatura giusta. perfetta per molte occasioni. cheers.. ",91.212,jjjbeer,Italy,6%,Birra Bellazzi MyBo
0,0,http://www.ratebeer.com/user/290400/beer-ratings/,441,0,7,4,9,9,4.4 AROMA 9/10 APPEARANCE 4/5 TASTE 9/10 PALATE 4/5 OVERALL 18/20jjjbeer(9),9,5,290400,4.4,95.495,3.683297,Duvel Moortgat,18,,4,441,Belgian Strong Ale,http://www.ratebeer.com/beer/duvel-tripel-hop-2013-sorachi-ace/201945/290400/,"cosa volere di pi da una birra, dorato opaca profumo di luppolo intenso e lievito (piacevole). la definirei in perfetto stile duvel.eccellente!!
cheers..
 ",96.308,jjjbeer,Belgium,9.5%,Duvel Tripel Hop 2013 (Sorachi Ace)
0,0,http://www.ratebeer.com/user/290400/beer-ratings/,21,0,7,5,9,9,4.5 AROMA 9/10 APPEARANCE 4/5 TASTE 9/10 PALATE 5/5 OVERALL 18/20jjjbeer(9),9,5,290400,4.5,76.091,3.634223,Birra Bellazzi,18,,4,255,Imperial IPA,http://www.ratebeer.com/beer/birra-bellazzi-alley-hop/213026/290400/,"nel bicchiere si presenta ambrato carico con poca schiuma finissima (come piace a me).
il profumo  esplosivo, eccellete e generosa luppolatura retta da un ottima combinazione di malti non invasivo(come succede avvolte nelle imperial o double).
 pi la bevo e piu mi piace.
eccellente!!
 ",95.199,jjjbeer,Italy,8.5%,Birra Bellazzi Alley Hop
0,0,http://www.ratebeer.com/user/290400/beer-ratings/,14,0,7,4,8,9,4.2 AROMA 8/10 APPEARANCE 4/5 TASTE 8/10 PALATE 4/5 OVERALL 18/20jjjbeer(9),8,5,290400,4.2,60.193,3.271074,Birra Bellazzi,18,,4,165,American Pale Ale,http://www.ratebeer.com/beer/birra-bellazzi-jake/213027/290400/,"nel bicchiere si presenta dorato opaco e il profumo di luppolo ben bilanciato e non invasivo. al palato sentiamo un piacevolissimo agrumato e sentori di malto ben equilibrati, che rende questa birra particolare e adatta ad ogni situazione.
molto piacevole sia in bottiglia che alla spina.
cheers.. ",68.467,jjjbeer,Italy,5.5%,Birra Bellazzi Jake
