user_num_places_rated,user_num_following,user_url,beer_num_ratings,user_num_friends,user_num_breweries_rated,review_palate_score,review_taste_score,user_num_ratings,review_ratings_blob,review_aroma_score,user_num_countries_rated,user_id,review_avg_score,beer_global_style_score,beer_weighted_avg_score,beer_brewer_name,review_overall_score,user_location,review_appearance_score,beer_num_calories,beer_style,beer_url,review_blob,beer_global_score,user_name,beer_location,beer_ABV,beer_name
0,0,http://www.ratebeer.com/user/30146/beer-ratings/,1856,0,3,3,9,3,3.5 AROMA 8/10 APPEARANCE 5/5 TASTE 9/10 PALATE 3/5 OVERALL 10/20alojzy(3),8,3,30146,3.5,75.026,3.33069,Labatt Breweries (AB InBev),10," camby, Indiana",5,1856,Dry Stout,http://www.ratebeer.com/beer/guinness-extra-stout-north-america/4456/30146/,"looks great smell great is great 
really dark brown head
no carbonation to speak of
but it fits just fine
 ",72.582,alojzy,Canada,5%,Guinness Extra Stout (North America)
0,0,http://www.ratebeer.com/user/30146/beer-ratings/,2985,0,3,1,1,3,0.7 AROMA 3/10 APPEARANCE 1/5 TASTE 1/10 PALATE 1/5 OVERALL 1/20alojzy(3),3,3,30146,0.7,0.736,1.206539,Anheuser-Busch InBev,1," camby, Indiana",1,2985,Pale Lager,http://www.ratebeer.com/beer/bud-light/474/30146/,"Is this beer?
iam not sure to many bubbles for me 
slight skunk smell
almost a clear yellow
itis just not a very well made beer
 ",,alojzy,Missouri,4.1%,Bud Light
0,0,http://www.ratebeer.com/user/30146/beer-ratings/,5020,0,3,4,10,3,4.8 AROMA 9/10 APPEARANCE 5/5 TASTE 10/10 PALATE 4/5 OVERALL 20/20alojzy(3),9,3,30146,4.8,87.891,3.398754,St. Jamess Gate (Diageo),20," camby, Indiana",5,5020,Dry Stout,http://www.ratebeer.com/beer/guinness-draught/1267/30146/,"I love this it is the best out of the tap
it is still very good out of bottle
not too many bubbles just enough
it tastes a little coffe to me but not too much just right
A1 stout ",80.547,alojzy,Ireland,4.2%,Guinness Draught 
