user_num_places_rated,user_num_following,user_url,beer_num_ratings,user_num_friends,user_num_breweries_rated,review_palate_score,review_taste_score,user_num_ratings,review_ratings_blob,review_aroma_score,user_num_countries_rated,user_id,review_avg_score,beer_global_style_score,beer_weighted_avg_score,beer_brewer_name,review_overall_score,user_location,review_appearance_score,beer_num_calories,beer_style,beer_url,review_blob,beer_global_score,user_name,beer_location,beer_ABV,beer_name
0,0,http://www.ratebeer.com/user/322153/beer-ratings/,689,0,4,4,9,5,4.1 AROMA 5/10 APPEARANCE 3/5 TASTE 9/10 PALATE 4/5 OVERALL 20/20lekebekoi(5),5,2,322153,4.1,85.998,3.987829,Cantillon,20,,3,689,Lambic Style - Gueuze,http://www.ratebeer.com/beer/cantillon-lou-pepe-gueuze/7501/322153/,"Armes de vin blanc, mousseux. Saveur de mousseux trs amre got de biere absent ",99.63,lekebekoi,Belgium,5%,Cantillon Lou Pepe Gueuze
0,0,http://www.ratebeer.com/user/322153/beer-ratings/,2531,0,4,5,10,5,4.2 AROMA 7/10 APPEARANCE 3/5 TASTE 10/10 PALATE 5/5 OVERALL 17/20lekebekoi(5),7,2,322153,4.2,92.737,3.805713,Brouwerij Rodenbach (Palm),17,,3,2531,Sour Red/Brown,http://www.ratebeer.com/beer/rodenbach-grand-cru/1194/322153/,"Fruits rouges, petit nez d&apos;alcool. Plus sur que la rodenbach rgulire, plus forte en alcool.  ",98.405,lekebekoi,Belgium,6%,Rodenbach Grand Cru
0,0,http://www.ratebeer.com/user/322153/beer-ratings/,1633,0,4,3,5,5,3 AROMA 8/10 APPEARANCE 3/5 TASTE 5/10 PALATE 3/5 OVERALL 11/20lekebekoi(5),8,2,322153,3,49.683,3.519358,Brouwerij Rodenbach (Palm),11,,3,1633,Sour Red/Brown,http://www.ratebeer.com/beer/rodenbach/1193/322153/,"Nez de fruits rouges, fut de chne. Lgre acidite got d&apos;alcool peu prsent 
 ",90.031,lekebekoi,Belgium,5.2%,Rodenbach 
0,0,http://www.ratebeer.com/user/322153/beer-ratings/,329,0,4,2,4,5,3 AROMA 7/10 APPEARANCE 2/5 TASTE 4/10 PALATE 2/5 OVERALL 15/20lekebekoi(5),7,2,322153,3,27.247,3.06109,Brouwerij Van Honsebrouck,15,,2,329,Lambic Style - Fruit,http://www.ratebeer.com/beer/st-louis-premium-framboise/28152/322153/,"Trs fruite, pe un peux trop, rafrachissante, mais pas super dur pour une lambic  ",42.467,lekebekoi,Belgium,2.8%,St. Louis Premium Framboise
0,0,http://www.ratebeer.com/user/322153/beer-ratings/,35,0,4,4,9,5,4.4 AROMA 8/10 APPEARANCE 4/5 TASTE 9/10 PALATE 4/5 OVERALL 19/20lekebekoi(5),8,2,322153,4.4,60.193,3.440286,Brasseurs du Monde / Le Picoleur,19,,4,300,Eisbock,http://www.ratebeer.com/beer/brasseurs-du-monde-hors-serie-lincorruptible/247869/322153/,"Bire complexe, nez dlicat mais agrable. Apparence : mousse paisse et persistante bruntre. Au got: alcool trs subtil malgr son %, note de caf subtile et de sucre, vanille trs prsent dans tre dsagrable. Trs bonne bire  boire avec modration ! a fait changement quoi !  ",84.628,lekebekoi,Canada,10%,Brasseurs du Monde Hors Srie LIncorruptible
