user_num_places_rated,user_num_following,user_url,beer_num_ratings,user_num_friends,user_num_breweries_rated,review_palate_score,review_taste_score,user_num_ratings,review_ratings_blob,review_aroma_score,user_num_countries_rated,user_id,review_avg_score,beer_global_style_score,beer_weighted_avg_score,beer_brewer_name,review_overall_score,user_location,review_appearance_score,beer_num_calories,beer_style,beer_url,review_blob,beer_global_score,user_name,beer_location,beer_ABV,beer_name
0,0,http://www.ratebeer.com/user/330814/beer-ratings/,4063,0,6,5,10,8,4.8 AROMA 9/10 APPEARANCE 5/5 TASTE 10/10 PALATE 5/5 OVERALL 19/20SeanCunningham(8),9,2,330814,4.8,98.136,4.098022,North Coast Brewing Company,19," Ithaca, New York",5,4063,Imperial Stout,http://www.ratebeer.com/beer/north-coast-old-rasputin-russian-imperial-stout/680/330814/,Shocked by the quality of this beer. Bold taste without being too bitter. No oily residue like many imperial stouts. ,99.841,SeanCunningham,California,9%,North Coast Old Rasputin Russian Imperial Stout
0,0,http://www.ratebeer.com/user/330814/beer-ratings/,422,0,6,5,10,8,5 AROMA 10/10 APPEARANCE 5/5 TASTE 10/10 PALATE 5/5 OVERALL 20/20SeanCunningham(8),10,2,330814,5,67.803,3.59544,Stone Brewing,20," Ithaca, New York",5,422,Imperial IPA,http://www.ratebeer.com/beer/stone-18th-anniversary-golden-brown-ipa/281439/330814/,"This is the perfect beer. This is the perfect beer. This is the perfect beer. This is the perfect beer. This is the perfect beer. This is the perfect beer. This is the perfect beer. This is the perfect beer. This is the perfect beer. 

---Rated via Beer Buddy for iPhone ",93.589,SeanCunningham,California,8.5%,Stone 18th Anniversary Golden Brown IPA
0,0,http://www.ratebeer.com/user/330814/beer-ratings/,3513,0,6,4,7,8,3.9 AROMA 9/10 APPEARANCE 4/5 TASTE 7/10 PALATE 4/5 OVERALL 15/20SeanCunningham(8),9,2,330814,3.9,97.919,3.753818,Sierra Nevada Brewing Company,15," Ithaca, New York",4,3513,India Pale Ale (IPA),http://www.ratebeer.com/beer/sierra-nevada-celebration-ale/370/330814/,Ggggggggggghhhhhhhhhjjjjknbgggcffffvvbhbnnnbgggffd via Beer Buddy for iPhone ,97.702,SeanCunningham,California,6.8%,Sierra Nevada Celebration Ale
0,0,http://www.ratebeer.com/user/330814/beer-ratings/,27,0,6,4,8,8,4.1 AROMA 8/10 APPEARANCE 4/5 TASTE 8/10 PALATE 4/5 OVERALL 17/20SeanCunningham(8),8,2,330814,4.1,95.318,3.484263,Horseheads Brewing,17," Ithaca, New York",4,216,Spice/Herb/Vegetable,http://www.ratebeer.com/beer/horseheads-pumpkin-ale/93045/330814/,"Great Great Great Great Great Great Great Great Great Great Great Great Great Great Great Great Great Great 

---Rated via Beer Buddy for iPhone ",88.056,SeanCunningham,New York,7.2%,Horseheads Pumpkin Ale
0,0,http://www.ratebeer.com/user/330814/beer-ratings/,1132,0,6,5,9,8,4.7 AROMA 9/10 APPEARANCE 5/5 TASTE 9/10 PALATE 5/5 OVERALL 19/20SeanCunningham(8),9,2,330814,4.7,99.206,4.000085,Stone Brewing,19," Ithaca, New York",5,1132,Imperial IPA,http://www.ratebeer.com/beer/stone-ruinten-ipa/171722/330814/,"Great Great Great Great Great Great Great Great Great Great Great Great Great Great Great Great Great Great 

---Rated via Beer Buddy for iPhone ",99.63,SeanCunningham,California,10.8%,Stone RuinTen IPA
0,0,http://www.ratebeer.com/user/330814/beer-ratings/,3382,0,6,5,8,8,4.5 AROMA 8/10 APPEARANCE 4/5 TASTE 8/10 PALATE 5/5 OVERALL 20/20SeanCunningham(8),8,2,330814,4.5,97.483,3.733097,Sierra Nevada Brewing Company,20," Ithaca, New York",4,3382,India Pale Ale (IPA),http://www.ratebeer.com/beer/sierra-nevada-torpedo-extra-ipa/59261/330814/,An overall great beer from a solid brewery. More hoppy than the pale ale with nice body and finish. ,97.373,SeanCunningham,California,7.2%,Sierra Nevada Torpedo Extra IPA
0,0,http://www.ratebeer.com/user/330814/beer-ratings/,5020,0,6,4,8,8,4.1 AROMA 8/10 APPEARANCE 4/5 TASTE 8/10 PALATE 4/5 OVERALL 17/20SeanCunningham(8),8,2,330814,4.1,87.891,3.398754,St. Jamess Gate (Diageo),17," Ithaca, New York",4,5020,Dry Stout,http://www.ratebeer.com/beer/guinness-draught/1267/330814/,"Anywhere, anytime. The classic stout to compare all other stouts to. Love it.

---Rated via Beer Buddy for iPhone ",80.547,SeanCunningham,Ireland,4.2%,Guinness Draught 
0,0,http://www.ratebeer.com/user/330814/beer-ratings/,87,0,6,4,8,8,3.7 AROMA 6/10 APPEARANCE 4/5 TASTE 8/10 PALATE 4/5 OVERALL 15/20SeanCunningham(8),6,2,330814,3.7,66.189,3.427378,Griffin Claw Brewing Company,15," Ithaca, New York",4,225,India Pale Ale (IPA),http://www.ratebeer.com/beer/griffin-claw-norms-raggedy-ass-ipa/226131/330814/,"Draft. Light golden not overpowering hop flavor. Detroit airport ipa pretty good.

---Rated via Beer Buddy for iPhone ",83.485,SeanCunningham,Michigan,7.5%,Griffin Claw Norms Raggedy-Ass IPA
