user_num_places_rated,user_num_following,user_url,beer_num_ratings,user_num_friends,user_num_breweries_rated,review_palate_score,review_taste_score,user_num_ratings,review_ratings_blob,review_aroma_score,user_num_countries_rated,user_id,review_avg_score,beer_global_style_score,beer_weighted_avg_score,beer_brewer_name,review_overall_score,user_location,review_appearance_score,beer_num_calories,beer_style,beer_url,review_blob,beer_global_score,user_name,beer_location,beer_ABV,beer_name
0,0,http://www.ratebeer.com/user/368704/beer-ratings/,89,0,5,3,5,8,2.3 AROMA 6/10 APPEARANCE 3/5 TASTE 5/10 PALATE 3/5 OVERALL 6/20Joropoolie157(8),6,2,368704,2.3,26.207,2.832114,Robinsons,6," Hartlepool, Durham, England                         ",3,126,Bitter,http://www.ratebeer.com/beer/robinsons-unicorn-cask/43330/368704/,"Citrus is the overriding factor of this ale. It is drinkable and refreshing. Good colour but weak head. Not the best, but I would have another. ",25.973,Joropoolie157,England,4.2%,Robinsons Unicorn (Cask)
0,0,http://www.ratebeer.com/user/368704/beer-ratings/,6,0,5,4,6,8,2.1 AROMA 3/10 APPEARANCE 3/5 TASTE 6/10 PALATE 4/5 OVERALL 5/20Joropoolie157(8),3,2,368704,2.1,,2.81667,Hydes,5," Hartlepool, Durham, England                         ",3,135,Bitter,http://www.ratebeer.com/beer/hydes-finest/228490/368704/,Good hoppy flavour that lingers on the pallette. Looks good but never really delivers in the way you expect. Good session beer though.  ,,Joropoolie157,England,4.5%,Hydes Finest
0,0,http://www.ratebeer.com/user/368704/beer-ratings/,41,0,5,4,6,8,2.5 AROMA 6/10 APPEARANCE 3/5 TASTE 6/10 PALATE 4/5 OVERALL 6/20Joropoolie157(8),6,2,368704,2.5,41.283,2.906273,Hydes,6," Hartlepool, Durham, England                         ",3,129,Bitter,http://www.ratebeer.com/beer/hydes-jekylls-gold-cask/5617/368704/,Nice easy drinking beer. Smooth on the palate with a very pleasant aftertaste. Not the best but certainly not the worst. ,33.291,Joropoolie157,England,4.3%,Hydes Jekylls Gold (Cask)
0,0,http://www.ratebeer.com/user/368704/beer-ratings/,160,0,5,4,8,8,3.1 AROMA 3/10 APPEARANCE 3/5 TASTE 8/10 PALATE 4/5 OVERALL 13/20Joropoolie157(8),3,2,368704,3.1,76.441,3.118245,Wychwood (Marstons),13," Hartlepool, Durham, England                         ",3,160,Golden Ale/Blond Ale,http://www.ratebeer.com/beer/wychwood-hobgoblin-gold-bottle/272841/368704/,Lovely bottled beer being sold off for 99p in morrisons. Pours well looks great and tastes of summer with a fresh but bitter after taste. Very enjoyable.  ,46.136,Joropoolie157,England,4.5%,Wychwood Hobgoblin Gold (Bottle)
0,0,http://www.ratebeer.com/user/368704/beer-ratings/,24,0,5,4,3,8,1.6 AROMA 3/10 APPEARANCE 2/5 TASTE 3/10 PALATE 4/5 OVERALL 4/20Joropoolie157(8),3,2,368704,1.6,85.639,3.108693,Wolf,4," Hartlepool, Durham, England                         ",2,111,Bitter,http://www.ratebeer.com/beer/wolf-cavell-ale-9503/19142/368704/,"Bought the beer based on the association with the great dame Edith Cavell. Pleasent aroma, quite murky but tastes well. Good beer that tastes much stronger than the 3.7. Enjoyed. ",46.873,Joropoolie157,England,3.7%,Wolf Cavell Ale 9503
0,0,http://www.ratebeer.com/user/368704/beer-ratings/,31,0,5,3,4,8,1.6 AROMA 3/10 APPEARANCE 3/5 TASTE 4/10 PALATE 3/5 OVERALL 3/20Joropoolie157(8),3,2,368704,1.6,45.436,2.931866,Shepherd Neame,3," Hartlepool, Durham, England                         ",3,114,Bitter,http://www.ratebeer.com/beer/shepherd-neame-4-4-2-bottle/124376/368704/,"Special offer from lidl. Nice looking summer ale that is very pleasing on the palate. Keeps its head well throughout and is a pleasing, effortless drink. ",35.819,Joropoolie157,England,3.8%,Shepherd Neame 4-4-2 (Bottle)
0,0,http://www.ratebeer.com/user/368704/beer-ratings/,58,0,5,3,3,8,1.4 AROMA 2/10 APPEARANCE 3/5 TASTE 3/10 PALATE 3/5 OVERALL 3/20Joropoolie157(8),2,2,368704,1.4,10.051,2.678362,Lidl UK,3," Hartlepool, Durham, England                         ",3,114,Bitter,http://www.ratebeer.com/beer/lidl-hatherwood-ruby-rooster/219213/368704/,Passable bitter lovely colour and nice head. Aroma almost non existent but tastes good. A lidl special at 90p. Enjoyable ale. ,17.134,Joropoolie157,England,3.8%,Lidl Hatherwood Ruby Rooster
0,0,http://www.ratebeer.com/user/368704/beer-ratings/,24,0,5,1,1,8,1 AROMA 3/10 APPEARANCE 4/5 TASTE 1/10 PALATE 1/5 OVERALL 1/20Joropoolie157(8),3,2,368704,1,10.051,2.42951,Wychwood (Marstons),1," Hartlepool, Durham, England                         ",4,114,Spice/Herb/Vegetable,http://www.ratebeer.com/beer/wychwood-hot-cross-bunny/320701/368704/,Far to medicinal for me. Really did not like this.looks good and smells good but the cloves are just overpowering.  ,10.051,Joropoolie157,England,3.8%,Wychwood Hot Cross Bunny
