user_num_places_rated,user_num_following,user_url,beer_num_ratings,user_num_friends,user_num_breweries_rated,review_palate_score,review_taste_score,user_num_ratings,review_ratings_blob,review_aroma_score,user_num_countries_rated,user_id,review_avg_score,beer_global_style_score,beer_weighted_avg_score,beer_brewer_name,review_overall_score,user_location,review_appearance_score,beer_num_calories,beer_style,beer_url,review_blob,beer_global_score,user_name,beer_location,beer_ABV,beer_name
2,0,http://www.ratebeer.com/user/3752/beer-ratings/,122,1,346,3,7,775,3.2 AROMA 6/10 APPEARANCE 3/5 TASTE 7/10 PALATE 3/5 OVERALL 13/20RobBestwick(775),6,42,3752,3.2,91.14,3.390532,Iron Fist Brewing Company,13," Calgary, Alberta, Canada                          ",3,122,Bire de Garde,http://www.ratebeer.com/beer/iron-fist-spice-of-life/351109/3752/,"Bottle. Fruity and floral aroma. Pours opaque dark yellow with a large frothy head. Hoppy and spicy flavour with notes of cloves, corriander and nutmeg. Medium bodied. Moderate bitter finish.  ",80.547,RobBestwick,California,6.5%,Iron Fist Spice of Life
2,0,http://www.ratebeer.com/user/3752/beer-ratings/,52,1,346,3,7,775,3.4 AROMA 7/10 APPEARANCE 4/5 TASTE 7/10 PALATE 3/5 OVERALL 13/20RobBestwick(775),7,42,3752,3.4,40.556,3.283669,Borg Brugghs,13," Calgary, Alberta, Canada                          ",4,204,Saison,http://www.ratebeer.com/beer/borg-leifur-nr-32/341732/3752/,Bottle. Fruity aroma - mango and strawberry. Pours cloudy dark yellow with frothy white head. Bitter citrus flavour with notes of grapefruit and pepper. Medium bodied and sharp bitter finish. Interesting beer. ,65.917,RobBestwick,Iceland,6.8%,Borg Leifur Nr. 32
2,0,http://www.ratebeer.com/user/3752/beer-ratings/,136,1,346,3,6,775,2.9 AROMA 5/10 APPEARANCE 3/5 TASTE 6/10 PALATE 3/5 OVERALL 12/20RobBestwick(775),5,42,3752,2.9,1.471,2.641722,Big Rock Brewery,12," Calgary, Alberta, Canada                          ",3,136,India Pale Ale (IPA),http://www.ratebeer.com/beer/big-rock-ipa-india-pale-ale/13701/3752/,473ml can. Light toffee aroma. Pours copper in colour with a decent frothy white head. Miimal carbonation. Flavours are toffee and biscuits with a low to medium level of hoppiness. Medium bodied. Mild bitter finish. OK. ,15.644,RobBestwick,Canada,5.5%,Big Rock IPA (India Pale Ale)
2,0,http://www.ratebeer.com/user/3752/beer-ratings/,126,1,346,4,8,775,3.9 AROMA 8/10 APPEARANCE 4/5 TASTE 8/10 PALATE 4/5 OVERALL 15/20RobBestwick(775),8,42,3752,3.9,72.831,3.748596,Spider Bite Beer Company,15," Calgary, Alberta, Canada                          ",4,126,Imperial Stout,http://www.ratebeer.com/beer/spider-bite-boris-the-spider/160715/3752/,From a bottle. Roasted coffee and dark chocolate aroma. Pours jet black in colour with a small rusty brown head. Taste is like an espresso with notes of dark chocolate and nuts. Thick and medicinal in texture with some warming alcohol feeling. Nicely balanced finish. Good stout. ,97.647,RobBestwick,New York,10%,Spider Bite Boris the Spider
2,0,http://www.ratebeer.com/user/3752/beer-ratings/,329,1,346,3,7,775,3.5 AROMA 7/10 APPEARANCE 4/5 TASTE 7/10 PALATE 3/5 OVERALL 14/20RobBestwick(775),7,42,3752,3.5,89.261,3.360814,Anderson Valley Brewing Company,14," Calgary, Alberta, Canada                          ",4,329,Spice/Herb/Vegetable,http://www.ratebeer.com/beer/anderson-valley-fall-hornin-pumpkin-ale/225499/3752/,"Bottle. Spice, nutmeg and pumpkin aroma. Dark brown in colour with creamy off white head. Spice, cloves and nutmeg with subtle pumpkin flavours and some hops. Full bodied and a slightly bitter finish. Good brew. ",76.557,RobBestwick,California,6%,Anderson Valley Fall Hornin Pumpkin Ale
2,0,http://www.ratebeer.com/user/3752/beer-ratings/,42,1,346,3,7,775,3.4 AROMA 7/10 APPEARANCE 4/5 TASTE 7/10 PALATE 3/5 OVERALL 13/20RobBestwick(775),7,42,3752,3.4,59.192,3.339164,Saugatuck Brewing Company,13," Calgary, Alberta, Canada                          ",4,177,Stout,http://www.ratebeer.com/beer/saugatuck-blueberry-maple-stout/359078/3752/,"355ml bottle. Strong blueberry and maple aroma with a hint of coffee as well. Porter like in appearance - black with a small brownish head. Very sweet and malty with blueberry, maple, coffee and brown sugar flavours. Full bodied with a syrupy texture. Sweet malty finish. Not bad if you dont mind the sweetness. ",73.695,RobBestwick,Michigan,5.9%,Saugatuck Blueberry Maple Stout
2,0,http://www.ratebeer.com/user/3752/beer-ratings/,129,1,346,3,7,775,3.3 AROMA 7/10 APPEARANCE 3/5 TASTE 7/10 PALATE 3/5 OVERALL 13/20RobBestwick(775),7,42,3752,3.3,58.473,3.307461,Aviator Brewing Company,13," Calgary, Alberta, Canada                          ",3,129,Abbey Tripel,http://www.ratebeer.com/beer/aviator-devils-tramping-ground-tripel/96071/3752/,"From a can. Fresh banana aroma. Cloudy dark orange colour with a small white head. Banana, cloves and spice flavours. Thin to medium body with a sweet finish. Decent brew. ",69.388,RobBestwick,North Carolina,9.2%,Aviator Devils Tramping Ground Tripel
2,0,http://www.ratebeer.com/user/3752/beer-ratings/,46,1,346,4,8,775,3.9 AROMA 8/10 APPEARANCE 4/5 TASTE 8/10 PALATE 4/5 OVERALL 15/20RobBestwick(775),8,42,3752,3.9,91.709,3.39234,West Sixth Brewing Company,15," Calgary, Alberta, Canada                          ",4,270,Spice/Herb/Vegetable,http://www.ratebeer.com/beer/west-sixth-christmas-ale/240496/3752/,"From a can. Strong spice, nutmeg and christmas pudding aroma. Opaque dark brown colour with a yellowish head. Christmas pudding and brandy flavours with lots of dark fruit and warming alcohol. Full bodied with a very sweet malty finish. ",80.967,RobBestwick,Kentucky,9%,West Sixth Christmas Ale
2,0,http://www.ratebeer.com/user/3752/beer-ratings/,23,1,346,3,6,775,3.1 AROMA 7/10 APPEARANCE 3/5 TASTE 6/10 PALATE 3/5 OVERALL 12/20RobBestwick(775),7,42,3752,3.1,5.719,3.101206,Arrowhead Brewing,12," Calgary, Alberta, Canada                          ",3,219,Imperial IPA,http://www.ratebeer.com/beer/arrowhead-im-so-freaking-hoppy-ipa/225792/3752/,"650ml bottle. Moderate lemon - citrus aroma. Pours a cloudy dark brown/orange with frothy head. Toffee, grapefruit and cloves are present in the flavour. Creamy texture and a strong bitter finish. ",45.554,RobBestwick,Canada,7.3%,Arrowhead Im So Freaking Hoppy! IPA
