user_num_places_rated,user_num_following,user_url,beer_num_ratings,user_num_friends,user_num_breweries_rated,review_palate_score,review_taste_score,user_num_ratings,review_ratings_blob,review_aroma_score,user_num_countries_rated,user_id,review_avg_score,beer_global_style_score,beer_weighted_avg_score,beer_brewer_name,review_overall_score,user_location,review_appearance_score,beer_num_calories,beer_style,beer_url,review_blob,beer_global_score,user_name,beer_location,beer_ABV,beer_name
0,0,http://www.ratebeer.com/user/37982/beer-ratings/,14,0,4,2,2,5,1.1 AROMA 2/10 APPEARANCE 2/5 TASTE 2/10 PALATE 2/5 OVERALL 3/20xvulic(5),2,2,37982,1.1,29.039,1.895768,Pivovara Daruvar,3, Croatia                         ,2,126,Pale Lager,http://www.ratebeer.com/beer/pub-svijetlo/46369/37982/,Product of Osjecka Pivovara for the Getro (a Croatian hypermarked). Very cheap and very bad. Similiar to President Choice but a little worse. ,2.5,xvulic,Croatia,4.2%,Pub Svijetlo
0,0,http://www.ratebeer.com/user/37982/beer-ratings/,144,0,4,3,4,5,2.3 AROMA 4/10 APPEARANCE 2/5 TASTE 4/10 PALATE 3/5 OVERALL 10/20xvulic(5),4,2,37982,2.3,42.936,2.032074,Carlsberg Croatia,10, Croatia                         ,2,144,Pale Lager,http://www.ratebeer.com/beer/pan-lager/9373/37982/,"Average bear, gold color, flavour is bland and smooth, very light. Highly available in the Croatia ",3.82,xvulic,Croatia,4.8%,Pan Lager
0,0,http://www.ratebeer.com/user/37982/beer-ratings/,8,0,4,2,3,5,1.5 AROMA 3/10 APPEARANCE 2/5 TASTE 3/10 PALATE 2/5 OVERALL 5/20xvulic(5),3,2,37982,1.5,,1.99,Tvornica Piva (ex. Pivovara Regent),5, Croatia                         ,2,144,Pilsener,http://www.ratebeer.com/beer/regent-croatia/13025/37982/,"Croatian bears is not very good, but this one is in my opinion bad bear even under Croatian standards ",,xvulic,Croatia,4.8%,Regent (Croatia)
0,0,http://www.ratebeer.com/user/37982/beer-ratings/,72,0,4,4,9,5,4.4 AROMA 9/10 APPEARANCE 4/5 TASTE 9/10 PALATE 4/5 OVERALL 18/20xvulic(5),9,2,37982,4.4,49.524,2.96884,Heineken Slovensko,18, Croatia                         ,4,135,Dunkel/Tmav,http://www.ratebeer.com/beer/zlaty-bazant-tmavy-115-golden-pheasant-dark/24292/37982/,Slovak dark beer with mild bitterness and a caramel taste. A little bit too sweet but I like it. ,37.472,xvulic,Slovak Republic,4.5%,Zlat Baant Tmavy 11.5 % (Golden Pheasant Dark)
0,0,http://www.ratebeer.com/user/37982/beer-ratings/,846,0,4,5,10,5,4.8 AROMA 10/10 APPEARANCE 4/5 TASTE 10/10 PALATE 5/5 OVERALL 19/20xvulic(5),10,2,37982,4.8,31.691,2.677192,Heineken Slovensko,19, Croatia                         ,4,846,Czech Pilsner (Svtl),http://www.ratebeer.com/beer/zlaty-bazant-12--golden-pheasant--premium/2549/37982/,"Greath bear, unfortunatelly only available in Slovak Republic. I just return from Bratislava and bring 24 cans with me. ",,xvulic,Slovak Republic,5%,Zlat Baant (12% / Golden Pheasant / Premium)
