user_num_places_rated,user_num_following,user_url,beer_num_ratings,user_num_friends,user_num_breweries_rated,review_palate_score,review_taste_score,user_num_ratings,review_ratings_blob,review_aroma_score,user_num_countries_rated,user_id,review_avg_score,beer_global_style_score,beer_weighted_avg_score,beer_brewer_name,review_overall_score,user_location,review_appearance_score,beer_num_calories,beer_style,beer_url,review_blob,beer_global_score,user_name,beer_location,beer_ABV,beer_name
0,0,http://www.ratebeer.com/user/399117/beer-ratings/,68,0,7,3,5,7,2.4 AROMA 4/10 APPEARANCE 3/5 TASTE 5/10 PALATE 3/5 OVERALL 9/20Jimbo666(7),4,3,399117,2.4,21.829,2.718118,Joseph Holt,9,,3,126,Golden Ale/Blond Ale,http://www.ratebeer.com/beer/holts-two-hoots-bottle/153594/399117/,Not bad aroma. Pours good head but taste is watery with fairly strong bitter finish. Not bad but a bit too watery ,19.909,Jimbo666,England,4.2%,Holts Two Hoots (Bottle)
0,0,http://www.ratebeer.com/user/399117/beer-ratings/,1293,0,7,3,6,7,2.6 AROMA 3/10 APPEARANCE 3/5 TASTE 6/10 PALATE 3/5 OVERALL 11/20Jimbo666(7),3,3,399117,2.6,43.134,2.033744,United Breweries Group,11,,3,1293,Pale Lager,http://www.ratebeer.com/beer/kingfisher-premium-lager-beer/214/399117/,"Pours good head which fades slowly. Slightly sweet very faint aroma, refreshing watery taste with lasting bitter finish. Good with a curry ",3.82,Jimbo666,India,5%,Kingfisher (Premium) Lager Beer
0,0,http://www.ratebeer.com/user/399117/beer-ratings/,181,0,7,3,7,7,2.9 AROMA 3/10 APPEARANCE 3/5 TASTE 7/10 PALATE 3/5 OVERALL 13/20Jimbo666(7),3,3,399117,2.9,14.959,2.745415,Bankss (Marstons),13,,3,181,Bitter,http://www.ratebeer.com/beer/bankss-bitter-filtered/66286/399117/,"Another aldi special. 89p so I wasnt expecting much but pleasantly surprised. Couldnt get much aroma, very faint burnt malt smell. Good bittersweet malty hit which fades. For 89p Im not complaining  ",20.297,Jimbo666,England,3.8%,Bankss Bitter (Filtered)
0,0,http://www.ratebeer.com/user/399117/beer-ratings/,7,0,7,3,6,7,3.1 AROMA 6/10 APPEARANCE 3/5 TASTE 6/10 PALATE 3/5 OVERALL 13/20Jimbo666(7),6,3,399117,3.1,,2.681071,Badger (Hall & Woodhouse),13,,3,126,Bitter,http://www.ratebeer.com/beer/badger-wild-wader/391897/399117/,"Another purchase from aldi. Good beer from badger brewery will definitely get some more. Pours with a nice head, fruity aroma taste slightly watery, zesty malt finish ",,Jimbo666,England,4.2%,Badger Wild Wader
0,0,http://www.ratebeer.com/user/399117/beer-ratings/,433,0,7,3,7,7,3 AROMA 4/10 APPEARANCE 3/5 TASTE 7/10 PALATE 3/5 OVERALL 13/20Jimbo666(7),4,3,399117,3,73.572,3.058322,Brakspear (Marstons),13,,3,433,Bitter,http://www.ratebeer.com/beer/brakspear-oxford-gold-bottle/13191/399117/,"Working my way through the aldi ale section. This has been the best yet. Couldnt get much aroma from it, good fruity flavour with a bitter finish. Pretty good one from Marston.  ",42.195,Jimbo666,England,4.6%,Brakspear Oxford Gold (Bottle)
0,0,http://www.ratebeer.com/user/399117/beer-ratings/,345,0,7,2,3,7,1.4 AROMA 3/10 APPEARANCE 3/5 TASTE 3/10 PALATE 2/5 OVERALL 3/20Jimbo666(7),3,3,399117,1.4,3.087,2.474856,Greene King,3,,3,345,Bitter,http://www.ratebeer.com/beer/greene-king-ipa-cask/44839/399117/,"Quite bland. Not much head, watery bitter notes. Disappointing! The aroma is probably the best thing about the beer but the taste disappoints.  ",11.189,Jimbo666,England,3.6%,Greene King IPA (Cask)
0,0,http://www.ratebeer.com/user/399117/beer-ratings/,21,0,7,2,3,7,1.3 AROMA 2/10 APPEARANCE 3/5 TASTE 3/10 PALATE 2/5 OVERALL 3/20Jimbo666(7),2,3,399117,1.3,82.799,2.374866,Saint-Omer,3,,3,135,Pale Lager,http://www.ratebeer.com/beer/saint-omer-munsterbrau/44436/399117/,"Its poor. Got fooled by the lowestein name and thought Id have a punt on it. Its watery, pretty tasteless pish, as youd expect from a saint omer ",9.335,Jimbo666,France,4.5%,Saint-Omer Munsterbru
