user_num_places_rated,user_num_following,user_url,beer_num_ratings,user_num_friends,user_num_breweries_rated,review_palate_score,review_taste_score,user_num_ratings,review_ratings_blob,review_aroma_score,user_num_countries_rated,user_id,review_avg_score,beer_global_style_score,beer_weighted_avg_score,beer_brewer_name,review_overall_score,user_location,review_appearance_score,beer_num_calories,beer_style,beer_url,review_blob,beer_global_score,user_name,beer_location,beer_ABV,beer_name
0,0,http://www.ratebeer.com/user/4482/beer-ratings/,1145,0,41,3,4,99,2.4 AROMA 4/10 APPEARANCE 3/5 TASTE 4/10 PALATE 3/5 OVERALL 10/20JohnDo2000(99),4,13,4482,2.4,13.019,2.62714,Flying Dog Brewery,10," Metairie, Louisiana",3,1145,Golden Ale/Blond Ale,http://www.ratebeer.com/beer/flying-dog-tire-bite-golden-ale/687/4482/,"I bought a variety pack of flying dog beers, and this one was by far my favorite.  I wasnt terribly impressed by the brewery honestly.  If I were to  buy flying dog again, it would most certainly be this particular brew.  Give it a shot...you may have another opinion. ",15.234,JohnDo2000,Maryland,5.1%,Flying Dog Tire Bite Golden Ale
0,0,http://www.ratebeer.com/user/4482/beer-ratings/,993,0,41,2,1,99,1.3 AROMA 3/10 APPEARANCE 3/5 TASTE 1/10 PALATE 2/5 OVERALL 4/20JohnDo2000(99),3,13,4482,1.3,40.258,3.249314,Flying Dog Brewery,4," Metairie, Louisiana",3,993,India Pale Ale (IPA),http://www.ratebeer.com/beer/flying-dog-snake-dog-ipa-through-2007/684/4482/,"Ugh. Not a fan at all. I feel guilty because a lot of other beer connasseurs tend to enjoy it, but I didnt.  I bot a variety pack with about seven different flying dog brews, and this one was my least favorite.  Oh well...my opinion might be crap.  I probably had a bad batch considering the other reviews. I will give it another try and re-review it shortly. ",65.097,JohnDo2000,Maryland,5.75%,Flying Dog Snake Dog IPA (through 2007)
0,0,http://www.ratebeer.com/user/4482/beer-ratings/,657,0,41,3,8,99,2.8 AROMA 1/10 APPEARANCE 1/5 TASTE 8/10 PALATE 3/5 OVERALL 15/20JohnDo2000(99),1,13,4482,2.8,41.355,2.912426,"Vermont Hard Cider Company, LLC (C&C; Group)",15," Metairie, Louisiana",1,657,Cider,http://www.ratebeer.com/beer/woodchuck-amber-draft-cider/2989/4482/,"I dont know that I call this a beer, but whatever.  Its a good cider.  Very fruity, very light, and very sweet.  Goes over well with the ladies as well.  Dont drink too much of these, so I dont have too much of a comparrison.  I still like it. ",31.691,JohnDo2000,LLC,5%,Woodchuck Amber Draft Cider
0,0,http://www.ratebeer.com/user/4482/beer-ratings/,2162,0,41,3,5,99,2.7 AROMA 5/10 APPEARANCE 3/5 TASTE 5/10 PALATE 3/5 OVERALL 11/20JohnDo2000(99),5,13,4482,2.7,6.011,1.604336,Miller Brewing Company (MillerCoors),11," Metairie, Louisiana",3,2162,Pale Lager,http://www.ratebeer.com/beer/miller-genuine-draft-mgd/405/4482/,"Run of the mill, b ut still, you cant knock the MGD too much.  A lot more flavor than any of the other miller products, MGD gives a fairly decent taste with a lot of smoothness.  Unfortunately, Miller isnt too flavorfull to begin with. ",0.441,JohnDo2000,Wisconsin,4.7%,Miller Genuine Draft (MGD)
0,0,http://www.ratebeer.com/user/4482/beer-ratings/,2363,0,41,1,3,99,1.2 AROMA 1/10 APPEARANCE 2/5 TASTE 3/10 PALATE 1/5 OVERALL 5/20JohnDo2000(99),1,13,4482,1.2,2.353,1.40132,Miller Brewing Company (MillerCoors),5," Metairie, Louisiana",2,2363,Pale Lager,http://www.ratebeer.com/beer/miller-lite/403/4482/,"Great for festivals/ballgames, etc, but not a bar drink at all.  Dont quite understand the big hype over all the miller products, but its a decent light beer. ",0.147,JohnDo2000,Wisconsin,4.2%,Miller Lite
0,0,http://www.ratebeer.com/user/4482/beer-ratings/,3108,0,41,3,7,99,3.6 AROMA 7/10 APPEARANCE 3/5 TASTE 7/10 PALATE 3/5 OVERALL 16/20JohnDo2000(99),7,13,4482,3.6,42.467,2.968881,Coors Brewing Company (MillerCoors),16," Metairie, Louisiana",3,3108,Witbier,http://www.ratebeer.com/beer/blue-moon-belgian-white-ale/2228/4482/,"Wonderfull summer brew with a distinct taste and very aeromatic aftertaste.  Hopsy with a lot of head.  Very smooth finish.
 ",35.73,JohnDo2000,Colorado,5.4%,Blue Moon Belgian White Ale
0,0,http://www.ratebeer.com/user/4482/beer-ratings/,581,0,41,3,7,99,2.7 AROMA 3/10 APPEARANCE 2/5 TASTE 7/10 PALATE 3/5 OVERALL 12/20JohnDo2000(99),3,13,4482,2.7,9.335,2.666558,Molson Coors UK (MolsonCoors),12," Metairie, Louisiana",2,581,Bitter,http://www.ratebeer.com/beer/caffreys/824/4482/,Decent ale.  More of a lagery taste.  Light and creamy taste. ,16.595,JohnDo2000,England,3.8%,Caffreys 
0,0,http://www.ratebeer.com/user/4482/beer-ratings/,1483,0,41,3,6,99,3.2 AROMA 5/10 APPEARANCE 3/5 TASTE 6/10 PALATE 3/5 OVERALL 15/20JohnDo2000(99),5,13,4482,3.2,46.078,2.076851,FEMSA - Cuauhtmoc-Moctezuma (Heineken),15," Metairie, Louisiana",3,1483,Pale Lager,http://www.ratebeer.com/beer/dos-equis-xx-special-lager/225/4482/,"Very smooth and light beer.  Good flavor despite its thinnes.  Much better with a lime in it.  Better than corona - MUCH better.  When I went to Mexico, they said that they keep this beer for themselves and export the corona. ",4.405,JohnDo2000,Mexico,4.2%,Dos Equis XX Special Lager
