user_num_places_rated,user_num_following,user_url,beer_num_ratings,user_num_friends,user_num_breweries_rated,review_palate_score,review_taste_score,user_num_ratings,review_ratings_blob,review_aroma_score,user_num_countries_rated,user_id,review_avg_score,beer_global_style_score,beer_weighted_avg_score,beer_brewer_name,review_overall_score,user_location,review_appearance_score,beer_num_calories,beer_style,beer_url,review_blob,beer_global_score,user_name,beer_location,beer_ABV,beer_name
0,0,http://www.ratebeer.com/user/48094/beer-ratings/,31,0,3,2,4,5,1.7 AROMA 1/10 APPEARANCE 3/5 TASTE 4/10 PALATE 2/5 OVERALL 7/20Centerice(5),1,2,48094,1.7,0.588,2.337714,Church-Key Brewing,7," Ontario, Canada                          ",3,210,Sour Red/Brown,http://www.ratebeer.com/beer/church-key-the-lactese-falcon/78808/48094/,This beer pours to a dark brown body with a wispy tan head.  The nose is an immediate scent of blue cheese with a secondary sour malt aroma. The mouth feel is thin and acidic with a mildly sour finish. This is definitely a disappointment from one of the top brewers around. ,11.472,Centerice,Canada,7%,Church-Key The Lactese Falcon
0,0,http://www.ratebeer.com/user/48094/beer-ratings/,2182,0,3,3,6,5,3.1 AROMA 6/10 APPEARANCE 3/5 TASTE 6/10 PALATE 3/5 OVERALL 13/20Centerice(5),6,2,48094,3.1,79.692,3.189264,Wychwood (Marstons),13," Ontario, Canada                          ",3,2182,Premium Bitter/ESB,http://www.ratebeer.com/beer/wychwood-hobgoblin-pasteurised/5107/48094/,A deep reddish-brown colour with a wispy white head.  A sweet malt and chocolate aroma with a subtle hint of fruitiness. The flavour delivers much like the aroma with a thick sweet malt and chocolate overtone with a nice fruit finish.  ,51.03,Centerice,England,5.2%,Wychwood Hobgoblin (Pasteurised)
0,0,http://www.ratebeer.com/user/48094/beer-ratings/,810,0,3,3,7,5,3.2 AROMA 6/10 APPEARANCE 3/5 TASTE 7/10 PALATE 3/5 OVERALL 13/20Centerice(5),6,2,48094,3.2,83.679,3.217333,Shepherd Neame,13," Ontario, Canada                          ",3,810,Premium Bitter/ESB,http://www.ratebeer.com/beer/shepherd-neame-bishops-finger-pasteurised/4139/48094/,"Deep copper appearance, with a wispy white head.  Earthy, hoppy aroma with a hint  of citrus and sweet fruit.  Medium bodied with an excellent hop and citrus flavour that finishes with a sweet caramel malt aftertaste.  ",55.574,Centerice,England,5.4%,Shepherd Neame Bishops Finger (Pasteurised)
0,0,http://www.ratebeer.com/user/48094/beer-ratings/,88,0,3,3,6,5,2.9 AROMA 5/10 APPEARANCE 3/5 TASTE 6/10 PALATE 3/5 OVERALL 12/20Centerice(5),5,2,48094,2.9,13.437,2.602087,Church-Key Brewing,12," Ontario, Canada                          ",3,150,English Pale Ale,http://www.ratebeer.com/beer/church-key-northumberland-ale/7664/48094/,A nice golden ale with a thin wispy head.  Light body and flavour with a crisp grapefruit finish.  Enjoyable pint but not Church-Keys best effort. ,15.097,Centerice,Canada,5%,Church-Key Northumberland Ale
0,0,http://www.ratebeer.com/user/48094/beer-ratings/,198,0,3,4,8,5,3.6 AROMA 6/10 APPEARANCE 3/5 TASTE 8/10 PALATE 4/5 OVERALL 15/20Centerice(5),6,2,48094,3.6,50.588,3.305687,Church-Key Brewing,15," Ontario, Canada                          ",3,198,Smoked,http://www.ratebeer.com/beer/church-key-holy-smoke/17829/48094/,"A dark reddish brown colour with a modest fizzy head.  A slight smoky, peaty aroma with a hint of bbq. Smokey flavour with notes of cooked bacon, biscuits and sweet caramel.   A very accessible and enjoyable smoke beer.  ",69.518,Centerice,Canada,6.2%,Church-Key Holy Smoke
