user_num_places_rated,user_num_following,user_url,beer_num_ratings,user_num_friends,user_num_breweries_rated,review_palate_score,review_taste_score,user_num_ratings,review_ratings_blob,review_aroma_score,user_num_countries_rated,user_id,review_avg_score,beer_global_style_score,beer_weighted_avg_score,beer_brewer_name,review_overall_score,user_location,review_appearance_score,beer_num_calories,beer_style,beer_url,review_blob,beer_global_score,user_name,beer_location,beer_ABV,beer_name
0,0,http://www.ratebeer.com/user/50157/beer-ratings/,271,0,74,3,7,279,2.6 AROMA 3/10 APPEARANCE 3/5 TASTE 7/10 PALATE 3/5 OVERALL 10/20Bcoble003(279),3,17,50157,2.6,59.335,3.009145,Boston Beer Company,10," Aiea, Hawaii",3,271,Klsch,http://www.ratebeer.com/beer/samuel-adams-escape-route/243590/50157/,This beer is pretty satisfying. cannot complain from the bottle. not a whole lot of tasty notes. I do like how it is smooth.  ,38.706,Bcoble003,Massachusetts,5%,Samuel Adams Escape Route
0,0,http://www.ratebeer.com/user/50157/beer-ratings/,200,0,74,3,3,279,2.2 AROMA 3/10 APPEARANCE 3/5 TASTE 3/10 PALATE 3/5 OVERALL 10/20Bcoble003(279),3,17,50157,2.2,16.053,2.709407,Coors Brewing Company (MillerCoors),10," Aiea, Hawaii",3,200,Amber Ale,http://www.ratebeer.com/beer/blue-moon-valencia-grove-amber-ale/159507/50157/,"This beer is out of the bottle. smells like nothing, tastes like wheat that is about all for this. it is not a terrible taste but I really do not taste any orange what so ever. ",19.649,Bcoble003,Colorado,5.9%,Blue Moon Valencia Grove Amber Ale
0,0,http://www.ratebeer.com/user/50157/beer-ratings/,1948,0,74,3,6,279,2.9 AROMA 6/10 APPEARANCE 2/5 TASTE 6/10 PALATE 3/5 OVERALL 12/20Bcoble003(279),6,17,50157,2.9,95.672,3.238983,Goose Island Beer Company (AB-InBev),12," Aiea, Hawaii",2,1948,Bitter,http://www.ratebeer.com/beer/goose-island-honkers-ale/811/50157/,"Chocolate, coffee malt smooth Finnish. This beer is worthy of everyone on this site to try. You will not be disappointed!



---Rated via Beer Buddy for iPhone ",59.048,Bcoble003,Illinois,4.3%,Goose Island Honkers Ale
0,0,http://www.ratebeer.com/user/50157/beer-ratings/,107,0,74,3,7,279,3.2 AROMA 5/10 APPEARANCE 3/5 TASTE 7/10 PALATE 3/5 OVERALL 14/20Bcoble003(279),5,17,50157,3.2,14.132,2.350139,Miller Brewing Company (MillerCoors),14," Aiea, Hawaii",3,107,Fruit Beer,http://www.ratebeer.com/beer/redds-strawberry-ale/225169/50157/,"Tastes like strawberries and cream oatmeal when I was a child. The strawberries are noticeable but not over powering. If I was laying in a hammock on a warm summers day this would be perfect!.

---Rated via Beer Buddy for iPhone ",8.617,Bcoble003,Wisconsin,5%,Redds Strawberry Ale
