user_num_places_rated,user_num_following,user_url,beer_num_ratings,user_num_friends,user_num_breweries_rated,review_palate_score,review_taste_score,user_num_ratings,review_ratings_blob,review_aroma_score,user_num_countries_rated,user_id,review_avg_score,beer_global_style_score,beer_weighted_avg_score,beer_brewer_name,review_overall_score,user_location,review_appearance_score,beer_num_calories,beer_style,beer_url,review_blob,beer_global_score,user_name,beer_location,beer_ABV,beer_name
0,0,http://www.ratebeer.com/user/56712/beer-ratings/,1379,0,5,4,6,6,3.1 AROMA 6/10 APPEARANCE 3/5 TASTE 6/10 PALATE 4/5 OVERALL 12/20badbrains(6),6,3,56712,3.1,99.841,3.873807,Allagash Brewing Company,12," New York, New York",3,1379,Abbey Tripel,http://www.ratebeer.com/beer/allagash-tripel-reserve/3063/56712/,"Bottle, batch #83.  Slightly cloudy gold in color.  Medium head.  Apple aroma.  Persistent finish a nice surprise to the relatively light body.  Agree with the alcohol comments below.  Like a yeastier better-balanced Tripel, myself. ",99.046,badbrains,Maine,9%,Allagash Tripel Reserve
0,0,http://www.ratebeer.com/user/56712/beer-ratings/,417,0,5,3,8,6,3.7 AROMA 9/10 APPEARANCE 2/5 TASTE 8/10 PALATE 3/5 OVERALL 15/20badbrains(6),9,3,56712,3.7,97.373,3.787933,Southampton Publick House,15," New York, New York",2,417,Saison,http://www.ratebeer.com/beer/southampton-cuvee-des-fleurs/37625/56712/,"Bottle.  Cloudy pour, medium gold color.  Light head.  Orange and apricot aroma.   Strong floral ester and flavor.  Sweet, sour, bitter all well balanced.  Skinny, bubbly feel. ",98.244,badbrains,New York,8.2%,Southampton Cuvee des Fleurs
0,0,http://www.ratebeer.com/user/56712/beer-ratings/,486,0,5,4,9,6,4.2 AROMA 8/10 APPEARANCE 4/5 TASTE 9/10 PALATE 4/5 OVERALL 17/20badbrains(6),8,3,56712,4.2,95.73,3.842105,Southampton Publick House,17," New York, New York",4,486,Abt/Quadrupel,http://www.ratebeer.com/beer/southampton-abbot-12/12631/56712/,"Bottle.  Light molasses color, sweet aroma, medium head.  Strong yet light malt flavor with definite caramel notes.  Mild body complements flavor very well.  Bubbly feel.  Surprisingly complex and refreshing on a summer day post-work! ",98.833,badbrains,New York,10%,Southampton Abbot 12
0,0,http://www.ratebeer.com/user/56712/beer-ratings/,965,0,5,4,7,6,3.7 AROMA 7/10 APPEARANCE 4/5 TASTE 7/10 PALATE 4/5 OVERALL 15/20badbrains(6),7,3,56712,3.7,96.078,3.707323,Brasserie Dupont,15," New York, New York",4,965,Belgian Strong Ale,http://www.ratebeer.com/beer/moinette-biologique/4680/56712/,"""Foret"" branding.  Balanced sweet/sour, with nice bitterness.  Sweet and fruity aroma, complemented by yeasty sourness and spicey light-body.  Refreshing! ",96.873,badbrains,Belgium,7.5%,Moinette Biologique
0,0,http://www.ratebeer.com/user/56712/beer-ratings/,945,0,5,3,7,6,3.2 AROMA 6/10 APPEARANCE 4/5 TASTE 7/10 PALATE 3/5 OVERALL 12/20badbrains(6),6,3,56712,3.2,47.592,2.935966,Privatbrauerei Gaffel Becker & Co.,12," New York, New York",4,945,Klsch,http://www.ratebeer.com/beer/gaffel-kolsch/1692/56712/,"0.4 L draft at Loreley, in NYC.  My first Kolsch, so not much to compare to.  No lingering head, crisp grain, a little dry and tasty. ",33.095,badbrains,Germany,4.8%,Gaffel Klsch
0,0,http://www.ratebeer.com/user/56712/beer-ratings/,1060,0,5,2,5,6,2.5 AROMA 5/10 APPEARANCE 3/5 TASTE 5/10 PALATE 2/5 OVERALL 10/20badbrains(6),5,3,56712,2.5,44.716,2.766248,Radeberger Exportbierbrauerei (Oetker Group),10," New York, New York",3,1060,Pilsener,http://www.ratebeer.com/beer/radeberger-pilsner/8975/56712/,"On tap at Loreley, in NYC.  More golden than the Jevers I had the same trip; I thought it tasty. ",21.195,badbrains,Germany,4.8%,Radeberger Pilsner
