user_num_places_rated,user_num_following,user_url,beer_num_ratings,user_num_friends,user_num_breweries_rated,review_palate_score,review_taste_score,user_num_ratings,review_ratings_blob,review_aroma_score,user_num_countries_rated,user_id,review_avg_score,beer_global_style_score,beer_weighted_avg_score,beer_brewer_name,review_overall_score,user_location,review_appearance_score,beer_num_calories,beer_style,beer_url,review_blob,beer_global_score,user_name,beer_location,beer_ABV,beer_name
0,0,http://www.ratebeer.com/user/62014/beer-ratings/,1124,0,5,4,8,5,3.8 AROMA 7/10 APPEARANCE 4/5 TASTE 8/10 PALATE 4/5 OVERALL 15/20BigT0827(5),7,2,62014,3.8,99.365,3.623126,Tregs Brewing Company,15," Fairfield, Connecticut",4,1124,Amber Ale,http://www.ratebeer.com/beer/troegs-hopback-amber-ale/17495/62014/,"Pours a light amber color with a nice head. It has a strong citrusy hop aroma with a small malt smell. Taste is of malt with a strong hop bitterness, but not too strong. This beer is lowly carbonated with a medium mouthfeel. Its a good hoppy amber ale. ",94.593,BigT0827,Pennsylvania,6%,Tregs HopBack Amber Ale
0,0,http://www.ratebeer.com/user/62014/beer-ratings/,2089,0,5,3,7,5,3.4 AROMA 6/10 APPEARANCE 3/5 TASTE 7/10 PALATE 3/5 OVERALL 15/20BigT0827(5),6,2,62014,3.4,58.617,3.394138,Brooklyn Brewery,15," Fairfield, Connecticut",3,2089,India Pale Ale (IPA),http://www.ratebeer.com/beer/brooklyn-east-india-pale-ale/530/62014/,Pours a golden color with a small lasting head. and good lacing. Aroma is strong with citrus like hops and has a small malt aroma. Taste of light malt and heavy hop flavor with a slight alcoholic aftertaste. A pretty good IPA. ,80.122,BigT0827,New York,6.9%,Brooklyn East India Pale Ale
0,0,http://www.ratebeer.com/user/62014/beer-ratings/,1614,0,5,3,8,5,3.7 AROMA 7/10 APPEARANCE 3/5 TASTE 8/10 PALATE 3/5 OVERALL 16/20BigT0827(5),7,2,62014,3.7,96.193,3.383699,Samuel Smith,16," Fairfield, Connecticut",3,1614,Premium Bitter/ESB,http://www.ratebeer.com/beer/samuel-smiths-india-ale/86/62014/,"Pours a copper color. There is a small head that quickly diminishes while leaving a little lacing on the glass. Aroma is strong from citrus like hops. Has a low level of carbonation with a medium mouth feel.  Taste is similar to aroma with fruit like hops, but a malt flavor is there to balance it. A good example of an English IPA. ",78.93,BigT0827,England,5%,Samuel Smiths India Ale
0,0,http://www.ratebeer.com/user/62014/beer-ratings/,2374,0,5,4,7,5,3.8 AROMA 7/10 APPEARANCE 4/5 TASTE 7/10 PALATE 4/5 OVERALL 16/20BigT0827(5),7,2,62014,3.8,94.958,3.583738,Sierra Nevada Brewing Company,16," Fairfield, Connecticut",4,2374,Porter,http://www.ratebeer.com/beer/sierra-nevada-porter/366/62014/,"Color was a very dark brown, with some red. It had a good off-white head with some lacing. There was a moderate malt smell with a strong hop aroma. Initial flavor is sweet, with a bitter coffee finish. Overall, this is a very good porter. ",93.134,BigT0827,California,5.6%,Sierra Nevada Porter
0,0,http://www.ratebeer.com/user/62014/beer-ratings/,838,0,5,4,6,5,2.8 AROMA 4/10 APPEARANCE 3/5 TASTE 6/10 PALATE 4/5 OVERALL 11/20BigT0827(5),4,2,62014,2.8,31.071,2.742684,Boston Beer Company,11," Fairfield, Connecticut",3,838,Wheat Ale,http://www.ratebeer.com/beer/samuel-adams-hefeweizen/30059/62014/,"Aroma is nothing special, it smells like any other beer. This is a cloudy beer with a white head. The flavor is a little weak, but would be a refreshing beer for a summer day. ",19.909,BigT0827,Massachusetts,5.4%,Samuel Adams Hefeweizen
