user_num_places_rated,user_num_following,user_url,beer_num_ratings,user_num_friends,user_num_breweries_rated,review_palate_score,review_taste_score,user_num_ratings,review_ratings_blob,review_aroma_score,user_num_countries_rated,user_id,review_avg_score,beer_global_style_score,beer_weighted_avg_score,beer_brewer_name,review_overall_score,user_location,review_appearance_score,beer_num_calories,beer_style,beer_url,review_blob,beer_global_score,user_name,beer_location,beer_ABV,beer_name
0,0,http://www.ratebeer.com/user/69473/beer-ratings/,4020,0,8,4,9,9,4.4 AROMA 9/10 APPEARANCE 5/5 TASTE 9/10 PALATE 4/5 OVERALL 17/20barleyandhoppy(9),9,2,69473,4.4,97.702,3.496178,Brouwerij Hoegaarden (InBev),17," Plainfield, Illinois",5,4020,Witbier,http://www.ratebeer.com/beer/hoegaarden/399/69473/,"Loved this beer....Very light in color, nice frothy white head, loved the coriander and orange peel smell and taste, light and refreshing ",88.545,barleyandhoppy,Belgium,4.9%,Hoegaarden 
0,0,http://www.ratebeer.com/user/69473/beer-ratings/,3109,0,8,4,8,9,3.8 AROMA 7/10 APPEARANCE 4/5 TASTE 8/10 PALATE 4/5 OVERALL 15/20barleyandhoppy(9),7,2,69473,3.8,42.467,2.968822,Coors Brewing Company (MillerCoors),15," Plainfield, Illinois",4,3109,Witbier,http://www.ratebeer.com/beer/blue-moon-belgian-white-ale/2228/69473/,"I used to love the blue moon alot more then I started tasting real belgium whites.  Best in tap, very cold with a slice of orange ",35.639,barleyandhoppy,Colorado,5.4%,Blue Moon Belgian White Ale
0,0,http://www.ratebeer.com/user/69473/beer-ratings/,424,0,8,3,4,9,2.6 AROMA 4/10 APPEARANCE 3/5 TASTE 4/10 PALATE 3/5 OVERALL 12/20barleyandhoppy(9),4,2,69473,2.6,15.781,2.596642,Coors Brewing Company (MillerCoors),12," Plainfield, Illinois",3,424,Wheat Ale,http://www.ratebeer.com/beer/blue-moon-rising-moon-spring-ale/69699/69473/," hint of lime in the nose, not a taste expexted from blue moon, they shouls stick to the original.  very blahh and boring will give it to some people that stop by the house I do not like ",14.27,barleyandhoppy,Colorado,5.6%,Blue Moon Rising Moon Spring Ale
0,0,http://www.ratebeer.com/user/69473/beer-ratings/,1470,0,8,4,8,9,4.3 AROMA 9/10 APPEARANCE 4/5 TASTE 8/10 PALATE 4/5 OVERALL 18/20barleyandhoppy(9),9,2,69473,4.3,91.709,3.604224,Southern Tier Brewing Company (ABV),18," Plainfield, Illinois",4,1470,India Pale Ale (IPA),http://www.ratebeer.com/beer/southern-tier-ipa/23004/69473/,"nice smell of hops and a hint of floral, nice and hoppy on the palate.  has a clean, refreshing, long finish ",93.908,barleyandhoppy,New York,7.3%,Southern Tier IPA
0,0,http://www.ratebeer.com/user/69473/beer-ratings/,302,0,8,2,4,9,2.1 AROMA 2/10 APPEARANCE 3/5 TASTE 4/10 PALATE 2/5 OVERALL 10/20barleyandhoppy(9),2,2,69473,2.1,41.918,2.971508,New Belgium Brewing Company,10," Plainfield, Illinois",3,302,Spice/Herb/Vegetable,http://www.ratebeer.com/beer/new-belgium-springboard-ale/68961/69473/,"12 oz bottle, yeast citrus smell, very bad taste of malt, could have done better, even worse after taste ",35.998,barleyandhoppy,Colorado,6.2%,New Belgium Springboard Ale
0,0,http://www.ratebeer.com/user/69473/beer-ratings/,604,0,8,3,6,9,3.1 AROMA 1/10 APPEARANCE 4/5 TASTE 6/10 PALATE 3/5 OVERALL 17/20barleyandhoppy(9),1,2,69473,3.1,77.702,3.1572,Rogue Ales,17," Plainfield, Illinois",4,604,Wheat Ale,http://www.ratebeer.com/beer/rogue-mom-hefeweizen/583/69473/,"22 oz bomber, lots of hops very smooth wheat beer, not as strong of wheat as normal but it is called half! ",49.259,barleyandhoppy,Oregon,5.2%,Rogue MoM Hefeweizen
0,0,http://www.ratebeer.com/user/69473/beer-ratings/,2527,0,8,5,8,9,4.2 AROMA 8/10 APPEARANCE 4/5 TASTE 8/10 PALATE 5/5 OVERALL 17/20barleyandhoppy(9),8,2,69473,4.2,99.418,3.872997,Bear Republic Brewing Company,17," Plainfield, Illinois",4,2527,India Pale Ale (IPA),http://www.ratebeer.com/beer/bear-republic-racer-5-ipa/1608/69473/,"22 oz bomber, light brown color, light beige head, citrus and pine to the taste, good balance, delicious ",99.046,barleyandhoppy,California,7.5%,Bear Republic Racer 5 IPA
0,0,http://www.ratebeer.com/user/69473/beer-ratings/,1712,0,8,4,7,9,3.7 AROMA 7/10 APPEARANCE 3/5 TASTE 7/10 PALATE 4/5 OVERALL 16/20barleyandhoppy(9),7,2,69473,3.7,80.441,3.795646,New Holland Brewing Company,16," Plainfield, Illinois",3,1712,Imperial Stout,http://www.ratebeer.com/beer/new-holland-dragons-milk/14621/69473/,"22 oz bomber, dark as coffee with very little head, flovor of cappucino and very clean finish ",98.298,barleyandhoppy,Michigan,11%,New Holland Dragons Milk
0,0,http://www.ratebeer.com/user/69473/beer-ratings/,777,0,8,4,9,9,4.2 AROMA 8/10 APPEARANCE 4/5 TASTE 9/10 PALATE 4/5 OVERALL 17/20barleyandhoppy(9),8,2,69473,4.2,81.588,3.509672,Goose Island Beer Company (AB-InBev),17," Plainfield, Illinois",4,777,Sweet Stout,http://www.ratebeer.com/beer/goose-island-oatmeal-stout/815/69473/,First initial taste is strong with coffee and follows with a smooth chocolate ,89.572,barleyandhoppy,Illinois,5.1%,Goose Island Oatmeal Stout
