user_num_places_rated,user_num_following,user_url,beer_num_ratings,user_num_friends,user_num_breweries_rated,review_palate_score,review_taste_score,user_num_ratings,review_ratings_blob,review_aroma_score,user_num_countries_rated,user_id,review_avg_score,beer_global_style_score,beer_weighted_avg_score,beer_brewer_name,review_overall_score,user_location,review_appearance_score,beer_num_calories,beer_style,beer_url,review_blob,beer_global_score,user_name,beer_location,beer_ABV,beer_name
0,0,http://www.ratebeer.com/user/81008/beer-ratings/,3581,0,2,5,9,3,4.6 AROMA 9/10 APPEARANCE 5/5 TASTE 9/10 PALATE 5/5 OVERALL 18/20chandahar(3),9,2,81008,4.6,,4.434106,Westvleteren Abdij St. Sixtus,18," Westfield, New York",5,3581,Abt/Quadrupel,http://www.ratebeer.com/beer/westvleteren-12-xii/4934/81008/,"A wonderfull brew full of flavor with an well defined head. Pours smooth and is very refreshing. It has a slow linger on the palate that compliments the start and the finish is incredible.

This brew rivals the big names in Color, flavoe, finish, and overall score in my book. ",,chandahar,Belgium,10.2%,Westvleteren 12 (XII)
0,0,http://www.ratebeer.com/user/81008/beer-ratings/,10,0,2,3,3,3,2.3 AROMA 4/10 APPEARANCE 4/5 TASTE 3/10 PALATE 3/5 OVERALL 9/20chandahar(3),4,2,81008,2.3,20.1,2.51,Portland Brewing Company (Pyramid - North American Breweries),9," Westfield, New York",4,120,Wheat Ale,http://www.ratebeer.com/beer/elk-rock-bugling-bull-hefeweisen/26473/81008/,"I am a heffeweizen lover, and when I poured this particular brand my mouth was watering to take a swig.  It was a pleasent color and had a good head, but when it comes to taste, it was just like the beach...NEAR WATER!

  With almost no distinct flavor this was a huge dissapointment in my book. Do yourself a favor, pass this one by. ",16.4,chandahar,Oregon,4%,Elk Rock Bugling Bull Hefeweisen
0,0,http://www.ratebeer.com/user/81008/beer-ratings/,33,0,2,4,8,3,4.2 AROMA 8/10 APPEARANCE 4/5 TASTE 8/10 PALATE 4/5 OVERALL 18/20chandahar(3),8,2,81008,4.2,71.323,3.345176,Portland Brewing Company (Pyramid - North American Breweries),18," Westfield, New York",4,,Porter,http://www.ratebeer.com/beer/portland-brewing-haystack-black-porter/131/81008/,"This is one of my favorite Microbrews.  It has a unique flavor with a nice finish.  It doesnt overpower the palate, nor does it linger for a long period of time.  If youre a dark beer lover pick up a Haystack Black and give it a go.

Note: If you find a bottle in a basement...best to leave it and go buy one fresh. ",82.299,chandahar,Oregon,,Portland Brewing Haystack Black Porter
