user_num_places_rated,user_num_following,user_url,beer_num_ratings,user_num_friends,user_num_breweries_rated,review_palate_score,review_taste_score,user_num_ratings,review_ratings_blob,review_aroma_score,user_num_countries_rated,user_id,review_avg_score,beer_global_style_score,beer_weighted_avg_score,beer_brewer_name,review_overall_score,user_location,review_appearance_score,beer_num_calories,beer_style,beer_url,review_blob,beer_global_score,user_name,beer_location,beer_ABV,beer_name
1,0,http://www.ratebeer.com/user/83397/beer-ratings/,35,0,5,4,8,6,4.3 AROMA 9/10 APPEARANCE 5/5 TASTE 8/10 PALATE 4/5 OVERALL 17/20LordofTime25(6),9,1,83397,4.3,44.532,3.297009,Great River Brewery,17," Whittemore, Iowa",5,210,India Pale Ale (IPA),http://www.ratebeer.com/beer/great-river-big-cock-ipa/136214/83397/,"Dank, citrusy, floral goodness in a glass! Sweetness to it that makes you want more!!  ",69.257,LordofTime25,Iowa,7%,Great River Big Cock IPA
1,0,http://www.ratebeer.com/user/83397/beer-ratings/,245,0,5,3,4,6,3.3 AROMA 8/10 APPEARANCE 5/5 TASTE 4/10 PALATE 3/5 OVERALL 13/20LordofTime25(6),8,1,83397,3.3,94.159,3.828111,Goose Island Beer Company (AB-InBev),13," Whittemore, Iowa",5,245,Sour/Wild Ale,http://www.ratebeer.com/beer/goose-island-halia/224078/83397/,"Mild tartness/sour to it. Little or no peach. Which is weird since they use 12,000 lbs of peaches supposedly. Not worth the sticker price in my opinion. There are a lot better examples of this style for less money.  ",98.62,LordofTime25,Illinois,7.5%,Goose Island Halia 
1,0,http://www.ratebeer.com/user/83397/beer-ratings/,98,0,5,4,8,6,3.9 AROMA 7/10 APPEARANCE 4/5 TASTE 8/10 PALATE 4/5 OVERALL 16/20LordofTime25(6),7,1,83397,3.9,67.803,3.322188,Great River Brewery,16," Whittemore, Iowa",4,162,American Pale Ale,http://www.ratebeer.com/beer/great-river-483-pale-ale/101672/83397/,Tasty pale ale that pour to a redish tint. Good flavor with a burst of a citrus maybe grapefruit?  ,71.45,LordofTime25,Iowa,5.4%,Great River 483 Pale Ale
1,0,http://www.ratebeer.com/user/83397/beer-ratings/,1629,0,5,5,9,6,4.5 AROMA 9/10 APPEARANCE 5/5 TASTE 9/10 PALATE 5/5 OVERALL 17/20LordofTime25(6),9,1,83397,4.5,99.206,3.849366,Cigar City Brewing,17," Whittemore, Iowa",5,1629,India Pale Ale (IPA),http://www.ratebeer.com/beer/cigar-city-jai-alai-india-pale-ale/95103/83397/,Very drinkable IPA. Sweetness & bitterness in a near perfect balance. Definitely a go to IPA!  ,98.833,LordofTime25,Florida,7.5%,Cigar City Jai Alai India Pale Ale
1,0,http://www.ratebeer.com/user/83397/beer-ratings/,190,0,5,5,8,6,4.1 AROMA 7/10 APPEARANCE 5/5 TASTE 8/10 PALATE 5/5 OVERALL 16/20LordofTime25(6),7,1,83397,4.1,44.655,3.249589,Empyrean Brewing Company,16," Whittemore, Iowa",5,190,Porter,http://www.ratebeer.com/beer/empyrean-dark-side-vanilla-porter/10368/83397/,Tasty creamy vanilla porter that is smooth in your mouth as it goes down. Definitely recommend it! ,61.189,LordofTime25,Nebraska,5.7%,Empyrean Dark Side Vanilla Porter
1,0,http://www.ratebeer.com/user/83397/beer-ratings/,11,0,5,4,8,6,3.1 AROMA 7/10 APPEARANCE 4/5 TASTE 8/10 PALATE 4/5 OVERALL 8/20LordofTime25(6),7,1,83397,3.1,90.031,3.350991,August Schell Brewing Company,8," Whittemore, Iowa",4,,Traditional Ale,http://www.ratebeer.com/beer/schell-anniversary-series-3--bavarian-forest-dampfbier/90362/83397/,A good dark beer flavor with a light beer drinkablitity! I tried it and drank it the rest of the night! ,86.176,LordofTime25,Minnesota,,Schell Anniversary Series #3 - Bavarian Forest Dampfbier
