user_num_places_rated,user_num_following,user_url,beer_num_ratings,user_num_friends,user_num_breweries_rated,review_palate_score,review_taste_score,user_num_ratings,review_ratings_blob,review_aroma_score,user_num_countries_rated,user_id,review_avg_score,beer_global_style_score,beer_weighted_avg_score,beer_brewer_name,review_overall_score,user_location,review_appearance_score,beer_num_calories,beer_style,beer_url,review_blob,beer_global_score,user_name,beer_location,beer_ABV,beer_name
0,0,http://www.ratebeer.com/user/852/beer-ratings/,1240,0,61,3,6,173,2.9 AROMA 5/10 APPEARANCE 3/5 TASTE 6/10 PALATE 3/5 OVERALL 12/20dirtyc(173),5,17,852,2.9,91.988,3.91585,Great Lakes Brewing (Ohio),12," Erie, Pennsylvania",3,1240,Imperial Stout,http://www.ratebeer.com/beer/great-lakes-blackout-stout/30896/852/,"I have been enjoying this hoppy imperial stout.. I look forward to cracking one open after a long night of work, put my feet up, and watch the late night shows.. a bit high in ABV with 9% but still enjoy to the last drop ",99.312,dirtyc,Ohio,9%,Great Lakes Blackout Stout
0,0,http://www.ratebeer.com/user/852/beer-ratings/,1773,0,61,3,5,173,3.3 AROMA 7/10 APPEARANCE 4/5 TASTE 5/10 PALATE 3/5 OVERALL 14/20dirtyc(173),7,17,852,3.3,99.736,3.869712,Great Lakes Brewing (Ohio),14," Erie, Pennsylvania",4,1773,Porter,http://www.ratebeer.com/beer/great-lakes-edmund-fitzgerald-porter/1226/852/,"Can taste the coffee and chocolate, a nice roasty porter... I am a big fan of Great Lakes.. never met a Great Lakes that I didnt like ",98.993,dirtyc,Ohio,5.8%,Great Lakes Edmund Fitzgerald Porter
0,0,http://www.ratebeer.com/user/852/beer-ratings/,896,0,61,2,6,173,2.3 AROMA 4/10 APPEARANCE 3/5 TASTE 6/10 PALATE 2/5 OVERALL 8/20dirtyc(173),4,17,852,2.3,44.408,2.683078,Abita Brewing Company,8," Erie, Pennsylvania",3,896,Amber Lager/Vienna,http://www.ratebeer.com/beer/abita-amber-lager/2/852/,This one has a nice amber color through the glass.. slight caramel flavor with a white head.  Nothing too special here to report on ,17.268,dirtyc,Louisiana,4.5%,Abita Amber Lager
0,0,http://www.ratebeer.com/user/852/beer-ratings/,1307,0,61,3,6,173,3 AROMA 7/10 APPEARANCE 3/5 TASTE 6/10 PALATE 3/5 OVERALL 11/20dirtyc(173),7,17,852,3,26.557,2.583875,Abita Brewing Company,11," Erie, Pennsylvania",3,1307,Fruit Beer,http://www.ratebeer.com/beer/abita-purple-haze/8/852/,A good raspberry wheat beer... I would only drink one of these however... very fruity with a faded purple color to it.  Enjoyable wheat beer ,14.132,dirtyc,Louisiana,4.75%,Abita Purple Haze
0,0,http://www.ratebeer.com/user/852/beer-ratings/,188,0,61,2,6,173,2.6 AROMA 5/10 APPEARANCE 4/5 TASTE 6/10 PALATE 2/5 OVERALL 9/20dirtyc(173),5,17,852,2.6,53.82,3.077264,Palmetto Brewing Company,9," Erie, Pennsylvania",4,188,Amber Ale,http://www.ratebeer.com/beer/palmetto-amber-ale/8557/852/,An appealing amber appearance... not so hot on the initial taste... but after a few sips... this amber ale becomes soothing.  Good size head that lasts after the pour ,43.524,dirtyc,South Carolina,5.3%,Palmetto Amber Ale
0,0,http://www.ratebeer.com/user/852/beer-ratings/,2375,0,61,3,5,173,2.8 AROMA 5/10 APPEARANCE 3/5 TASTE 5/10 PALATE 3/5 OVERALL 12/20dirtyc(173),5,17,852,2.8,94.958,3.583831,Sierra Nevada Brewing Company,12," Erie, Pennsylvania",3,2375,Porter,http://www.ratebeer.com/beer/sierra-nevada-porter/366/852/,"This is only the second style of Sierra Nevada that I have had.. but I did enjoy this porter... with a roasted barley and rich, smooth flavor ",93.134,dirtyc,California,5.6%,Sierra Nevada Porter
0,0,http://www.ratebeer.com/user/852/beer-ratings/,2482,0,61,4,6,173,3 AROMA 5/10 APPEARANCE 3/5 TASTE 6/10 PALATE 4/5 OVERALL 12/20dirtyc(173),5,17,852,3,97.096,3.639701,Victory Brewing Company (ABV),12," Erie, Pennsylvania",3,2482,Abbey Tripel,http://www.ratebeer.com/beer/victory-golden-monkey/630/852/,Another decent beer from Victory Brewing.. subtle aroma and flavor.. golden in color ,95.079,dirtyc,Pennsylvania,9.5%,Victory Golden Monkey
0,0,http://www.ratebeer.com/user/852/beer-ratings/,12,0,61,3,6,173,3 AROMA 6/10 APPEARANCE 2/5 TASTE 6/10 PALATE 3/5 OVERALL 13/20dirtyc(173),6,17,852,3,63.1,3.09,Old Savannah Brewing Company,13," Erie, Pennsylvania",2,,English Pale Ale,http://www.ratebeer.com/beer/savannah-pale-ale/55578/852/,A great dark pale ale... no head on the pour.. chocolate malt with a very dark amber in color ,51.7,dirtyc,Georgia,,Savannah Pale Ale
0,0,http://www.ratebeer.com/user/852/beer-ratings/,18,0,61,2,5,173,2.6 AROMA 5/10 APPEARANCE 2/5 TASTE 5/10 PALATE 2/5 OVERALL 12/20dirtyc(173),5,17,852,2.6,42.126,2.704432,Liberty Brewery & Grill - Myrtle Beach,12," Erie, Pennsylvania",2,150,Wheat Ale,http://www.ratebeer.com/beer/liberty-myrtle-beach-unfiltered-wheat/36923/852/,This light ale has a great taste when served with a lemon wedge. A hazy yellow appearance with a nice head. I enjoyed this wheat and will have it again for sure. ,27.247,dirtyc,South Carolina,5%,Liberty Myrtle Beach Unfiltered Wheat
0,0,http://www.ratebeer.com/user/852/beer-ratings/,15,0,61,3,5,173,2.9 AROMA 6/10 APPEARANCE 3/5 TASTE 5/10 PALATE 3/5 OVERALL 12/20dirtyc(173),6,17,852,2.9,49.046,2.745035,Liberty Brewery & Grill - Myrtle Beach,12," Erie, Pennsylvania",3,,Fruit Beer,http://www.ratebeer.com/beer/liberty-myrtle-beach-raspberry-wheat/37064/852/,"Im trying to drink all of the Liberty brews, the raspberry wheat is one of my favorite.  A nice berry aroma, with a subtle berry taste but not too overwhelming which is what I liked. ",25.145,dirtyc,South Carolina,,Liberty Myrtle Beach Raspberry Wheat
0,0,http://www.ratebeer.com/user/852/beer-ratings/,2285,0,61,3,5,173,2.9 AROMA 6/10 APPEARANCE 3/5 TASTE 5/10 PALATE 3/5 OVERALL 12/20dirtyc(173),6,17,852,2.9,47.041,2.937099,Boston Beer Company,12," Erie, Pennsylvania",3,2285,Wheat Ale,http://www.ratebeer.com/beer/samuel-adams-summer-ale/171/852/,"I enjoyed this summer ale, always a big fan of a summer brew. nice crisp refreshing taste with a hint of citrusy aroma and taste. ",33.193,dirtyc,Massachusetts,5.3%,Samuel Adams Summer Ale
0,0,http://www.ratebeer.com/user/852/beer-ratings/,31,0,61,2,6,173,2.8 AROMA 6/10 APPEARANCE 3/5 TASTE 6/10 PALATE 2/5 OVERALL 11/20dirtyc(173),6,17,852,2.8,35.639,2.985263,Liberty Brewery & Grill - Myrtle Beach,11," Erie, Pennsylvania",3,135,Brown Ale,http://www.ratebeer.com/beer/liberty-myrtle-beach-nut-brown-ale/36925/852/,"A great dark ale, chocolate malt taste, very smooth and full bodied, would get this again for sure ",38.866,dirtyc,South Carolina,4.5%,Liberty Myrtle Beach Nut Brown Ale
0,0,http://www.ratebeer.com/user/852/beer-ratings/,26,0,61,2,5,173,2.6 AROMA 5/10 APPEARANCE 3/5 TASTE 5/10 PALATE 2/5 OVERALL 11/20dirtyc(173),5,17,852,2.6,23.079,2.79479,Liberty Brewery & Grill - Myrtle Beach,11," Erie, Pennsylvania",3,150,Irish Ale,http://www.ratebeer.com/beer/liberty-myrtle-beach-rockets-red-ale/36927/852/,"Nice dark red ale, trying to try all the Liberty beers, one of the best ales that I have had ",24.425,dirtyc,South Carolina,5%,Liberty Myrtle Beach Rockets Red Ale
0,0,http://www.ratebeer.com/user/852/beer-ratings/,33,0,61,2,4,173,2.1 AROMA 4/10 APPEARANCE 3/5 TASTE 4/10 PALATE 2/5 OVERALL 8/20dirtyc(173),4,17,852,2.1,22.831,1.839167,Beijing Yanjing Brewery Co.,8," Erie, Pennsylvania",3,165,Pale Lager,http://www.ratebeer.com/beer/yanjing-12-premium-extra/12062/852/,"Just randomly chose this beer from Beijing off of the shelf... nothing too special here, just your typical pale lager...  ",1.912,dirtyc,China,5.5%,Yanjing 12 Premium Extra  
0,0,http://www.ratebeer.com/user/852/beer-ratings/,480,0,61,3,5,173,2.5 AROMA 4/10 APPEARANCE 3/5 TASTE 5/10 PALATE 3/5 OVERALL 10/20dirtyc(173),4,17,852,2.5,94.034,3.370936,Michigan Brewing Company,10," Erie, Pennsylvania",3,480,Witbier,http://www.ratebeer.com/beer/celis-white/16684/852/,A nice belgian-style wheat beer... a hazy yellow in appearance... soft aromas and a good beer from Michigan Brewing ,77.589,dirtyc,Michigan,4.25%,Celis White
0,0,http://www.ratebeer.com/user/852/beer-ratings/,448,0,61,3,6,173,2.6 AROMA 4/10 APPEARANCE 3/5 TASTE 6/10 PALATE 3/5 OVERALL 10/20dirtyc(173),4,17,852,2.6,93.908,3.532567,Victory Brewing Company (ABV),10," Erie, Pennsylvania",3,448,Doppelbock,http://www.ratebeer.com/beer/victory-st-victorious-doppelbock/625/852/,"very deep ruby color.... light dark head. nice dark appearance, this is the first doppelbock that i have had..... not too shabby ",92.195,dirtyc,Pennsylvania,7.9%,Victory St. Victorious Doppelbock
0,0,http://www.ratebeer.com/user/852/beer-ratings/,2374,0,61,2,4,173,2.3 AROMA 5/10 APPEARANCE 3/5 TASTE 4/10 PALATE 2/5 OVERALL 9/20dirtyc(173),5,17,852,2.3,99.577,3.581656,Victory Brewing Company (ABV),9," Erie, Pennsylvania",3,2374,Pilsener,http://www.ratebeer.com/beer/victory-prima-pils/619/852/,"cloudy yellow brew...... decent pilsner, very smooth... light head. Hoppy aroma ",93.068,dirtyc,Pennsylvania,5.3%,Victory Prima Pils
0,0,http://www.ratebeer.com/user/852/beer-ratings/,646,0,61,3,6,173,2.7 AROMA 5/10 APPEARANCE 3/5 TASTE 6/10 PALATE 3/5 OVERALL 10/20dirtyc(173),5,17,852,2.7,93.781,3.252719,Tregs Brewing Company,10," Erie, Pennsylvania",3,646,Pilsener,http://www.ratebeer.com/beer/troegs-sunshine-pils/14050/852/,"This one is very hoppy, crisp sunshine taste to it... great german style pilsner to relax to ",61.33,dirtyc,Pennsylvania,4.7%,Tregs Sunshine Pils
0,0,http://www.ratebeer.com/user/852/beer-ratings/,3643,0,61,3,6,173,3 AROMA 7/10 APPEARANCE 3/5 TASTE 6/10 PALATE 3/5 OVERALL 11/20dirtyc(173),7,17,852,3,92.67,3.259444,Plzensky Prazdroj (SABMiller),11," Erie, Pennsylvania",3,3643,Czech Pilsner (Svtl),http://www.ratebeer.com/beer/pilsner-urquell/717/852/,"Nice golden appearance, crisp taste, soothing aftertaste all the way through the bottle ",62.177,dirtyc,Czech Republic,4.4%,Pilsner Urquell 
0,0,http://www.ratebeer.com/user/852/beer-ratings/,70,0,61,2,4,173,2.1 AROMA 4/10 APPEARANCE 2/5 TASTE 4/10 PALATE 2/5 OVERALL 9/20dirtyc(173),4,17,852,2.1,89.803,2.473849,Pittsburgh Brewing Company,9," Erie, Pennsylvania",2,129,Pale Lager,http://www.ratebeer.com/beer/pittsburgh-augustiner-lager/7629/852/,"Nothing too special with this Pittsburgh brew... golden amber color, lighter flavor ",15.508,dirtyc,Pennsylvania,4.3%,Pittsburgh Augustiner Lager
0,0,http://www.ratebeer.com/user/852/beer-ratings/,3163,0,61,2,5,173,2.3 AROMA 5/10 APPEARANCE 2/5 TASTE 5/10 PALATE 2/5 OVERALL 9/20dirtyc(173),5,17,852,2.3,98.459,3.779557,Victory Brewing Company (ABV),9," Erie, Pennsylvania",2,3163,India Pale Ale (IPA),http://www.ratebeer.com/beer/victory-hopdevil/618/852/,"Subtle spice aroma, copper with tan head that likes to hang around,  I actually liked this one.. it is always nice to support the local Pennsylvanian breweries ",98.082,dirtyc,Pennsylvania,6.7%,Victory HopDevil
0,0,http://www.ratebeer.com/user/852/beer-ratings/,40,0,61,2,7,173,2.2 AROMA 2/10 APPEARANCE 1/5 TASTE 7/10 PALATE 2/5 OVERALL 10/20dirtyc(173),2,17,852,2.2,88.3,3.14,Red Bell Brewery & Pub,10," Erie, Pennsylvania",1,144,Amber Lager/Vienna,http://www.ratebeer.com/beer/red-bell-philadelphia-original-lager/7320/852/,"cloudy amber appearance, aroma wasnt the best... after the first sip, this lager does get better however, very smooth.... just wanted to try something new ",60.3,dirtyc,Pennsylvania,4.8%,Red Bell Philadelphia Original Lager
0,0,http://www.ratebeer.com/user/852/beer-ratings/,418,0,61,3,7,173,3.2 AROMA 7/10 APPEARANCE 3/5 TASTE 7/10 PALATE 3/5 OVERALL 12/20dirtyc(173),7,17,852,3.2,74.786,3.119024,Atlantic Brewing Company,12," Erie, Pennsylvania",3,418,Fruit Beer,http://www.ratebeer.com/beer/atlantic-bar-harbor-blueberry-ale/7228/852/,"Tasteful blueberry ale, strong aroma with subtle blueberry flavor, just the right amount ",46.873,dirtyc,Maine,5.2%,Atlantic Bar Harbor Blueberry Ale
0,0,http://www.ratebeer.com/user/852/beer-ratings/,1129,0,61,3,6,173,2.7 AROMA 6/10 APPEARANCE 3/5 TASTE 6/10 PALATE 3/5 OVERALL 9/20dirtyc(173),6,17,852,2.7,86.353,3.240803,Charles Wells,9," Erie, Pennsylvania",3,1129,Premium Bitter/ESB,http://www.ratebeer.com/beer/wells-bombardier-glorious-english-bottle/4463/852/,"Had this in a pint bottle, enjoyed it very much, hint of hops but balanced very well as you drink ",59.335,dirtyc,England,4.7%,Wells Bombardier Glorious English (Bottle)
0,0,http://www.ratebeer.com/user/852/beer-ratings/,646,0,61,3,5,173,2.7 AROMA 6/10 APPEARANCE 3/5 TASTE 5/10 PALATE 3/5 OVERALL 10/20dirtyc(173),6,17,852,2.7,91.638,3.328054,Great Lakes Brewing (Ohio),10," Erie, Pennsylvania",3,646,Witbier,http://www.ratebeer.com/beer/great-lakes-holy-moses-white-ale/1228/852/,"Very flavorful with hint of fruit and spice together, another great one from Great Lakes, gotta hand it to Cleveland ",72.207,dirtyc,Ohio,5.4%,Great Lakes Holy Moses White Ale
0,0,http://www.ratebeer.com/user/852/beer-ratings/,892,0,61,3,6,173,2.7 AROMA 5/10 APPEARANCE 3/5 TASTE 6/10 PALATE 3/5 OVERALL 10/20dirtyc(173),5,17,852,2.7,70.426,3.458514,Southern Tier Brewing Company (ABV),10," Erie, Pennsylvania",3,892,Old Ale,http://www.ratebeer.com/beer/southern-tier-old-man-winter-ale/28797/852/,"Very nice ale to sit back during the winter and sip on this one, very relaxing and warming, happy with this winter ale ",86.087,dirtyc,New York,7.2%,Southern Tier Old Man Winter Ale
0,0,http://www.ratebeer.com/user/852/beer-ratings/,321,0,61,3,5,173,2.5 AROMA 5/10 APPEARANCE 2/5 TASTE 5/10 PALATE 3/5 OVERALL 10/20dirtyc(173),5,17,852,2.5,46.021,3.193018,Southern Tier Brewing Company (ABV),10," Erie, Pennsylvania",2,321,Abbey Tripel,http://www.ratebeer.com/beer/southern-tier-tripel/40410/852/,"I couldnt beleive how strong this one was with 9% alcohol volume, a few of these and you are feeling it... nice belgian style beer ",62.599,dirtyc,New York,9%,Southern Tier Tripel
0,0,http://www.ratebeer.com/user/852/beer-ratings/,1029,0,61,2,7,173,2.8 AROMA 5/10 APPEARANCE 3/5 TASTE 7/10 PALATE 2/5 OVERALL 11/20dirtyc(173),5,17,852,2.8,48.244,3.225757,Southern Tier Brewing Company (ABV),11," Erie, Pennsylvania",3,1029,American Pale Ale,http://www.ratebeer.com/beer/southern-tier-pmx-phin-matts-extraordinary-ale/40485/852/,"I loved this one by Southern Tier, the aroma and taste was extraordinary, phin and matt did a great job on this one! ",58.761,dirtyc,New York,5.7%,Southern Tier PMX (Phin & Matts Extraordinary Ale)
0,0,http://www.ratebeer.com/user/852/beer-ratings/,1470,0,61,2,5,173,2.7 AROMA 7/10 APPEARANCE 3/5 TASTE 5/10 PALATE 2/5 OVERALL 10/20dirtyc(173),7,17,852,2.7,91.709,3.604224,Southern Tier Brewing Company (ABV),10," Erie, Pennsylvania",3,1470,India Pale Ale (IPA),http://www.ratebeer.com/beer/southern-tier-ipa/23004/852/,"This is a great IPA, i really enjoy this style, very aromatic of hops, very fresh taste ",93.908,dirtyc,New York,7.3%,Southern Tier IPA
0,0,http://www.ratebeer.com/user/852/beer-ratings/,502,0,61,3,6,173,2.5 AROMA 3/10 APPEARANCE 3/5 TASTE 6/10 PALATE 3/5 OVERALL 10/20dirtyc(173),3,17,852,2.5,14.684,2.60885,Brauerei Beck & Co./Becks (InBev),10," Erie, Pennsylvania",3,502,Dunkel/Tmav,http://www.ratebeer.com/beer/st-pauli-girl-special-dark/732/852/,"I havent had St. Pauli Girl Lager yet, but I enjoyed this nice dark lager, smooth flow and satisfying taste, I enjoy having a dark beer during the winter months, so of course, I enjoyed this ",14.546,dirtyc,Germany,4.8%,St. Pauli Girl Special Dark
0,0,http://www.ratebeer.com/user/852/beer-ratings/,1015,0,61,2,4,173,2.2 AROMA 6/10 APPEARANCE 2/5 TASTE 4/10 PALATE 2/5 OVERALL 8/20dirtyc(173),6,17,852,2.2,96.136,3.509909,Great Lakes Brewing (Ohio),8," Erie, Pennsylvania",2,1015,Spice/Herb/Vegetable,http://www.ratebeer.com/beer/great-lakes-christmas-ale/4492/852/,"Another beer that I wasnt too sure about with the spice and ginger flavor, but yet I wasnt appalled by it either, Great Lakes puts out a huge variety, and I am always willing to try a new one ",89.495,dirtyc,Ohio,7.5%,Great Lakes Christmas Ale
0,0,http://www.ratebeer.com/user/852/beer-ratings/,2265,0,61,3,6,173,2.9 AROMA 6/10 APPEARANCE 3/5 TASTE 6/10 PALATE 3/5 OVERALL 11/20dirtyc(173),6,17,852,2.9,77.589,3.131884,Erdinger Weissbru,11," Erie, Pennsylvania",3,2265,German Hefeweizen,http://www.ratebeer.com/beer/erdinger-weissbier-hefe-weizen/2468/852/,"I really enjoy Erdinger, dont have the chance to drink it all too often, nice golden appearance, enjoyable aroma and taste ",46.985,dirtyc,Germany,5.3%,Erdinger Weissbier (Hefe-Weizen)
0,0,http://www.ratebeer.com/user/852/beer-ratings/,1014,0,61,2,6,173,2.6 AROMA 4/10 APPEARANCE 3/5 TASTE 6/10 PALATE 2/5 OVERALL 11/20dirtyc(173),4,17,852,2.6,11.33,2.953613,Yuengling Brewery,11," Erie, Pennsylvania",3,1014,Porter,http://www.ratebeer.com/beer/yuengling-original-black-and-tan/887/852/,"A dark brew from Pottsville, didnt entirely enjoy the palate, but one of those beers that gets better as you drink, a nice porter to relax to in the winter, cant talk trash on this because of my love for Yuengling ",34.441,dirtyc,Pennsylvania,5.2%,Yuengling Original Black and Tan
0,0,http://www.ratebeer.com/user/852/beer-ratings/,348,0,61,2,4,173,2.2 AROMA 5/10 APPEARANCE 2/5 TASTE 4/10 PALATE 2/5 OVERALL 9/20dirtyc(173),5,17,852,2.2,1.912,2.390662,Anheuser-Busch InBev,9," Erie, Pennsylvania",2,348,Oktoberfest/Mrzen,http://www.ratebeer.com/beer/michelob-marzen/10937/852/,"Nice dark amber appearance, soothing taste, but nothing too special here, had this out of an ale and lager variety pack, aroma is pleasing ",11.047,dirtyc,Missouri,4.9%,Michelob Marzen
0,0,http://www.ratebeer.com/user/852/beer-ratings/,525,0,61,1,4,173,1.7 AROMA 4/10 APPEARANCE 2/5 TASTE 4/10 PALATE 1/5 OVERALL 6/20dirtyc(173),4,17,852,1.7,21.829,2.651677,Anheuser-Busch InBev,6," Erie, Pennsylvania",2,525,Spice/Herb/Vegetable,http://www.ratebeer.com/beer/jacks-pumpkin-spice-ale/51770/852/,"Well, knowing that this had some spice to it, I wasnt too enthused, but I wanted to try it anyway, the initial taste I didnt like, but then after the first couple sips it got better, dark appearance, aroma of pumpkin and spice ",17.803,dirtyc,Missouri,5.5%,Jacks Pumpkin Spice Ale
0,0,http://www.ratebeer.com/user/852/beer-ratings/,191,0,61,2,4,173,2.5 AROMA 6/10 APPEARANCE 3/5 TASTE 4/10 PALATE 2/5 OVERALL 10/20dirtyc(173),6,17,852,2.5,71.576,2.262925,Straub Brewery,10," Erie, Pennsylvania",3,191,Pale Lager,http://www.ratebeer.com/beer/straub-american-lager/8159/852/,"I didnt enjoy the initial taste, but then it grew on me after a few more sips... i would say it is worth the money, it is overall a good wheat beer ",7.462,dirtyc,Pennsylvania,4.33%,Straub American Lager
0,0,http://www.ratebeer.com/user/852/beer-ratings/,2654,0,61,4,6,173,3.1 AROMA 6/10 APPEARANCE 3/5 TASTE 6/10 PALATE 4/5 OVERALL 12/20dirtyc(173),6,17,852,3.1,91.988,3.232411,Boston Beer Company,12," Erie, Pennsylvania",3,2654,Oktoberfest/Mrzen,http://www.ratebeer.com/beer/samuel-adams-octoberfest/167/852/,"This is a great fall beer, perfect for the season, golden appearance, can pick up on the sweet flavors ",58.761,dirtyc,Massachusetts,5.3%,Samuel Adams Octoberfest
0,0,http://www.ratebeer.com/user/852/beer-ratings/,870,0,61,2,2,173,1.5 AROMA 3/10 APPEARANCE 3/5 TASTE 2/10 PALATE 2/5 OVERALL 5/20dirtyc(173),3,17,852,1.5,2.353,1.401265,Anheuser-Busch InBev,5," Erie, Pennsylvania",3,870,Pale Lager,http://www.ratebeer.com/beer/budweiser-select/40957/852/,"UPDATED: SEP 23, 2005",0.147,dirtyc,Missouri,4.3%,Budweiser Select
0,0,http://www.ratebeer.com/user/852/beer-ratings/,41,0,61,1,1,173,0.8 AROMA 1/10 APPEARANCE 1/5 TASTE 1/10 PALATE 1/5 OVERALL 4/20dirtyc(173),1,17,852,0.8,28.93,1.718902,City Brewery (La Crosse Plant),4," Erie, Pennsylvania",1,246,Malt Liquor,http://www.ratebeer.com/beer/lucky-number-high-gravity-lager/24165/852/,"Had this in the can, the only good that can come out of this beer is its high alcohol content, taste is horrible, aroma even worse ",1.03,dirtyc,Wisconsin,8.2%,Lucky Number High Gravity Lager
0,0,http://www.ratebeer.com/user/852/beer-ratings/,56,0,61,2,1,173,1.1 AROMA 2/10 APPEARANCE 2/5 TASTE 1/10 PALATE 2/5 OVERALL 4/20dirtyc(173),2,17,852,1.1,24.906,1.848477,Pittsburgh Brewing Company,4," Erie, Pennsylvania",2,126,Pale Lager,http://www.ratebeer.com/beer/old-german-premium-lager/7630/852/,"Bought a couple of forties of Old German... well what can you really say about this one, its CHEAP, that is about it ",1.765,dirtyc,Pennsylvania,4.2%,Old German Premium Lager
0,0,http://www.ratebeer.com/user/852/beer-ratings/,663,0,61,3,6,173,2.7 AROMA 5/10 APPEARANCE 3/5 TASTE 6/10 PALATE 3/5 OVERALL 10/20dirtyc(173),5,17,852,2.7,35.549,2.734803,Brouwerij Huyghe,10," Erie, Pennsylvania",3,663,Fruit Beer,http://www.ratebeer.com/beer/van-diest-fruli-strawberry-beer/24970/852/,"We have this on tap at work, to tell you the truth, you dont feel like your drinking a beer, it is however, refreshing, strong strawberry taste and goes down smooth, this is fine to have one pint but no more than that ",19.518,dirtyc,Belgium,4.1%,Van Diest Frli Strawberry Beer
0,0,http://www.ratebeer.com/user/852/beer-ratings/,1218,0,61,2,4,173,2.1 AROMA 4/10 APPEARANCE 3/5 TASTE 4/10 PALATE 2/5 OVERALL 8/20dirtyc(173),4,17,852,2.1,88.706,2.488944,ywiec (ywiec Group/Heineken),8," Erie, Pennsylvania",3,1218,Pale Lager,http://www.ratebeer.com/beer/379ywiec-jasne-pe322ne--beer/6558/852/,"Had this one in Windsor, first Polish beer that I think I have had, nothing outstanding but overall appealling, should have bought another to get a true sense for it ",11.189,dirtyc,Poland,5.6%,ywiec Jasne Pene / Beer
0,0,http://www.ratebeer.com/user/852/beer-ratings/,140,0,61,2,5,173,2.4 AROMA 5/10 APPEARANCE 3/5 TASTE 5/10 PALATE 2/5 OVERALL 9/20dirtyc(173),5,17,852,2.4,20.812,2.623362,Bulmers Cider (Heineken UK),9," Erie, Pennsylvania",3,140,Cider,http://www.ratebeer.com/beer/scrumpy-jack/3002/852/,"A nice cider, yellowish gold colour, overall a decent cider, sweet taste, plus... you have to love the name of it ",16.053,dirtyc,England,6%,Scrumpy Jack
0,0,http://www.ratebeer.com/user/852/beer-ratings/,263,0,61,3,4,173,2.2 AROMA 5/10 APPEARANCE 2/5 TASTE 4/10 PALATE 3/5 OVERALL 8/20dirtyc(173),5,17,852,2.2,78.819,3.186943,Westons Cider,8," Erie, Pennsylvania",2,263,Cider,http://www.ratebeer.com/beer/westons-old-rosie-scrumpy/14005/852/,"This cider has a cloudy appearance, very tasty, now that I have been trying a lot of ciders, I am getting an idea of what is a good cider and what is not ",51.324,dirtyc,England,7.3%,Westons Old Rosie Scrumpy
0,0,http://www.ratebeer.com/user/852/beer-ratings/,3150,0,61,3,5,173,2.2 AROMA 3/10 APPEARANCE 3/5 TASTE 5/10 PALATE 3/5 OVERALL 8/20dirtyc(173),3,17,852,2.2,89.879,3.373366,InBev Belgium,8," Erie, Pennsylvania",3,3150,Belgian Ale,http://www.ratebeer.com/beer/leffe-blonde/2514/852/,"I finally tried Leffe, blond beer with a dark appearance, I agree that it is a connoisseur beer, most people probably would not enjoy but I did ",77.815,dirtyc,Belgium,6.6%,Leffe Blonde
0,0,http://www.ratebeer.com/user/852/beer-ratings/,90,0,61,3,6,173,2.4 AROMA 5/10 APPEARANCE 3/5 TASTE 6/10 PALATE 3/5 OVERALL 7/20dirtyc(173),5,17,852,2.4,73.203,3.166872,Greene King,7," Erie, Pennsylvania",3,156,Premium Bitter/ESB,http://www.ratebeer.com/beer/morland-old-speckled-hen-cask--52/47776/852/,"Pours a dark amber, the bartender convinced me to try this, enjoyable bitter, but nothing stands out in this one ",49.046,dirtyc,England,5.2%,Morland Old Speckled Hen (Cask - 5.2%)
0,0,http://www.ratebeer.com/user/852/beer-ratings/,44,0,61,3,3,173,2.2 AROMA 5/10 APPEARANCE 2/5 TASTE 3/10 PALATE 3/5 OVERALL 9/20dirtyc(173),5,17,852,2.2,36.789,2.793623,Magners GB / Shepton Mallet Cider Mill (C&C; Group),9," Erie, Pennsylvania",2,156,Cider,http://www.ratebeer.com/beer/addlestones-cask-conditioned-draught-cider/38418/852/,"I thought this was a decent cider, had this at The Setting Sun Pub, a cloudy appearance, had a different bite to it compared to other ciders I have had ",26.903,dirtyc,England,5.2%,Addlestones Cask Conditioned Draught Cider
0,0,http://www.ratebeer.com/user/852/beer-ratings/,145,0,61,2,5,173,2.3 AROMA 5/10 APPEARANCE 3/5 TASTE 5/10 PALATE 2/5 OVERALL 8/20dirtyc(173),5,17,852,2.3,24.906,2.703495,Westons Cider,8," Erie, Pennsylvania",3,145,Cider,http://www.ratebeer.com/beer/westons-stowford-press-medium-dry-cider/4734/852/,"Doesnt beat Westons Organic Cider, but is tasty, a medium dry cider, quenches your thirst, sweet aroma , nice appearance ",18.335,dirtyc,England,4.5%,Westons Stowford Press Medium Dry Cider
0,0,http://www.ratebeer.com/user/852/beer-ratings/,169,0,61,3,6,173,2.8 AROMA 5/10 APPEARANCE 3/5 TASTE 6/10 PALATE 3/5 OVERALL 11/20dirtyc(173),5,17,852,2.8,48.244,2.987131,Westons Cider,11," Erie, Pennsylvania",3,169,Cider,http://www.ratebeer.com/beer/westons-wyld-wood-classic-cider/159235/852/,"I really enjoyed this cider, 6.5% alcohol which is incredible, it only takes a couple of these to feel pretty good, I was impressed by this, a bit expensive, but worth the money for sure ",38.464,dirtyc,England,6.5%,Westons Wyld Wood Classic Cider
0,0,http://www.ratebeer.com/user/852/beer-ratings/,879,0,61,2,4,173,1.9 AROMA 3/10 APPEARANCE 3/5 TASTE 4/10 PALATE 2/5 OVERALL 7/20dirtyc(173),3,17,852,1.9,12.599,2.459059,Bulmers Cider (Heineken UK),7," Erie, Pennsylvania",3,879,Cider,http://www.ratebeer.com/beer/strongbow-cider/3001/852/,"A decent cider, saw commercials all over the tv and they have it on tap everywhere, your typical cider, nothing special here ",10.905,dirtyc,England,5%,Strongbow Cider
