user_num_places_rated,user_num_following,user_url,beer_num_ratings,user_num_friends,user_num_breweries_rated,review_palate_score,review_taste_score,user_num_ratings,review_ratings_blob,review_aroma_score,user_num_countries_rated,user_id,review_avg_score,beer_global_style_score,beer_weighted_avg_score,beer_brewer_name,review_overall_score,user_location,review_appearance_score,beer_num_calories,beer_style,beer_url,review_blob,beer_global_score,user_name,beer_location,beer_ABV,beer_name
24,0,http://www.ratebeer.com/user/85632/beer-ratings/,4,2,931,4,7,2709,3.6 AROMA 7/10 APPEARANCE 3/5 TASTE 7/10 PALATE 4/5 OVERALL 15/20planky84(2709),7,34,85632,3.6,,2.974475,Borough (Neath) Brewery,15," Greater London, England                         ",3,162,Porter,http://www.ratebeer.com/beer/borough-neath-pithead-porter/384110/85632/," Cask at the 2016 NWAF, The Roundhouse, Derby. Dark brown pour with a beige head. Aromas of cocoa, coffee, dark chocolate and a hint of blackcurrant. Flavours of woodsmoke, chocolate and dark roast coffee. Tasty.  ",,planky84,Wales,5.4%,Borough (Neath) Pithead Porter
24,0,http://www.ratebeer.com/user/85632/beer-ratings/,11,2,931,4,7,2709,3.6 AROMA 7/10 APPEARANCE 3/5 TASTE 7/10 PALATE 4/5 OVERALL 15/20planky84(2709),7,34,85632,3.6,38.138,3.532691,Brass Castle,15," Greater London, England                         ",3,249,Imperial Stout,http://www.ratebeer.com/beer/brass-castle-annexation/290949/85632/,"Cask at the 2016 NWAF, The Roundhouse, Derby. Black pour with a tan head. Chocolate raisin, black treacle aroma with a splash of coffee and vanilla. Flavours of licorice, quite a heavy coffee presence, burnt sugar. Boozy mouthfeel. Warm alcohol down the gullet. Nice . ",90.923,planky84,England,8.3%,Brass Castle Annexation
24,0,http://www.ratebeer.com/user/85632/beer-ratings/,3,2,931,3,7,2709,3.2 AROMA 6/10 APPEARANCE 3/5 TASTE 7/10 PALATE 3/5 OVERALL 13/20planky84(2709),6,34,85632,3.2,,3.149508,Georges / Hop Monster,13," Greater London, England                         ",3,132,Smoked,http://www.ratebeer.com/beer/hop-monster-rochford-banshee/188711/85632/," Cask at the 2016 NWAF, The Roundhouse, Derby. Dark brown pour with a beige head. Chocolate and licorice toffee aroma. Licorice and chocolate flavour. Not bad.  ",,planky84,England,4.4%,Hop Monster Rochford Banshee
24,0,http://www.ratebeer.com/user/85632/beer-ratings/,9,2,931,3,7,2709,3.2 AROMA 7/10 APPEARANCE 3/5 TASTE 7/10 PALATE 3/5 OVERALL 12/20planky84(2709),7,34,85632,3.2,,3.40164,Fernandes (Ossett),12," Greater London, England                         ",3,153,Porter,http://www.ratebeer.com/beer/fernandes-black-voodoo/231995/85632/," Cask at NWAF 2016, The Roundhouse, Derby. Dark brown pour with a beige head. Heavy nose of chocolate orange, splash of vanilla in there. Orange chocolate flavour. Sweet finish. If Terrys chocolates made beer... ",,planky84,England,5.1%,Fernandes Black Voodoo
24,0,http://www.ratebeer.com/user/85632/beer-ratings/,4,2,931,3,7,2709,3.4 AROMA 7/10 APPEARANCE 3/5 TASTE 7/10 PALATE 3/5 OVERALL 14/20planky84(2709),7,34,85632,3.4,,3.026355,Abbeydale,14," Greater London, England                         ",3,156,Porter,http://www.ratebeer.com/beer/abbeydale-mem-in-black/399704/85632/," Cask at NWAF 2016, The Roundhouse, Derby. Mahogany pour with a beige head. Orchard fruit and toffee aroma. Plum jam, blackberry and toffee flavour. Tasty.  ",,planky84,England,5.2%,Abbeydale Mem in Black
24,0,http://www.ratebeer.com/user/85632/beer-ratings/,119,2,931,4,8,2709,3.8 AROMA 7/10 APPEARANCE 4/5 TASTE 8/10 PALATE 4/5 OVERALL 15/20planky84(2709),7,34,85632,3.8,53.233,3.597369,Odell Brewing Company,15," Greater London, England                         ",4,119,Imperial Porter,http://www.ratebeer.com/beer/odell-fernet-aged-porter/175738/85632/,"Bottle from Beermoth, Manchester. Black pour with a dark beige head. Vanilla, dark fruit, chocolate, sweet spice aroma
 Smooth flavours of warm spice, cocoa, pepper, coffee. Warm alcohol linger. Good stuff. ",93.653,planky84,Colorado,9.8%,Odell Fernet-Aged Porter
24,0,http://www.ratebeer.com/user/85632/beer-ratings/,374,2,931,4,7,2709,3.5 AROMA 6/10 APPEARANCE 3/5 TASTE 7/10 PALATE 4/5 OVERALL 15/20planky84(2709),6,34,85632,3.5,92.263,3.543478,Dark Horse Brewing Company,15," Greater London, England                         ",3,374,Porter,http://www.ratebeer.com/beer/dark-horse-thirsty-trout-porter/10328/85632/," Bottle fro Beermoth, Manchester. Dark brown pour with a beige head. Raisin, licorice and chocolate aroma. Flavours of smoke, dark berries, chocolate and toffee. Dry finish. ",91.355,planky84,Michigan,7%,Dark Horse Thirsty Trout Porter
24,0,http://www.ratebeer.com/user/85632/beer-ratings/,899,2,931,4,7,2709,3.7 AROMA 8/10 APPEARANCE 3/5 TASTE 7/10 PALATE 4/5 OVERALL 15/20planky84(2709),8,34,85632,3.7,98.673,3.756484,Dark Horse Brewing Company,15," Greater London, England                         ",3,899,Smoked,http://www.ratebeer.com/beer/dark-horse-fore-smoked-stout/19266/85632/," Bottle. Black pour with a beige head. Aromas of licorice, burnt sugar, toffee. Flavours of raisin, coffee, smoke,. Very smooth.  ",97.756,planky84,Michigan,7%,Dark Horse Fore Smoked Stout
24,0,http://www.ratebeer.com/user/85632/beer-ratings/,872,2,931,4,7,2709,3.8 AROMA 8/10 APPEARANCE 3/5 TASTE 7/10 PALATE 4/5 OVERALL 16/20planky84(2709),8,34,85632,3.8,94.222,3.635733,Dark Horse Brewing Company,16," Greater London, England                         ",3,872,Scotch Ale,http://www.ratebeer.com/beer/dark-horse-scotty-karate-scotch-ale/55494/85632/," Bottle from Beermoth, Manchester. Brown pour with a whispy white head. Toffee apple, caramel, Orchard fruit. More of the same in the flavour. Warm alcohol down the gullet. Good brew. ",94.958,planky84,Michigan,9.75%,Dark Horse Scotty Karate Scotch Ale
